McGuinness,,John-McGuinness.D.1997-06-26,John,Fianna_Fáil,,2024-11-29,Fianna Fáil,34th Dáil,house,34,dail,,2025-01-29 00:00:00+00:00,Joint Committee on Remit Oversight,Parliamentary Regulation and Reform,Live - Primary,,2025-02-12 00:00:00+00:00,Live,,2025-05-21 00:00:00+00:00,Standing,,2024-11-29 00:00:00+00:00,Committee on Parliamentary Privileges and Oversight (Dáil Éireann),Parliamentary Regulation and Reform,Live - Primary,,2024-12-18 00:00:00+00:00,Live,,2025-05-21 00:00:00+00:00,Standing,,2025-01-29 00:00:00+00:00,Committee on Remit Oversight (Dáil Éireann),Parliamentary Regulation and Reform,Live - Primary,,2024-12-18 00:00:00+00:00,Live,,2025-05-21 00:00:00+00:00,Standing,,2024-11-29,Carlow-Kilkenny,Carlow-Kilkenny,John McGuinness,,,,,,,,,,,,,,,,,,,,,,,,,,,,,,,,,,,,,,,,,,,,,,,,,,,,,,,,,,,,,,,,,,,,,,,,,,,,,,,,,,,,,,,,,,,,,,,,,,,,Leas-Cheann Comhairle,,2025-02-19,,,,,,,,,,,,,,,,,,,,,,,,,,,,,,,,,,,,,,,,,,,,,,,,,,,,,,,,,,,,,,,,,,,,,,,,,false,1997
Mitchell,,Denise-Mitchell.D.2016-10-03,Denise,Sinn_Féin,,2024-11-29,Sinn Féin,34th Dáil,house,34,dail,,2025-01-29 00:00:00+00:00,Joint Committee on Remit Oversight,Parliamentary Regulation and Reform,Live - Primary,,2025-02-12 00:00:00+00:00,Live,,2025-05-21 00:00:00+00:00,Standing,,2024-11-29 00:00:00+00:00,Committee on Standing Orders and Dáil Reform,Parliamentary Regulation and Reform,Live - Primary,,2024-12-18 00:00:00+00:00,Live,,2025-01-24 00:00:00+00:00,Standing,,2024-11-29 00:00:00+00:00,Committee on Parliamentary Privileges and Oversight (Dáil Éireann),Parliamentary Regulation and Reform,Live - Primary,,2024-12-18 00:00:00+00:00,Live,,2025-05-21 00:00:00+00:00,Standing,,2024-11-29,Dublin-Bay-North,Dublin Bay North,Denise Mitchell,,,,,,,,2025-01-29 00:00:00+00:00,Committee on Remit Oversight (Dáil Éireann),Parliamentary Regulation and Reform,Live - Primary,,2024-12-18 00:00:00+00:00,Live,,2025-05-21 00:00:00+00:00,Standing,,,,,,,,,,,,,,,,,,,,,,,,,,,,,,,,,,,,,,,,,,,,,,,,,,,,,,,,,,,,,,,,,,,,,,,,,,,,,,,,,,,,,,,,,,,,,,,,,,,,,,,,,,,,,,,,,,,,,,,,,,,,,,,,,,,,,,,,,,,,,,,,,,,,,,,,,,,,,,false,2016
Moran,,Kevin-Boxer-Moran.D.2016-10-03,Kevin Boxer,Independent,,2024-11-29,Independent,34th Dáil,house,34,dail,,,,,,,,,,,,,,,,,,,,,,,,,,,,,,,,,,,2024-11-29,Longford-Westmeath,Longford-Westmeath,Kevin Boxer Moran,,,,,,,,,,,,,,,,,,,,,,,,,,,,,,,,,,,,,,,,,,,,,,,,,,,,,,,,,,,,,,,,,,,,,,,,,,,,,,,,,,,,,,,,,,,,,,,,,,,,"Minister of State at the Department of Public Expenditure, Infrastructure, Public Service Reform and Digitalisation",,2025-06-05,"Minister of State at the Department of Public Expenditure, National Development Plan Delivery and Reform",2025-06-04,2025-01-29,,,,,,,,,,,,,,,,,,,,,,,,,,,,,,,,,,,,,,,,,,,,,,,,,,,,,,,,,,,,,,,,,,,,,,true,2016
Moynihan,,Aindrias-Moynihan.D.2016-10-03,Aindrias,Fianna_Fáil,,2024-11-29,Fianna Fáil,34th Dáil,house,34,dail,,2025-05-01 00:00:00+00:00,"Joint Committee on Finance, Public Expenditure, Public Service Reform and Digitalisation, and Taoiseach",Shadow Department,Live - Primary,,2025-05-07 00:00:00+00:00,Live,2026-01-20 00:00:00+00:00,2025-05-07 00:00:00+00:00,Sessional,,2025-01-29 00:00:00+00:00,Working Group of Committee Cathaoirligh,The Committee System and Parliamentary Administration,Live - Primary,,2025-02-12 00:00:00+00:00,Live,,2025-05-07 00:00:00+00:00,Standing,,2025-05-01 00:00:00+00:00,Joint Committee on Agriculture and Food,Shadow Department,Live - Primary,,2025-05-07 00:00:00+00:00,Live,,2025-05-07 00:00:00+00:00,Sessional,,2024-11-29,Cork-North-West,Cork North-West,Aindrias Moynihan,,,,,2025-05-07 00:00:00+00:00,Cathaoirleach,,2025-05-01 00:00:00+00:00,Select Committee on Agriculture and Food,Shadow Department,Live - Primary,,2025-04-30 00:00:00+00:00,Live,,2025-05-07 00:00:00+00:00,Sessional,,,,,,,,2024-11-29 00:00:00+00:00,Committee on Budgetary Oversight,Oversight,Live - Primary,,2024-12-18 00:00:00+00:00,Live,,2026-01-20 00:00:00+00:00,Standing,,2025-05-01 00:00:00+00:00,"Select Committee on Finance, Public Expenditure, Public Service Reform and Digitalisation, and Taoiseach",Shadow Department,Live - Primary,,2025-04-30 00:00:00+00:00,Live,2026-01-20 00:00:00+00:00,2025-05-07 00:00:00+00:00,Sessional,,2025-01-21 16:29:34.896666+00:00,Select Committee on Subsidiarity (European Union Legislative Scrutiny),Shadow Department,Dissolved,2025-05-07 00:00:00+00:00,2025-01-23 00:00:00+00:00,Dissolved,2025-05-07 00:00:00+00:00,2025-02-13 00:00:00+00:00,Standing transitional,,,,,,,,,,,,,,,,2025-05-07 00:00:00+00:00,Cathaoirleach,,,,,,,,,,,,,,,,,,,,,,,,,,,,,,,,,,,,,,,,,,,,,,,,,,,,,,,,,,,,,,,,,,,,,,,,,,,,,,,,,,,,,,,,,,,,,,,,,,,,,,false,2016
Moynihan,,Michael-Moynihan.D.1997-06-26,Michael,Fianna_Fáil,,2024-11-29,Fianna Fáil,34th Dáil,house,34,dail,,,,,,,,,,,,,,,,,,,,,,,,,,,,,,,,,,,2024-11-29,Cork-North-West,Cork North-West,Michael Moynihan,,,,,,,,,,,,,,,,,,,,,,,,,,,,,,,,,,,,,,,,,,,,,,,,,,,,,,,,,,,,,,,,,,,,,,,,,,,,,,,,,,,,,,,,,,,,,,,,,,,,Minister of State at the Department of Education and Youth,,2025-05-02,Minister of State at the Department of Education,2025-05-01,2025-01-29,,,,,,,,,,,,,,,,,,,,,,,,,,,,,,,,,,,,,,,,,,,,,,,,,,,,,,,,,,,,,,,,,,,,,,true,1997
Moynihan,,Shane-Moynihan.D.2024-11-29,Shane,Fianna_Fáil,,2024-11-29,Fianna Fáil,34th Dáil,house,34,dail,,2025-01-29 00:00:00+00:00,"Comhchoiste na Gaeilge, na Gaeltachta agus Phobal Labhartha na Gaeilge",Policy,Live - Primary,,2025-02-12 00:00:00+00:00,Live,,2025-05-07 00:00:00+00:00,Standing,,2025-05-01 00:00:00+00:00,Joint Committee on Transport,Shadow Department,Live - Primary,,2025-05-13 00:00:00+00:00,Live,,2025-05-07 00:00:00+00:00,Sessional,,2025-05-01 00:00:00+00:00,Joint Committee on the Implementation of the Good Friday Agreement ,Shadow Department,Live - Primary,,2025-05-12 00:00:00+00:00,Live,,2025-05-07 00:00:00+00:00,Sessional,,2024-11-29,Dublin-Mid-West,Dublin Mid-West,Shane Moynihan,,,,,,,,2025-01-29 00:00:00+00:00,"Roghchoiste na Gaeilge, na Gaeltachta agus Phobal Labhartha na Gaeilge",Policy,Live - Primary,,2025-02-12 00:00:00+00:00,Live,,2025-05-07 00:00:00+00:00,Standing,,,,,,,,2025-05-01 00:00:00+00:00,Select Committee on Transport,Shadow Department,Live - Primary,,2025-04-30 00:00:00+00:00,Live,,2025-05-07 00:00:00+00:00,Sessional,,2025-05-01 00:00:00+00:00,Select Committee on the Implementation of the Good Friday Agreement ,Shadow Department,Live - Primary,,2025-04-30 00:00:00+00:00,Live,,2025-05-07 00:00:00+00:00,Sessional,,,,,,,,,,,,,,,,,,,,,,,,2025-05-28 00:00:00+00:00,Leas-Chathaoirleach,,,,,,,,,,,,,,,,,,,,,,,,,,,,,,,,,,,,,2025-05-28 00:00:00+00:00,Leas-Chathaoirleach,,,,,,,,,,,,,,,,,,,,,,,,,,,,,,,,,,,,,,,,,,,,,,,,,,,,,,,,,,,,,,,,,,,false,2024
Murnane O'Connor,,Jennifer-Murnane-O'Connor.S.2016-04-25,Jennifer,Fianna_Fáil,,2024-11-29,Fianna Fáil,34th Dáil,house,34,dail,,,,,,,,,,,,,,,,,,,,,,,,,,,,,,,,,,,2024-11-29,Carlow-Kilkenny,Carlow-Kilkenny,Jennifer Murnane O'Connor,,,,,,,,,,,,,,,,,,,,,,,,,,,,,,,,,,,,,,,,,,,,,,,,,,,,,,,,,,,,,,,,,,,,,,,,,,,,,,,,,,,,,,,,,,,,,,,,,,,,Minister of State at the Department of Health,,2025-01-29,,,,,,,,,,,,,,,,,,,,,,,,,,,,,,,,,,,,,,,,,,,,,,,,,,,,,,,,,,,,,,,,,,,,,,,,,true,2016
Murphy,,Michael-Murphy.D.2024-11-29,Michael,Fine_Gael,,2024-11-29,Fine Gael,34th Dáil,house,34,dail,,2025-01-29 00:00:00+00:00,Working Group of Committee Cathaoirligh,The Committee System and Parliamentary Administration,Live - Primary,,2025-02-12 00:00:00+00:00,Live,,2025-05-07 00:00:00+00:00,Standing,,2025-05-01 00:00:00+00:00,Joint Committee on Transport,Shadow Department,Live - Primary,,2025-05-13 00:00:00+00:00,Live,,2025-05-07 00:00:00+00:00,Sessional,,2025-01-29 00:00:00+00:00,Joint Committee on Public Petitions and the Ombudsmen,Oversight,Live - Primary,,2025-02-12 00:00:00+00:00,Live,2026-05-26 00:00:00+00:00,2025-05-07 00:00:00+00:00,Standing,,2024-11-29,Tipperary-South,Tipperary South,Michael Murphy,,,,,,,,2025-05-01 00:00:00+00:00,Joint Committee on European Union Affairs,Shadow Department,Live - Primary,,2025-05-13 00:00:00+00:00,Live,,2025-05-07 00:00:00+00:00,Sessional,,,,,,,,2025-05-01 00:00:00+00:00,Select Committee on Transport,Shadow Department,Live - Primary,,2025-04-30 00:00:00+00:00,Live,,2025-05-07 00:00:00+00:00,Sessional,,2025-01-29 00:00:00+00:00,Select Committee on Public Petitions and the Ombudsmen,Oversight,Live - Primary,,2025-02-12 00:00:00+00:00,Live,2026-05-26 00:00:00+00:00,2025-05-07 00:00:00+00:00,Standing,,2025-01-21 16:29:34.896666+00:00,Select Committee on Subsidiarity (European Union Legislative Scrutiny),Shadow Department,Dissolved,2025-05-07 00:00:00+00:00,2025-01-23 00:00:00+00:00,Dissolved,2025-05-07 00:00:00+00:00,2025-02-13 00:00:00+00:00,Standing transitional,,2025-05-01 00:00:00+00:00,Select Committee on European Union Affairs,Shadow Department,Live - Primary,,2025-04-30 00:00:00+00:00,Live,,2025-05-07 00:00:00+00:00,Sessional,,2025-05-07 00:00:00+00:00,Cathaoirleach,,,,,,,,,,,,,,,,,,,,,,,,,,,,,,,,,,,,,2025-05-07 00:00:00+00:00,Cathaoirleach,,,,,,,,,,,,,,,,,,,,,,,,,,,,,,,,,,,,,,,,,,,,,,,,,,,,,,,,,,,,,,,,,,,false,2024
Murphy,,Paul-Murphy.D.2014-10-10,Paul,People_Before_Profit_Solidarity,,2024-11-29,People Before Profit-Solidarity,34th Dáil,house,34,dail,,2025-05-01 00:00:00+00:00,"Joint Committee on Further and Higher Education, Research, Innovation and Science",Shadow Department,Live - Primary,,2025-05-13 00:00:00+00:00,Live,2026-02-05 00:00:00+00:00,2025-05-07 00:00:00+00:00,Sessional,,2025-05-01 00:00:00+00:00,Joint Committee on Artificial Intelligence,Policy,Live - Primary,,2025-05-12 00:00:00+00:00,Live,,2025-05-07 00:00:00+00:00,Special,,2025-05-01 00:00:00+00:00,"Select Committee on Further and Higher Education, Research, Innovation and Science",Shadow Department,Live - Primary,,2025-04-30 00:00:00+00:00,Live,2026-02-05 00:00:00+00:00,2025-05-07 00:00:00+00:00,Sessional,,2024-11-29,Dublin-South-West,Dublin South-West,Paul Murphy,,,,,,,,2025-05-01 00:00:00+00:00,Select Committee on Artificial Intelligence,Policy,Live - Primary,,2025-04-30 00:00:00+00:00,Live,,2025-05-07 00:00:00+00:00,Special,,,,,,,,2024-11-29 00:00:00+00:00,Committee on Standing Orders and Dáil Reform,Parliamentary Regulation and Reform,Live - Primary,,2024-12-18 00:00:00+00:00,Live,,2025-01-24 00:00:00+00:00,Standing,,2024-11-29 00:00:00+00:00,Committee of Public Accounts,Oversight,Live - Primary,,2024-12-18 00:00:00+00:00,Live,,2025-11-26 00:00:00+00:00,Standing,,2025-01-21 16:29:34.896666+00:00,Select Committee on Subsidiarity (European Union Legislative Scrutiny),Shadow Department,Dissolved,2025-05-07 00:00:00+00:00,2025-01-23 00:00:00+00:00,Dissolved,2025-05-07 00:00:00+00:00,2025-02-13 00:00:00+00:00,Standing transitional,,,,,,,,,,,,,,,,,,,,,,,,,,,,,,,,,,,,,,,,,,,,,,,,,,,,,,,,,,,,,,,,,,,,,,,,,,,,,,,,,,,,,,,,,,,,,,,,,,,,,,,,,,,,,,,,,,,,,,,false,2014
Murphy,,Verona-Murphy.D.2020-02-08,Verona,Independent,,2024-11-29,Independent,34th Dáil,house,34,dail,,2025-01-29 00:00:00+00:00,Working Group of Committee Cathaoirligh,The Committee System and Parliamentary Administration,Live - Primary,,2025-02-12 00:00:00+00:00,Live,2025-02-13 00:00:00+00:00,2024-12-18 00:00:00+00:00,Standing,,2025-01-29 00:00:00+00:00,Joint Committee on Remit Oversight,Parliamentary Regulation and Reform,Live - Primary,,2025-02-12 00:00:00+00:00,Live,,2024-12-18 00:00:00+00:00,Standing,,2024-11-29 00:00:00+00:00,Committee on Parliamentary Privileges and Oversight (Dáil Éireann),Parliamentary Regulation and Reform,Live - Primary,,2024-12-18 00:00:00+00:00,Live,,2024-12-18 00:00:00+00:00,Standing,,2024-11-29,Wexford,Wexford,Verona Murphy,,,,,2024-12-18 00:00:00+00:00,Cathaoirleach,,2024-11-29 00:00:00+00:00,Business Committee (Dáil Éireann),Parliamentary Business and Committee Membership,Live - Primary,,2024-12-18 00:00:00+00:00,Live,,2024-12-18 00:00:00+00:00,Standing,,,,,,,,2025-01-29 00:00:00+00:00,Committee on Remit Oversight (Dáil Éireann),Parliamentary Regulation and Reform,Live - Primary,,2024-12-18 00:00:00+00:00,Live,,2024-12-18 00:00:00+00:00,Standing,,2024-11-29 00:00:00+00:00,Committee of Selection (Dáil Éireann),Parliamentary Business and Committee Membership,Live - Primary,,2024-12-18 00:00:00+00:00,Live,,2024-12-18 00:00:00+00:00,Standing,,2024-11-29 00:00:00+00:00,Committee on Standing Orders and Dáil Reform,Parliamentary Regulation and Reform,Live - Primary,,2024-12-18 00:00:00+00:00,Live,,2024-12-18 00:00:00+00:00,Standing,,,,,,,,,,,,,2024-12-18 00:00:00+00:00,Cathaoirleach,,2024-12-18 00:00:00+00:00,Cathaoirleach,,2024-12-18 00:00:00+00:00,Cathaoirleach,,,,,,,,,,,,,,,,,,,,,,,,Ceann Comhairle,,2024-12-18,,,,,2024-12-18 00:00:00+00:00,Cathaoirleach,,2024-12-18 00:00:00+00:00,Cathaoirleach,,,,,,,,,,,,,,,,,,,,,,,,,,,,,,,,,,,,,,,,,,,,,,,,,,,,,,,,,,,,,,,,false,2020
Mythen,,Johnny-Mythen.D.2020-02-08,Johnny,Sinn_Féin,,2024-11-29,Sinn Féin,34th Dáil,house,34,dail,,2025-05-01 00:00:00+00:00,Joint Committee on Artificial Intelligence,Policy,Live - Primary,,2025-05-12 00:00:00+00:00,Live,,2025-05-07 00:00:00+00:00,Special,,2025-05-01 00:00:00+00:00,Select Committee on Artificial Intelligence,Policy,Live - Primary,,2025-04-30 00:00:00+00:00,Live,,2025-05-07 00:00:00+00:00,Special,,,,,,,,,,,,,2024-11-29,Wexford,Wexford,Johnny Mythen,,,,,,,,,,,,,,,,,,,,,,,,,,,,,,,,,,,,,,,,,,,,,,,,,,,,,,,,,,,,,,,,,,,,,,,,,,,,,,,,,,,,,,,,,,,,,,,,,,,,,,,,,,,,,,,,,,,,,,,,,,,,,,,,,,,,,,,,,,,,,,,,,,,,,,,,,,,,,,,,,,,,,,,,,,,,,,,false,2020
Nash,,Gerald-Nash.D.2011-03-09,Ged,Labour_Party,,2024-11-29,Labour Party,34th Dáil,house,34,dail,,2025-05-01 00:00:00+00:00,"Joint Committee on Finance, Public Expenditure, Public Service Reform and Digitalisation, and Taoiseach",Shadow Department,Live - Primary,,2025-05-07 00:00:00+00:00,Live,,2025-05-07 00:00:00+00:00,Sessional,,2025-01-29 00:00:00+00:00,Joint Committee on Remit Oversight,Parliamentary Regulation and Reform,Live - Primary,,2025-02-12 00:00:00+00:00,Live,,2025-05-21 00:00:00+00:00,Standing,,2025-05-01 00:00:00+00:00,"Select Committee on Finance, Public Expenditure, Public Service Reform and Digitalisation, and Taoiseach",Shadow Department,Live - Primary,,2025-04-30 00:00:00+00:00,Live,,2025-05-07 00:00:00+00:00,Sessional,,2024-11-29,Louth,Louth,Ged Nash,,,,,,,,2024-11-29 00:00:00+00:00,Committee on Parliamentary Privileges and Oversight (Dáil Éireann),Parliamentary Regulation and Reform,Live - Primary,,2024-12-18 00:00:00+00:00,Live,,2025-05-21 00:00:00+00:00,Standing,,,,,,,,2024-11-29 00:00:00+00:00,Committee on Budgetary Oversight,Oversight,Live - Primary,,2024-12-18 00:00:00+00:00,Live,,2025-05-07 00:00:00+00:00,Standing,,2025-01-29 00:00:00+00:00,Committee on Remit Oversight (Dáil Éireann),Parliamentary Regulation and Reform,Live - Primary,,2024-12-18 00:00:00+00:00,Live,,2025-05-21 00:00:00+00:00,Standing,,,,,,,,,,,,,,,,,,,,,,,,,,,,,,,,,,,,,,,,,,,,,,,,,,,,,,,,,,,,,,,,,,,,,,,,,,,,,,,,,,,,,,,,,,,,,,,,,,,,,,,,,,,,,,,,,,,,,,,,,,,,,,,,,,false,2011
Naughton,,Hildegarde-Naughton.S.2013-07-19,Hildegarde,Fine_Gael,,2024-11-29,Fine Gael,34th Dáil,house,34,dail,,,,,,,,,,,,,,,,,,,,,,,,,,,,,,,,,,,2024-11-29,Galway-West,Galway West,Hildegarde Naughton,,,,,,,,,,,,,,,,,,,,,,,,,,,,,,,,,,,,,,,,,,,,,,,,,,,,,,,,,,,,,,,,,,,,,,,,,,,,,,,,,,,,,,,,,,,,,,,,,,,,"Minister of State at the Department of Children, Equality, Disability, Integration and Youth with responsibility for Disability",2025-05-01,2025-01-23,"Minister of State at the Department of Children, Disability and Equality",2025-11-18,2025-05-02,,,,,,,Minister for Education and Youth,,2025-11-18,,,,,,,,,,,,,,,,,,,,,,,,,,,,,,,,,,,,,,,,,,,,,,,,,,,,,,,,,,,,,true,2013
Neville,,Joe-Neville.D.2024-11-29,Joe,Fine_Gael,,2024-11-29,Fine Gael,34th Dáil,house,34,dail,,2025-05-01 00:00:00+00:00,Joint Committee on Infrastructure and National Development Plan Delivery,Shadow Department,Live - Primary,,2025-05-07 00:00:00+00:00,Live,,2025-05-07 00:00:00+00:00,Sessional,,2024-11-29 00:00:00+00:00,Committee on Budgetary Oversight,Oversight,Live - Primary,,2024-12-18 00:00:00+00:00,Live,,2025-05-07 00:00:00+00:00,Standing,,2024-11-29 00:00:00+00:00,Committee of Public Accounts,Oversight,Live - Primary,,2024-12-18 00:00:00+00:00,Live,,2025-05-07 00:00:00+00:00,Standing,,2024-11-29,Kildare-North,Kildare North,Joe Neville,,2025-05-28 00:00:00+00:00,Leas-Chathaoirleach,,,,,2025-05-01 00:00:00+00:00,Select Committee on Infrastructure and National Development Plan Delivery,Shadow Department,Live - Primary,,2025-04-30 00:00:00+00:00,Live,,2025-05-07 00:00:00+00:00,Sessional,,,,,,,,,,,,,,,,,,,,,,,,,,,,,,,,,,,,,,,,,,,,,,,,,,,,,,,2025-05-28 00:00:00+00:00,Leas-Chathaoirleach,,,,,,,,,,,,,,,,,,,,,,,,,,,,,,,,,,,,,,,,,,,,,,,,,,,,,,,,,,,,,,,,,,,,,,,,,,,,,,,,,,,,,,,,,,,,,,,,,,,,,,false,2024
Newsome Drennan,,Natasha-Newsome-Drennan.D.2024-11-29,Natasha,Sinn_Féin,,2024-11-29,Sinn Féin,34th Dáil,house,34,dail,,2025-05-01 00:00:00+00:00,Joint Committee on Agriculture and Food,Shadow Department,Live - Primary,,2025-05-07 00:00:00+00:00,Live,,2025-05-07 00:00:00+00:00,Sessional,,2025-05-01 00:00:00+00:00,Select Committee on Agriculture and Food,Shadow Department,Live - Primary,,2025-04-30 00:00:00+00:00,Live,,2025-05-07 00:00:00+00:00,Sessional,,,,,,,,,,,,,2024-11-29,Carlow-Kilkenny,Carlow-Kilkenny,Natasha Newsome Drennan,,,,,,,,,,,,,,,,,,,,,,,,,,,,,,,,,,,,,,,,,,,,,,,,,,,,,,,,,,,,,,,,,,,,,,,,,,,,,,,,,,,,,,,,,,,,,,,,,,,,,,,,,,,,,,,,,,,,,,,,,,,,,,,,,,,,,,,,,,,,,,,,,,,,,,,,,,,,,,,,,,,,,,,,,,,,,,,false,2024
Nolan,,Carol-Nolan.D.2016-10-03,Carol,Independent,,2024-11-29,Independent,34th Dáil,house,34,dail,,,,,,,,,,,,,,,,,,,,,,,,,,,,,,,,,,,2024-11-29,Offaly,Offaly,Carol Nolan,,,,,,,,,,,,,,,,,,,,,,,,,,,,,,,,,,,,,,,,,,,,,,,,,,,,,,,,,,,,,,,,,,,,,,,,,,,,,,,,,,,,,,,,,,,,,,,,,,,,,,,,,,,,,,,,,,,,,,,,,,,,,,,,,,,,,,,,,,,,,,,,,,,,,,,,,,,,,,,,,,,,,,,,,,,,,,,false,2016
Ní Raghallaigh,,Shónagh-Ní-Raghallaigh.D.2024-11-29,Shónagh,Sinn_Féin,,2024-11-29,Sinn Féin,34th Dáil,house,34,dail,,2025-01-29 00:00:00+00:00,"Comhchoiste na Gaeilge, na Gaeltachta agus Phobal Labhartha na Gaeilge",Policy,Live - Primary,,2025-02-12 00:00:00+00:00,Live,,2025-05-07 00:00:00+00:00,Standing,,2025-05-01 00:00:00+00:00,Joint Committee on Education and Youth,Shadow Department,Live - Primary,,2025-05-13 00:00:00+00:00,Live,,2025-05-07 00:00:00+00:00,Sessional,,2025-01-29 00:00:00+00:00,"Roghchoiste na Gaeilge, na Gaeltachta agus Phobal Labhartha na Gaeilge",Policy,Live - Primary,,2025-02-12 00:00:00+00:00,Live,,2025-05-07 00:00:00+00:00,Standing,,2024-11-29,Kildare-South,Kildare South,Shónagh Ní Raghallaigh,,,,,,,,2025-05-01 00:00:00+00:00,Select Committee on Education and Youth,Shadow Department,Live - Primary,,2025-04-30 00:00:00+00:00,Live,,2025-05-07 00:00:00+00:00,Sessional,,,,,,,,,,,,,,,,,,,,,,,,,,,,,,,,,,,,,,,,,,,,,,,,,,,,,,,,,,,,,,,,,,,,,,,,,,,,,,,,,,,,,,,,,,,,,,,,,,,,,,,,,,,,,,,,,,,,,,,,,,,,,,,,,,,,,,,,,,,,,,,,,,,,,,,,,,,,,,false,2024
O'Brien,,Darragh-O'Brien.D.2007-06-14,Darragh,Fianna_Fáil,,2024-11-29,Fianna Fáil,34th Dáil,house,34,dail,,,,,,,,,,,,,,,,,,,,,,,,,,,,,,,,,,,2024-11-29,Dublin-Fingal-East,Dublin Fingal East,Darragh O'Brien,,,,,,,,,,,,,,,,,,,,,,,,,,,,,,,,,,,,,,,,,,,,,,,,,,,,,,,,,,,,,,,,,,,,,,,,,,,,,,,,,,,,,,,,,,,,,,,,,,,,"Minister for Environment, Climate and Communications",2025-06-01,2025-01-23,"Minister for Climate, Energy and the Environment",,2025-06-02,,,,,,,Minister for Transport,,2025-06-02,Minister for Transport,2025-06-01,2025-01-23,,,,,,,,,,,,,,,,,,,,,,,,,,,,,,,,,,,,,,,,,,,,,,,,,,,,,,,,,,true,2007
O'Callaghan,,Cian-O'Callaghan.D.2020-02-08,Cian,Social_Democrats,,2024-11-29,Social Democrats,34th Dáil,house,34,dail,,2025-05-01 00:00:00+00:00,"Joint Committee on Finance, Public Expenditure, Public Service Reform and Digitalisation, and Taoiseach",Shadow Department,Live - Primary,,2025-05-07 00:00:00+00:00,Live,,2025-05-07 00:00:00+00:00,Sessional,,2024-11-29 00:00:00+00:00,Business Committee (Dáil Éireann),Parliamentary Business and Committee Membership,Live - Primary,,2024-12-18 00:00:00+00:00,Live,,2025-01-16 00:00:00+00:00,Standing,,2024-11-29 00:00:00+00:00,Committee on Standing Orders and Dáil Reform,Parliamentary Regulation and Reform,Live - Primary,,2024-12-18 00:00:00+00:00,Live,,2025-01-16 00:00:00+00:00,Standing,,2024-11-29,Dublin-Bay-North,Dublin Bay North,Cian O'Callaghan,,,,,,,,2024-11-29 00:00:00+00:00,Committee on Budgetary Oversight,Oversight,Live - Primary,,2024-12-18 00:00:00+00:00,Live,,2025-05-07 00:00:00+00:00,Standing,,,,,,,,2024-11-29 00:00:00+00:00,Committee of Selection (Dáil Éireann),Parliamentary Business and Committee Membership,Live - Primary,,2024-12-18 00:00:00+00:00,Live,,2025-01-16 00:00:00+00:00,Standing,,2025-05-01 00:00:00+00:00,"Select Committee on Finance, Public Expenditure, Public Service Reform and Digitalisation, and Taoiseach",Shadow Department,Live - Primary,,2025-04-30 00:00:00+00:00,Live,,2025-05-07 00:00:00+00:00,Sessional,,,,,,,,,,,,,,,,,,,,,,,,,,,,,,,,,,,,,,,,,,,,,,,,,,,,,,,,,,,,,,,,,,,,,,,,,,,,,,,,,,,,,,,,,,,,,,,,,,,,,,,,,,,,,,,,,,,,,,,,,,,,,,,,,,false,2020
O'Callaghan,,Jim-O'Callaghan.D.2016-10-03,Jim,Fianna_Fáil,,2024-11-29,Fianna Fáil,34th Dáil,house,34,dail,,,,,,,,,,,,,,,,,,,,,,,,,,,,,,,,,,,2024-11-29,Dublin-Bay-South,Dublin Bay South,Jim O'Callaghan,,,,,,,,,,,,,,,,,,,,,,,,,,,,,,,,,,,,,,,,,,,,,,,,,,,,,,,,,,,,,,,,,,,,,,,,,,,,,,,,,,,,,,,,,,,,,,,,,,,,Minister for Justice,2025-06-04,2025-01-23,"Minister for Justice, Home Affairs and Migration",,2025-06-05,,,,,,,,,,,,,,,,,,,,,,,,,,,,,,,,,,,,,,,,,,,,,,,,,,,,,,,,,,,,,,,,,,,,,,true,2016
O'Connell,,Maeve-O'Connell.D.2024-11-29,Maeve,Fine_Gael,,2024-11-29,Fine Gael,34th Dáil,house,34,dail,,2025-05-01 00:00:00+00:00,Joint Committee on Defence and National Security,Shadow Department,Live - Primary,,2025-05-13 00:00:00+00:00,Live,,2025-05-07 00:00:00+00:00,Sessional,,2025-05-01 00:00:00+00:00,"Joint Committee on Further and Higher Education, Research, Innovation and Science",Shadow Department,Live - Primary,,2025-05-13 00:00:00+00:00,Live,,2025-05-07 00:00:00+00:00,Sessional,,2025-01-29 00:00:00+00:00,Joint Committee on Public Petitions and the Ombudsmen,Oversight,Live - Primary,,2025-02-12 00:00:00+00:00,Live,,2026-05-26 00:00:00+00:00,Standing,,2024-11-29,Dublin-Rathdown,Dublin Rathdown,Maeve O'Connell,,,,,,,,2025-05-01 00:00:00+00:00,"Select Committee on Further and Higher Education, Research, Innovation and Science",Shadow Department,Live - Primary,,2025-04-30 00:00:00+00:00,Live,,2025-05-07 00:00:00+00:00,Sessional,,,,,,,,2025-01-29 00:00:00+00:00,Select Committee on Public Petitions and the Ombudsmen,Oversight,Live - Primary,,2025-02-12 00:00:00+00:00,Live,,2026-05-26 00:00:00+00:00,Standing,,2025-05-01 00:00:00+00:00,Select Committee on Defence and National Security,Shadow Department,Live - Primary,,2025-04-30 00:00:00+00:00,Live,,2025-05-07 00:00:00+00:00,Sessional,,,,,,,,,,,,,,,,,,,,,,,,2025-06-11 00:00:00+00:00,Leas-Chathaoirleach,,2025-06-11 00:00:00+00:00,Leas-Chathaoirleach,,,,,,,,,,,,,,,,,,,,,,,,,,,,,,,,,,,,,,,,,,,,,,,,,,,,,,,,,,,,,,,,,,,,,,,,,,,,,,,,,,,,,,,,,,,,,,,,,,,,,,false,2024
O'Connor,,James-O'Connor.D.2020-02-08,James,Fianna_Fáil,,2024-11-29,Fianna Fáil,34th Dáil,house,34,dail,,2025-05-01 00:00:00+00:00,Joint Committee on Artificial Intelligence,Policy,Live - Primary,,2025-05-12 00:00:00+00:00,Live,,2025-05-07 00:00:00+00:00,Special,,2025-05-01 00:00:00+00:00,Joint Committee on Drugs Use,Policy,Live - Primary,,2025-05-13 00:00:00+00:00,Live,,2025-05-07 00:00:00+00:00,Special,,2025-05-01 00:00:00+00:00,"Joint Committee on Enterprise, Tourism and Employment",Shadow Department,Live - Primary,,2025-05-13 00:00:00+00:00,Live,,2025-05-07 00:00:00+00:00,Sessional,,2024-11-29,Cork-East,Cork East,James O'Connor,,,,,2025-05-07 00:00:00+00:00,Cathaoirleach,,2025-01-29 00:00:00+00:00,Working Group of Committee Cathaoirligh,The Committee System and Parliamentary Administration,Live - Primary,,2025-02-12 00:00:00+00:00,Live,,2025-05-07 00:00:00+00:00,Standing,,,,,,,,2025-05-01 00:00:00+00:00,"Select Committee on Enterprise, Tourism and Employment",Shadow Department,Live - Primary,,2025-04-30 00:00:00+00:00,Live,,2025-05-07 00:00:00+00:00,Sessional,,2025-05-01 00:00:00+00:00,Select Committee on Artificial Intelligence,Policy,Live - Primary,,2025-04-30 00:00:00+00:00,Live,,2025-05-07 00:00:00+00:00,Special,,2025-05-01 00:00:00+00:00,Select Committee on Drugs Use,Policy,Live - Primary,,2025-04-30 00:00:00+00:00,Live,,2025-05-07 00:00:00+00:00,Special,,,,,,,,,,,,,,,,,,,,,,,,,,,,,,,,,,,,,,,,,,,,,,,,,,,2025-05-07 00:00:00+00:00,Cathaoirleach,,,,,,,,,,,,,,,,,,,,,,,,,,,,,,,,,,,,,,,,,,,,,,,,,,,,,,,,,,,,,,,,,,,false,2020
O'Dea,,Willie-O'Dea.D.1982-03-09,Willie,Fianna_Fáil,,2024-11-29,Fianna Fáil,34th Dáil,house,34,dail,,2025-05-01 00:00:00+00:00,"Joint Committee on Housing, Local Government and Heritage",Shadow Department,Live - Primary,,2025-05-07 00:00:00+00:00,Live,2025-06-18 00:00:00+00:00,2025-05-07 00:00:00+00:00,Sessional,,2025-05-01 00:00:00+00:00,Joint Committee on Drugs Use,Policy,Live - Primary,,2025-05-13 00:00:00+00:00,Live,,2025-05-07 00:00:00+00:00,Special,,2024-11-29 00:00:00+00:00,Committee on Members' Interests of Dáil Éireann,Statutory,Live - Primary,,2024-12-18 00:00:00+00:00,Live,,2025-05-07 00:00:00+00:00,Standing,,2024-11-29,Limerick-City,Limerick City,Willie O'Dea,,,,,,,,2025-05-01 00:00:00+00:00,"Select Committee on Housing, Local Government and Heritage",Shadow Department,Live - Primary,,2025-04-30 00:00:00+00:00,Live,2025-06-18 00:00:00+00:00,2025-05-07 00:00:00+00:00,Sessional,,,,,,,,2025-05-01 00:00:00+00:00,Select Committee on Drugs Use,Policy,Live - Primary,,2025-04-30 00:00:00+00:00,Live,,2025-05-07 00:00:00+00:00,Special,,,,,,,,,,,,,,,,,,,,,,,,,,,,,,,,,,,,,,,,,,,,,,,,,,,,,,,,,,,,,,,,,,,,,,,,,,,,,,,,,,,,,,,,,,,,,,,,,,,,,,,,,,,,,,,,,,,,,,,,,,,,,,,,,,,,,,,,,,,,,false,1982
