committee_1_expiry_type,committee_1_start_date,committee_1_end_date,committee_1_name_en,committee_1_name_start_date,committee_1_name_end_date,committee_1_type,committee_1_member_start_date,committee_1_member_end_date,committee_1_status,committee_1_main_status,committee_2_expiry_type,committee_2_start_date,committee_2_end_date,committee_2_name_en,committee_2_name_start_date,committee_2_name_end_date,committee_2_type,committee_2_member_start_date,committee_2_member_end_date,committee_2_status,committee_2_main_status,committee_3_expiry_type,committee_3_start_date,committee_3_end_date,committee_3_name_en,committee_3_name_start_date,committee_3_name_end_date,committee_3_type,committee_3_member_start_date,committee_3_member_end_date,committee_3_status,committee_3_main_status,party,party_code,party_start_date,party_end_date,constituency_code,constituency_name,dail_term,dail_code,dail_chamber_type,dail_number,membership_start_date,membership_end_date,first_name,unique_member_code,last_name,date_of_death,full_name,committee_1_role_title,committee_1_role_start_date,committee_1_role_end_date,committee_3_role_title,committee_3_role_start_date,committee_3_role_end_date,committee_4_expiry_type,committee_4_start_date,committee_4_end_date,committee_4_name_en,committee_4_name_start_date,committee_4_name_end_date,committee_4_type,committee_4_member_start_date,committee_4_member_end_date,committee_4_status,committee_4_main_status,office_1_name,office_1_start_date,office_1_end_date,committee_1_alt_name_en,committee_1_alt_name_start_date,committee_1_alt_name_end_date,committee_4_alt_name_en,committee_4_alt_name_start_date,committee_4_alt_name_end_date,committee_5_expiry_type,committee_5_start_date,committee_5_end_date,committee_5_name_en,committee_5_name_start_date,committee_5_name_end_date,committee_5_type,committee_5_member_start_date,committee_5_member_end_date,committee_5_status,committee_5_main_status,committee_6_expiry_type,committee_6_start_date,committee_6_end_date,committee_6_name_en,committee_6_name_start_date,committee_6_name_end_date,committee_6_type,committee_6_member_start_date,committee_6_member_end_date,committee_6_status,committee_6_main_status,committee_7_expiry_type,committee_7_start_date,committee_7_end_date,committee_7_name_en,committee_7_name_start_date,committee_7_name_end_date,committee_7_type,committee_7_member_start_date,committee_7_member_end_date,committee_7_status,committee_7_main_status,committee_8_expiry_type,committee_8_start_date,committee_8_end_date,committee_8_name_en,committee_8_name_start_date,committee_8_name_end_date,committee_8_type,committee_8_member_start_date,committee_8_member_end_date,committee_8_status,committee_8_main_status,committee_2_role_title,committee_2_role_start_date,committee_2_role_end_date,committee_4_role_title,committee_4_role_start_date,committee_4_role_end_date,committee_7_role_title,committee_7_role_start_date,committee_7_role_end_date,committee_9_expiry_type,committee_9_start_date,committee_9_end_date,committee_9_name_en,committee_9_name_start_date,committee_9_name_end_date,committee_9_type,committee_9_member_start_date,committee_9_member_end_date,committee_9_status,committee_9_main_status,committee_10_expiry_type,committee_10_start_date,committee_10_end_date,committee_10_name_en,committee_10_name_start_date,committee_10_name_end_date,committee_10_type,committee_10_member_start_date,committee_10_member_end_date,committee_10_status,committee_10_role_title,committee_10_main_status,office_2_name,office_2_start_date,office_2_end_date,committee_5_role_title,committee_5_role_start_date,committee_5_role_end_date,committee_6_role_title,committee_6_role_start_date,committee_6_role_end_date,office_3_name,office_3_start_date,office_3_end_date,office_4_name,office_4_start_date,office_4_end_date,committee_2_alt_name_en,committee_2_alt_name_start_date,committee_2_alt_name_end_date,committee_8_alt_name_en,committee_8_alt_name_start_date,committee_8_alt_name_end_date,committee_11_expiry_type,committee_11_start_date,committee_11_end_date,committee_11_name_en,committee_11_name_start_date,committee_11_name_end_date,committee_11_type,committee_11_member_start_date,committee_11_member_end_date,committee_11_status,committee_11_role,committee_11_main_status,committee_12_expiry_type,committee_12_service_unit,committee_12_start_date,committee_12_end_date,committee_12_name_en,committee_12_name_start_date,committee_12_name_end_date,committee_12_type,committee_12_member_start_date,committee_12_member_end_date,committee_12_status,committee_12_role,committee_12_main_status,committee_6_alt_name_en,committee_6_alt_name_start_date,committee_6_alt_name_end_date,committee_3_alt_name_en,committee_3_alt_name_start_date,committee_3_alt_name_end_date,office_5_start_date,office_5_end_date,office_5_name,office_6_start_date,office_6_end_date,office_6_name,party_1_name,party_1_code,party_1_start_date,party_1_end_date,party_2_name,party_2_code,party_2_start_date,party_2_end_date,committee_8_role_title,committee_8_role_start_date,committee_8_role_end_date,committee_12_role_title,committee_12_role_start_date,committee_12_role_end_date,ministerial_office,year_elected
Sessional,2025-05-13 00:00:00+00:00,,"Joint Committee on Climate, Environment and Energy",2025-05-01 00:00:00+00:00,,Shadow Department,2025-05-07 00:00:00+00:00,,Live - Primary,Live,Standing,2024-12-18 00:00:00+00:00,,Committee on Members' Interests of Dáil Éireann,2024-11-29 00:00:00+00:00,,Statutory,2025-05-07 00:00:00+00:00,,Live - Primary,Live,Sessional,2025-04-30 00:00:00+00:00,,"Select Committee on Climate, Environment and Energy",2025-05-01 00:00:00+00:00,,Shadow Department,2025-05-07 00:00:00+00:00,,Live - Primary,Live,Labour Party,Labour_Party,2024-11-29,,Dublin-South-West,Dublin South-West,34th Dáil,dail,house,34,2024-11-29,,Ciarán,Ciarán-Ahern.D.2024-11-29,Ahern,,Ciarán Ahern,,,,,,,,,,,,,,,,,,,,,,,,,,,,,,,,,,,,,,,,,,,,,,,,,,,,,,,,,,,,,,,,,,,,,,,,,,,,,,,,,,,,,,,,,,,,,,,,,,,,,,,,,,,,,,,,,,,,,,,,,,,,,,,,,,,,,,,,,,,,,,,,,,,,,,,,,,,,,,,,,,,,,,,,,,,,,,,false,2024
Sessional,2025-05-07 00:00:00+00:00,,Joint Committee on Agriculture and Food,2025-05-01 00:00:00+00:00,,Shadow Department,2025-05-07 00:00:00+00:00,,Live - Primary,Live,Sessional,2025-05-13 00:00:00+00:00,,"Joint Committee on Social Protection, Rural and Community Development",2025-05-01 00:00:00+00:00,,Shadow Department,2025-05-07 00:00:00+00:00,,Live - Primary,Live,Sessional,2025-04-30 00:00:00+00:00,,Select Committee on Agriculture and Food,2025-05-01 00:00:00+00:00,,Shadow Department,2025-05-07 00:00:00+00:00,,Live - Primary,Live,Fine Gael,Fine_Gael,2024-11-29,,Laois,Laois,34th Dáil,dail,house,34,2024-11-29,,William,William-Aird.D.2024-11-29,Aird,,William Aird,Leas-Chathaoirleach,2025-05-21 00:00:00+00:00,,Leas-Chathaoirleach,2025-05-21 00:00:00+00:00,,Sessional,2025-04-30 00:00:00+00:00,,"Select Committee on Social Protection, Rural and Community Development",2025-05-01 00:00:00+00:00,,Shadow Department,2025-05-07 00:00:00+00:00,,Live - Primary,Live,,,,,,,,,,,,,,,,,,,,,,,,,,,,,,,,,,,,,,,,,,,,,,,,,,,,,,,,,,,,,,,,,,,,,,,,,,,,,,,,,,,,,,,,,,,,,,,,,,,,,,,,,,,,,,,,,,,,,,,,,,,,,,,,,,,,,,,,,,,,,,,,,,,,,,,,,,,,,,false,2024
Sessional,2025-05-13 00:00:00+00:00,,"Joint Committee on Social Protection, Rural and Community Development",2025-05-01 00:00:00+00:00,,Shadow Department,2025-05-07 00:00:00+00:00,2026-05-28 00:00:00+00:00,Live - Primary,Live,Standing,2024-12-18 00:00:00+00:00,,Committee of Public Accounts,2024-11-29 00:00:00+00:00,,Oversight,2025-05-07 00:00:00+00:00,2026-05-28 00:00:00+00:00,Live - Primary,Live,Sessional,2025-04-30 00:00:00+00:00,,"Select Committee on Social Protection, Rural and Community Development",2025-05-01 00:00:00+00:00,,Shadow Department,2025-05-07 00:00:00+00:00,2026-05-28 00:00:00+00:00,Live - Primary,Live,Fianna Fáil,Fianna_Fáil,2024-11-29,,Dublin-South-Central,Dublin South-Central,34th Dáil,dail,house,34,2024-11-29,,Catherine,Catherine-Ardagh.S.2016-04-25,Ardagh,,Catherine Ardagh,,,,,,,,,,,,,,,,,,"Minister of State at the Department of Justice, Home Affairs and Migration",2026-05-28,,,,,,,,,,,,,,,,,,,,,,,,,,,,,,,,,,,,,,,,,,,,,,,,,,,,,,,,,,,,,,,,,,,,,,,,,,,,,,,,,,,,,,,,,,,,,,,,,,,,,,,,,,,,,,,,,,,,,,,,,,,,,,,,,,,,,,,,,,,,,,,,,,,,,,,,,,,,true,2016
,,,,,,,,,,,,,,,,,,,,,,,,,,,,,,,,,Labour Party,Labour_Party,2024-11-29,,Dublin-Bay-South,Dublin Bay South,34th Dáil,dail,house,34,2024-11-29,,Ivana,Ivana-Bacik.S.2007-07-23,Bacik,,Ivana Bacik,,,,,,,,,,,,,,,,,,,,,,,,,,,,,,,,,,,,,,,,,,,,,,,,,,,,,,,,,,,,,,,,,,,,,,,,,,,,,,,,,,,,,,,,,,,,,,,,,,,,,,,,,,,,,,,,,,,,,,,,,,,,,,,,,,,,,,,,,,,,,,,,,,,,,,,,,,,,,,,,,,,,,,,,,,,,,,,false,2007
Sessional,2025-05-07 00:00:00+00:00,,Joint Committee on Foreign Affairs and Trade,2025-05-01 00:00:00+00:00,,Shadow Department,2025-05-07 00:00:00+00:00,,Live - Primary,Live,Sessional,2025-04-30 00:00:00+00:00,,Select Committee on Foreign Affairs and Trade,2025-05-01 00:00:00+00:00,,Shadow Department,2025-05-07 00:00:00+00:00,,Live - Primary,Live,Standing,2024-12-18 00:00:00+00:00,,Committee of Public Accounts,2024-11-29 00:00:00+00:00,,Oversight,2025-05-07 00:00:00+00:00,,Live - Primary,Live,Sinn Féin,Sinn_Féin,2024-11-29,,Cavan-Monaghan,Cavan-Monaghan,34th Dáil,dail,house,34,2024-11-29,,Cathy,Cathy-Bennett.D.2024-11-29,Bennett,,Cathy Bennett,,,,,,,Standing transitional,2025-01-23 00:00:00+00:00,2025-05-07 00:00:00+00:00,Select Committee on Subsidiarity (European Union Legislative Scrutiny),2025-01-21 16:29:34.896666+00:00,,Shadow Department,2025-02-13 00:00:00+00:00,2025-05-07 00:00:00+00:00,Dissolved,Dissolved,,,,,,,,,,,,,,,,,,,,,,,,,,,,,,,,,,,,,,,,,,,,,,,,,,,,,,,,,,,,,,,,,,,,,,,,,,,,,,,,,,,,,,,,,,,,,,,,,,,,,,,,,,,,,,,,,,,,,,,,,,,,,,,,,,,,,,,,,,,,,,,,,,,,,,,,,,,,,,false,2024
Sessional,2025-05-13 00:00:00+00:00,,Joint Committee on Children and Equality,2025-05-01 00:00:00+00:00,,Shadow Department,2025-05-07 00:00:00+00:00,,Live - Primary,Live,Sessional,2025-05-13 00:00:00+00:00,,Joint Committee on Transport,2025-05-01 00:00:00+00:00,,Shadow Department,2025-05-07 00:00:00+00:00,,Live - Primary,Live,Standing,2024-12-18 00:00:00+00:00,,Committee of Public Accounts,2024-11-29 00:00:00+00:00,,Oversight,2025-05-07 00:00:00+00:00,,Live - Primary,Live,Fine Gael,Fine_Gael,2024-11-29,,Dublin-Fingal-West,Dublin Fingal West,34th Dáil,dail,house,34,2024-11-29,,Grace,Grace-Boland.D.2024-11-29,Boland,,Grace Boland,,,,,,,Sessional,2025-04-30 00:00:00+00:00,,Select Committee on Children and Equality,2025-05-01 00:00:00+00:00,,Shadow Department,2025-05-07 00:00:00+00:00,,Live - Primary,Live,,,,Joint Committee on Children and Equality,2025-05-01 00:00:00+00:00,,Select Committee on Children and Equality,2025-05-01 00:00:00+00:00,,Sessional,2025-04-30 00:00:00+00:00,,Select Committee on Transport,2025-05-01 00:00:00+00:00,,Shadow Department,2025-05-07 00:00:00+00:00,,Live - Primary,Live,,,,,,,,,,,,,,,,,,,,,,,,,,,,,,,,,,,,,,,,,,,,,,,,,,,,,,,,,,,,,,,,,,,,,,,,,,,,,,,,,,,,,,,,,,,,,,,,,,,,,,,,,,,,,,,,,,,,,,,,,,,,,,,,,,,,,,,,,,false,2024
Sessional,2025-05-07 00:00:00+00:00,,"Joint Committee on Housing, Local Government and Heritage",2025-05-01 00:00:00+00:00,,Shadow Department,2025-05-07 00:00:00+00:00,,Live - Primary,Live,Sessional,2025-05-13 00:00:00+00:00,,"Joint Committee on Further and Higher Education, Research, Innovation and Science",2025-05-01 00:00:00+00:00,,Shadow Department,2026-02-05 00:00:00+00:00,,Live - Primary,Live,Standing,2024-12-18 00:00:00+00:00,,Business Committee (Dáil Éireann),2024-11-29 00:00:00+00:00,,Parliamentary Business and Committee Membership,2025-01-16 00:00:00+00:00,,Live - Primary,Live,People Before Profit-Solidarity,People_Before_Profit_Solidarity,2024-11-29,,Dún-Laoghaire,Dún Laoghaire,34th Dáil,dail,house,34,2024-11-29,,Richard,Richard-Boyd-Barrett.D.2011-03-09,Boyd Barrett,,Richard Boyd Barrett,,,,,,,Standing,2024-12-18 00:00:00+00:00,,Committee on Standing Orders and Dáil Reform,2024-11-29 00:00:00+00:00,,Parliamentary Regulation and Reform,2025-01-16 00:00:00+00:00,2025-01-16 00:00:00+00:00,Live - Primary,Live,,,,,,,,,,Standing,2024-12-18 00:00:00+00:00,,Committee on Budgetary Oversight,2024-11-29 00:00:00+00:00,,Oversight,2025-05-07 00:00:00+00:00,,Live - Primary,Live,Sessional,2025-04-30 00:00:00+00:00,,"Select Committee on Housing, Local Government and Heritage",2025-05-01 00:00:00+00:00,,Shadow Department,2025-05-07 00:00:00+00:00,,Live - Primary,Live,Standing,2024-12-18 00:00:00+00:00,,Committee of Selection (Dáil Éireann),2024-11-29 00:00:00+00:00,,Parliamentary Business and Committee Membership,2025-01-16 00:00:00+00:00,,Live - Primary,Live,Sessional,2025-04-30 00:00:00+00:00,,"Select Committee on Further and Higher Education, Research, Innovation and Science",2025-05-01 00:00:00+00:00,,Shadow Department,2026-02-05 00:00:00+00:00,,Live - Primary,Live,,,,,,,,,,,,,,,,,,,,,,,,,,,,,,,,,,,,,,,,,,,,,,,,,,,,,,,,,,,,,,,,,,,,,,,,,,,,,,,,,,,,,,,,,,,,,,,,,,,,,,,,,false,2011
Sessional,2025-05-13 00:00:00+00:00,,Joint Committee on Defence and National Security,2025-05-01 00:00:00+00:00,,Shadow Department,2025-05-07 00:00:00+00:00,,Live - Primary,Live,Sessional,2025-05-13 00:00:00+00:00,,"Joint Committee on Justice, Home Affairs and Migration",2025-05-01 00:00:00+00:00,,Shadow Department,2025-05-07 00:00:00+00:00,,Live - Primary,Live,Special,2025-05-13 00:00:00+00:00,,Joint Committee on Drugs Use,2025-05-01 00:00:00+00:00,,Policy,2025-05-07 00:00:00+00:00,,Live - Primary,Live,Fianna Fáil,Fianna_Fáil,2024-11-29,,Dublin-Bay-North,Dublin Bay North,34th Dáil,dail,house,34,2024-11-29,,Tom,Tom-Brabazon.D.2024-11-29,Brabazon,,Tom Brabazon,,,,,,,Sessional,2025-04-30 00:00:00+00:00,,Select Committee on Defence and National Security,2025-05-01 00:00:00+00:00,,Shadow Department,2025-05-07 00:00:00+00:00,,Live - Primary,Live,,,,,,,,,,Sessional,2025-04-30 00:00:00+00:00,,"Select Committee on Justice, Home Affairs and Migration",2025-05-01 00:00:00+00:00,,Shadow Department,2025-05-07 00:00:00+00:00,,Live - Primary,Live,Special,2025-04-30 00:00:00+00:00,,Select Committee on Drugs Use,2025-05-01 00:00:00+00:00,,Policy,2025-05-07 00:00:00+00:00,,Live - Primary,Live,,,,,,,,,,,,,,,,,,,,,,,,,,,,,,,,,,,,,,,,,,,,,,,,,,,,,,,,,,,,,,,,,,,,,,,,,,,,,,,,,,,,,,,,,,,,,,,,,,,,,,,,,,,,,,,,,,,,,,,,,,,,,,,false,2024
Standing,2025-02-12 00:00:00+00:00,,Working Group of Committee Cathaoirligh,2025-01-29 00:00:00+00:00,,The Committee System and Parliamentary Administration,2025-05-07 00:00:00+00:00,,Live - Primary,Live,Standing,2024-12-18 00:00:00+00:00,,Committee of Public Accounts,2024-11-29 00:00:00+00:00,,Oversight,2025-05-07 00:00:00+00:00,,Live - Primary,Live,,,,,,,,,,,,Sinn Féin,Sinn_Féin,2024-11-29,,Wicklow,Wicklow,34th Dáil,dail,house,34,2024-11-29,,John,John-Brady.D.2016-10-03,Brady,,John Brady,,,,,,,,,,,,,,,,,,,,,,,,,,,,,,,,,,,,,,,,,,,,,,,,,,,,,,,,,,,,,,,,,,,,,,,Cathaoirleach,2025-05-07 00:00:00+00:00,,,,,,,,,,,,,,,,,,,,,,,,,,,,,,,,,,,,,,,,,,,,,,,,,,,,,,,,,,,,,,,,,,,,,,,,,,,,,,,,,,,,,,,,,,,,,,,,,,,,,,,false,2016
Sessional,2025-05-07 00:00:00+00:00,,Joint Committee on Foreign Affairs and Trade,2025-05-01 00:00:00+00:00,,Shadow Department,2025-05-07 00:00:00+00:00,,Live - Primary,Live,Standing,2025-02-12 00:00:00+00:00,,Joint Committee on Remit Oversight,2025-01-29 00:00:00+00:00,,Parliamentary Regulation and Reform,2026-01-29 00:00:00+00:00,,Live - Primary,Live,Sessional,2025-05-07 00:00:00+00:00,,"Joint Committee on Arts, Media, Communications, Culture and Sport",2025-05-01 00:00:00+00:00,,Shadow Department,2025-05-07 00:00:00+00:00,,Live - Primary,Live,Fine Gael,Fine_Gael,2024-11-29,,Wicklow-Wexford,Wicklow-Wexford,34th Dáil,dail,house,34,2024-11-29,,Brian,Brian-Brennan.D.2024-11-29,Brennan,,Brian Brennan,,,,,,,Sessional,2025-05-13 00:00:00+00:00,,"Joint Committee on Enterprise, Tourism and Employment",2025-05-01 00:00:00+00:00,,Shadow Department,2025-05-07 00:00:00+00:00,,Live - Primary,Live,,,,,,,,,,Sessional,2025-04-30 00:00:00+00:00,,"Select Committee on Arts, Media, Communications, Culture and Sport",2025-05-01 00:00:00+00:00,,Shadow Department,2025-05-07 00:00:00+00:00,,Live - Primary,Live,Sessional,2025-04-30 00:00:00+00:00,,Select Committee on Foreign Affairs and Trade,2025-05-01 00:00:00+00:00,,Shadow Department,2025-05-07 00:00:00+00:00,,Live - Primary,Live,Sessional,2025-04-30 00:00:00+00:00,,"Select Committee on Enterprise, Tourism and Employment",2025-05-01 00:00:00+00:00,,Shadow Department,2025-05-07 00:00:00+00:00,,Live - Primary,Live,Standing,2024-12-18 00:00:00+00:00,,Committee on Parliamentary Privileges and Oversight (Dáil Éireann),2024-11-29 00:00:00+00:00,,Parliamentary Regulation and Reform,2026-01-29 00:00:00+00:00,,Live - Primary,Live,,,,Leas-Chathaoirleach,2025-05-28 00:00:00+00:00,,Leas-Chathaoirleach,2025-05-28 00:00:00+00:00,,Standing,2024-12-18 00:00:00+00:00,,Committee on Remit Oversight (Dáil Éireann),2025-01-29 00:00:00+00:00,,Parliamentary Regulation and Reform,2026-01-29 00:00:00+00:00,,Live - Primary,Live,Standing,2024-12-18 00:00:00+00:00,,Committee on Standing Orders and Dáil Reform,2024-11-29 00:00:00+00:00,,Parliamentary Regulation and Reform,2026-01-28 00:00:00+00:00,,Live - Primary,[],Live,,,,,,,,,,,,,,,,,,,,,,,,,,,,,,,,,,,,,,,,,,,,,,,,,,,,,,,,,,,,,,,,,,,,,,,,,false,2024
Sessional,2025-05-07 00:00:00+00:00,,Joint Committee on Foreign Affairs and Trade,2025-05-01 00:00:00+00:00,,Shadow Department,2025-05-07 00:00:00+00:00,,Live - Primary,Live,Sessional,2025-05-07 00:00:00+00:00,,Joint Committee on Infrastructure and National Development Plan Delivery,2025-05-01 00:00:00+00:00,,Shadow Department,2025-05-07 00:00:00+00:00,,Live - Primary,Live,Sessional,2025-05-07 00:00:00+00:00,,"Joint Committee on Finance, Public Expenditure, Public Service Reform and Digitalisation, and Taoiseach",2025-05-01 00:00:00+00:00,,Shadow Department,2025-05-07 00:00:00+00:00,,Live - Primary,Live,Fianna Fáil,Fianna_Fáil,2024-11-29,,Dublin-Rathdown,Dublin Rathdown,34th Dáil,dail,house,34,2024-11-29,,Shay,Shay-Brennan.D.2024-11-29,Brennan,,Shay Brennan,,,,,,,Sessional,2025-04-30 00:00:00+00:00,,"Select Committee on Finance, Public Expenditure, Public Service Reform and Digitalisation, and Taoiseach",2025-05-01 00:00:00+00:00,,Shadow Department,2025-05-07 00:00:00+00:00,,Live - Primary,Live,,,,,,,,,,Sessional,2025-04-30 00:00:00+00:00,,Select Committee on Infrastructure and National Development Plan Delivery,2025-05-01 00:00:00+00:00,,Shadow Department,2025-05-07 00:00:00+00:00,,Live - Primary,Live,Sessional,2025-04-30 00:00:00+00:00,,Select Committee on Foreign Affairs and Trade,2025-05-01 00:00:00+00:00,,Shadow Department,2025-05-07 00:00:00+00:00,,Live - Primary,Live,Standing,2024-12-18 00:00:00+00:00,,Committee on Standing Orders and Dáil Reform,2024-11-29 00:00:00+00:00,,Parliamentary Regulation and Reform,2025-01-24 00:00:00+00:00,,Live - Primary,Live,,,,,,,,,,,,,,,,,,,,,,,,,,,,,,,,,,,,,,,,,,,,,,,,,,,,,,,,,,,,,,,,,,,,,,,,,,,,,,,,,,,,,,,,,,,,,,,,,,,,,,,,,,,,,,,,,,,,false,2024
,,,,,,,,,,,,,,,,,,,,,,,,,,,,,,,,,Fine Gael,Fine_Gael,2024-11-29,,Dublin-South-West,Dublin South-West,34th Dáil,dail,house,34,2024-11-29,,Colm,Colm-Brophy.D.2016-10-03,Brophy,,Colm Brophy,,,,,,,,,,,,,,,,,,"Minister of State at the Department of Justice, Home Affairs and Migration",2025-06-05,,,,,,,,,,,,,,,,,,,,,,,,,,,,,,,,,,,,,,,,,,,,,,,,,,,,,,,,,,,,,,,,,,,,,,,,,,,,,,,,,,,,Minister of State at the Department of Justice,2025-02-25,2025-06-04,,,,,,,,,,,,,,,,,,,,,,,,,,,,,,,,,,,,,,,,,,,,,,,,,,,,,,,,,,,,,,,,,,,,,,true,2016
,,,,,,,,,,,,,,,,,,,,,,,,,,,,,,,,,Fianna Fáil,Fianna_Fáil,2024-11-29,,Wexford,Wexford,34th Dáil,dail,house,34,2024-11-29,,James,James-Browne.D.2016-10-03,Browne,,James Browne,,,,,,,,,,,,,,,,,,"Minister for Housing, Local Government and Heritage",2025-01-23,,,,,,,,,,,,,,,,,,,,,,,,,,,,,,,,,,,,,,,,,,,,,,,,,,,,,,,,,,,,,,,,,,,,,,,,,,,,,,,,,,,,,,,,,,,,,,,,,,,,,,,,,,,,,,,,,,,,,,,,,,,,,,,,,,,,,,,,,,,,,,,,,,,,,,,,,,,,true,2016
Standing,2025-02-12 00:00:00+00:00,,Joint Committee on Public Petitions and the Ombudsmen,2025-01-29 00:00:00+00:00,,Oversight,2025-05-07 00:00:00+00:00,,Live - Primary,Live,Standing,2025-02-12 00:00:00+00:00,,Select Committee on Public Petitions and the Ombudsmen,2025-01-29 00:00:00+00:00,,Oversight,2025-05-07 00:00:00+00:00,,Live - Primary,Live,,,,,,,,,,,,Sinn Féin,Sinn_Féin,2024-11-29,,Cork-East,Cork East,34th Dáil,dail,house,34,2024-11-29,,Pat,Pat-Buckley.D.2016-10-03,Buckley,,Pat Buckley,,,,,,,,,,,,,,,,,,,,,,,,,,,,,,,,,,,,,,,,,,,,,,,,,,,,,,,,,,,,,,,,,,,,,,,,,,,,,,,,,,,,,,,,,,,,,,,,,,,,,,,,,,,,,,,,,,,,,,,,,,,,,,,,,,,,,,,,,,,,,,,,,,,,,,,,,,,,,,,,,,,,,,,,,,,,,,,false,2016
Sessional,2025-05-07 00:00:00+00:00,,"Joint Committee on Finance, Public Expenditure, Public Service Reform and Digitalisation, and Taoiseach",2025-05-01 00:00:00+00:00,,Shadow Department,2025-05-07 00:00:00+00:00,,Live - Primary,Live,Sessional,2025-05-13 00:00:00+00:00,,Joint Committee on Health,2025-05-01 00:00:00+00:00,,Shadow Department,2025-05-07 00:00:00+00:00,,Live - Primary,Live,Special,2025-05-13 00:00:00+00:00,,Joint Committee on Drugs Use,2025-05-01 00:00:00+00:00,,Policy,2025-05-07 00:00:00+00:00,,Live - Primary,Live,Fine Gael,Fine_Gael,2024-11-29,,Cork-North-Central,Cork North-Central,34th Dáil,dail,house,34,2024-11-29,,Colm,Colm-Burke.S.2011-05-25,Burke,,Colm Burke,,,,,,,Sessional,2025-04-30 00:00:00+00:00,,"Select Committee on Finance, Public Expenditure, Public Service Reform and Digitalisation, and Taoiseach",2025-05-01 00:00:00+00:00,,Shadow Department,2025-05-07 00:00:00+00:00,,Live - Primary,Live,,,,,,,,,,Sessional,2025-04-30 00:00:00+00:00,,Select Committee on Health,2025-05-01 00:00:00+00:00,,Shadow Department,2025-05-07 00:00:00+00:00,,Live - Primary,Live,Special,2025-04-30 00:00:00+00:00,,Select Committee on Drugs Use,2025-05-01 00:00:00+00:00,,Policy,2025-05-07 00:00:00+00:00,,Live - Primary,Live,,,,,,,,,,,,,,,,,,,,,,,Leas-Chathaoirleach,2025-05-28 00:00:00+00:00,,,,,,,,,,,,,,,,,,,,,,,,,,,,,,,,,,Leas-Chathaoirleach,2025-05-28 00:00:00+00:00,,,,,,,,,,,,,,,,,,,,,,,,,,,,,,,,,,,,,,,,,,,,,,,,,,,,,,,,,,,,,,,,,,,,false,2011
,,,,,,,,,,,,,,,,,,,,,,,,,,,,,,,,,Fine Gael,Fine_Gael,2024-11-29,,Longford-Westmeath,Longford-Westmeath,34th Dáil,dail,house,34,2024-11-29,,Peter,Peter-Burke.D.2016-10-03,Burke,,Peter Burke,,,,,,,,,,,,,,,,,,"Minister for Enterprise, Tourism and Employment",2025-06-02,,,,,,,,,,,,,,,,,,,,,,,,,,,,,,,,,,,,,,,,,,,,,,,,,,,,,,,,,,,,,,,,,,,,,,,,,,,,,,,,,,,,"Minister for Enterprise, Trade and Employment",2025-01-23,2025-06-01,,,,,,,,,,,,,,,,,,,,,,,,,,,,,,,,,,,,,,,,,,,,,,,,,,,,,,,,,,,,,,,,,,,,,,true,2016
Standing,2025-02-12 00:00:00+00:00,,Joint Committee on Remit Oversight,2025-01-29 00:00:00+00:00,,Parliamentary Regulation and Reform,2025-05-21 00:00:00+00:00,,Live - Primary,Live,Standing,2024-12-18 00:00:00+00:00,,Business Committee (Dáil Éireann),2024-11-29 00:00:00+00:00,,Parliamentary Business and Committee Membership,2025-01-16 00:00:00+00:00,,Live - Primary,Live,Standing,2024-12-18 00:00:00+00:00,,Committee on Standing Orders and Dáil Reform,2024-11-29 00:00:00+00:00,,Parliamentary Regulation and Reform,2025-01-24 00:00:00+00:00,,Live - Primary,Live,Fianna Fáil,Fianna_Fáil,2024-11-29,,Waterford,Waterford,34th Dáil,dail,house,34,2024-11-29,,Mary,Mary-Butler.D.2016-10-03,Butler,,Mary Butler,,,,,,,Standing,2024-12-18 00:00:00+00:00,,Committee on Parliamentary Privileges and Oversight (Dáil Éireann),2024-11-29 00:00:00+00:00,,Parliamentary Regulation and Reform,2025-05-21 00:00:00+00:00,,Live - Primary,Live,Minister of State at the Department of the Taoiseach with special responsibility as Government Chief Whip; and the Department of Health with responsibility for Mental Health,2025-01-23,,,,,,,,Standing,2024-12-18 00:00:00+00:00,,Committee of Selection (Dáil Éireann),2024-11-29 00:00:00+00:00,,Parliamentary Business and Committee Membership,2025-01-16 00:00:00+00:00,,Live - Primary,Live,Standing,2024-12-18 00:00:00+00:00,,Committee on Remit Oversight (Dáil Éireann),2025-01-29 00:00:00+00:00,,Parliamentary Regulation and Reform,2025-05-21 00:00:00+00:00,,Live - Primary,Live,,,,,,,,,,,,,,,,,,,,,,,,,,,,,,,,,,,,,,,,,,,,,,,,,,,,,,,,,,,,,,,,,,,,,,,,,,,,,,,,,,,,,,,,,,,,,,,,,,,,,,,,,,,,,,,,,,,,,,,,,,,,,,,true,2016
