Connolly,,John-Connolly.D.2024-11-29,John,Fianna_Fáil,,2024-11-29,Fianna Fáil,34th Dáil,house,34,dail,,2025-05-01 00:00:00+00:00,Joint Committee on Key Issues Affecting the Traveller Community,Policy,Live - Primary,,2025-05-12 00:00:00+00:00,Live,,2025-05-07 00:00:00+00:00,Sessional,,2025-05-01 00:00:00+00:00,Joint Committee on Children and Equality,Shadow Department,Live - Primary,,2025-05-13 00:00:00+00:00,Live,,2026-01-20 00:00:00+00:00,Sessional,,2025-05-01 00:00:00+00:00,Joint Committee on Fisheries and Maritime Affairs,Shadow Department,Live - Primary,,2025-05-07 00:00:00+00:00,Live,2026-01-20 00:00:00+00:00,2025-07-02 00:00:00+00:00,Sessional,,2024-11-29,Galway-West,Galway West,John Connolly,,,,,,,,2025-05-01 00:00:00+00:00,"Joint Committee on Further and Higher Education, Research, Innovation and Science",Shadow Department,Live - Primary,,2025-05-13 00:00:00+00:00,Live,,2025-05-07 00:00:00+00:00,Sessional,,,,,,,,2025-01-29 00:00:00+00:00,"Comhchoiste na Gaeilge, na Gaeltachta agus Phobal Labhartha na Gaeilge",Policy,Live - Primary,,2025-02-12 00:00:00+00:00,Live,,2025-05-07 00:00:00+00:00,Standing,,2025-05-01 00:00:00+00:00,Select Committee on Key Issues Affecting the Traveller Community,Policy,Live - Primary,,2025-04-30 00:00:00+00:00,Live,,2025-05-07 00:00:00+00:00,Sessional,,2025-01-29 00:00:00+00:00,"Roghchoiste na Gaeilge, na Gaeltachta agus Phobal Labhartha na Gaeilge",Policy,Live - Primary,,2025-02-12 00:00:00+00:00,Live,,2025-05-07 00:00:00+00:00,Standing,,2025-05-01 00:00:00+00:00,Select Committee on Children and Equality,Shadow Department,Live - Primary,,2025-04-30 00:00:00+00:00,Live,,2026-01-20 00:00:00+00:00,Sessional,,,,,,,,,,,2025-05-01 00:00:00+00:00,"Select Committee on Further and Higher Education, Research, Innovation and Science",Shadow Department,Live - Primary,,2025-04-30 00:00:00+00:00,Live,,2025-05-07 00:00:00+00:00,Sessional,,2025-05-01 00:00:00+00:00,Select Committee on Fisheries and Maritime Affairs,[],Shadow Department,Live - Primary,,2025-04-30 00:00:00+00:00,Live,2026-01-20 00:00:00+00:00,2025-07-02 00:00:00+00:00,Sessional,,,,,,,,,,,,,,,,,,,,2025-05-01 00:00:00+00:00,Joint Committee on Children and Equality,,2025-05-01 00:00:00+00:00,Select Committee on Children and Equality,,,,,,,,,,,,,,,,,,,,,,,,,,,,,,,,,,,,,,,,,,,,,,,,,,,,false,2024
Conway-Walsh,,Rose-Conway-Walsh.S.2016-04-25,Rose,Sinn_Féin,,2024-11-29,Sinn Féin,34th Dáil,house,34,dail,,2025-05-01 00:00:00+00:00,Joint Committee on the Implementation of the Good Friday Agreement ,Shadow Department,Live - Primary,,2025-05-12 00:00:00+00:00,Live,,2025-05-07 00:00:00+00:00,Sessional,,2025-05-01 00:00:00+00:00,"Joint Committee on Enterprise, Tourism and Employment",Shadow Department,Live - Primary,,2025-05-13 00:00:00+00:00,Live,,2025-05-07 00:00:00+00:00,Sessional,,2025-01-29 00:00:00+00:00,Working Group of Committee Cathaoirligh,The Committee System and Parliamentary Administration,Live - Primary,,2025-02-12 00:00:00+00:00,Live,,2025-05-07 00:00:00+00:00,Standing,,2024-11-29,Mayo,Mayo,Rose Conway-Walsh,,,,,,,,2025-05-01 00:00:00+00:00,Joint Committee on Defence and National Security,Shadow Department,Live - Primary,,2025-05-13 00:00:00+00:00,Live,,2025-05-07 00:00:00+00:00,Sessional,,,,,,,,2025-05-01 00:00:00+00:00,Select Committee on Defence and National Security,Shadow Department,Live - Primary,,2025-04-30 00:00:00+00:00,Live,,2025-05-07 00:00:00+00:00,Sessional,,2025-05-01 00:00:00+00:00,Select Committee on the Implementation of the Good Friday Agreement ,Shadow Department,Live - Primary,,2025-04-30 00:00:00+00:00,Live,,2025-05-07 00:00:00+00:00,Sessional,,2025-05-01 00:00:00+00:00,"Select Committee on Enterprise, Tourism and Employment",Shadow Department,Live - Primary,,2025-04-30 00:00:00+00:00,Live,,2025-05-07 00:00:00+00:00,Sessional,,,,,,,,,,,,,,,,2025-05-07 00:00:00+00:00,Cathaoirleach,,,,,,,,,,,,,,,,,,,,,,,,,,,,,,,,,,2025-05-07 00:00:00+00:00,Cathaoirleach,,,,,,,,,,,,,,,,,,,,,,,,,,,,,,,,,,,,,,,,,,,,,,,,,,,,,,,,,,,,,,,,,,,false,2016
Cooney,,Joe-Cooney.D.2024-11-29,Joe,Fine_Gael,,2024-11-29,Fine Gael,34th Dáil,house,34,dail,,2025-05-01 00:00:00+00:00,Joint Committee on Agriculture and Food,Shadow Department,Live - Primary,,2025-05-07 00:00:00+00:00,Live,,2025-05-07 00:00:00+00:00,Sessional,,2025-05-01 00:00:00+00:00,Joint Committee on Fisheries and Maritime Affairs,Shadow Department,Live - Primary,,2025-05-07 00:00:00+00:00,Live,,2025-05-07 00:00:00+00:00,Sessional,,2025-05-01 00:00:00+00:00,"Joint Committee on Housing, Local Government and Heritage",Shadow Department,Live - Primary,,2025-05-07 00:00:00+00:00,Live,,2025-05-07 00:00:00+00:00,Sessional,,2024-11-29,Clare,Clare,Joe Cooney,,,,,,,,2025-05-01 00:00:00+00:00,Select Committee on Agriculture and Food,Shadow Department,Live - Primary,,2025-04-30 00:00:00+00:00,Live,,2025-05-07 00:00:00+00:00,Sessional,,,,,,,,2025-05-01 00:00:00+00:00,Select Committee on Fisheries and Maritime Affairs,Shadow Department,Live - Primary,,2025-04-30 00:00:00+00:00,Live,,2025-05-07 00:00:00+00:00,Sessional,,2025-05-01 00:00:00+00:00,"Select Committee on Housing, Local Government and Heritage",Shadow Department,Live - Primary,,2025-04-30 00:00:00+00:00,Live,,2025-05-07 00:00:00+00:00,Sessional,,,,,,,,,,,,,,,,,,,,,,,,,,,,,,,,,,,,,,,,,,,,,,,,,,,,,,,,,,,,,,,,,,,,,,,,,,,,,,,,,,,,,,,,,,,,,,,,,,,,,,,,,,,,,,,,,,,,,,,,,,,,,,,,,,false,2024
Coppinger,,Ruth-Coppinger.D.2014-05-23,Ruth,People_Before_Profit_Solidarity,,2024-11-29,People Before Profit-Solidarity,34th Dáil,house,34,dail,,2025-01-29 00:00:00+00:00,Joint Committee on Remit Oversight,Parliamentary Regulation and Reform,Live - Primary,,2025-02-12 00:00:00+00:00,Live,,2025-05-21 00:00:00+00:00,Standing,,2025-05-01 00:00:00+00:00,Joint Committee on Education and Youth,Shadow Department,Live - Primary,,2025-05-13 00:00:00+00:00,Live,,2025-05-07 00:00:00+00:00,Sessional,,2024-11-29 00:00:00+00:00,Committee on Parliamentary Privileges and Oversight (Dáil Éireann),Parliamentary Regulation and Reform,Live - Primary,,2024-12-18 00:00:00+00:00,Live,,2025-05-21 00:00:00+00:00,Standing,,2024-11-29,Dublin-West,Dublin West,Ruth Coppinger,,,,,,,,2025-01-29 00:00:00+00:00,Committee on Remit Oversight (Dáil Éireann),Parliamentary Regulation and Reform,Live - Primary,,2024-12-18 00:00:00+00:00,Live,,2025-05-21 00:00:00+00:00,Standing,,,,,,,,2025-05-01 00:00:00+00:00,Select Committee on Education and Youth,Shadow Department,Live - Primary,,2025-04-30 00:00:00+00:00,Live,,2025-05-07 00:00:00+00:00,Sessional,,,,,,,,,,,,,,,,,,,,,,,,,,,,,,,,,,,,,,,,,,,,,,,,,,,,,,,,,,,,,,,,,,,,,,,,,,,,,,,,,,,,,,,,,,,,,,,,,,,,,,,,,,,,,,,,,,,,,,,,,,,,,,,,,,,,,,,,,,,,,false,2014
Cronin,,Réada-Cronin.D.2020-02-08,Réada,Sinn_Féin,,2024-11-29,Sinn Féin,34th Dáil,house,34,dail,,2025-05-01 00:00:00+00:00,Joint Committee on Infrastructure and National Development Plan Delivery,Shadow Department,Live - Primary,,2025-05-07 00:00:00+00:00,Live,,2025-05-07 00:00:00+00:00,Sessional,,2025-05-01 00:00:00+00:00,"Joint Committee on Climate, Environment and Energy",Shadow Department,Live - Primary,,2025-05-13 00:00:00+00:00,Live,,2025-05-07 00:00:00+00:00,Sessional,,2025-05-01 00:00:00+00:00,Select Committee on Infrastructure and National Development Plan Delivery,Shadow Department,Live - Primary,,2025-04-30 00:00:00+00:00,Live,,2025-05-07 00:00:00+00:00,Sessional,,2024-11-29,Kildare-North,Kildare North,Réada Cronin,,,,,,,,2025-05-01 00:00:00+00:00,"Select Committee on Climate, Environment and Energy",Shadow Department,Live - Primary,,2025-04-30 00:00:00+00:00,Live,,2025-05-07 00:00:00+00:00,Sessional,,,,,,,,,,,,,,,,,,,,,,,,,,,,,,,,,,,,,,,,,,,,,,,,,,,,,,,,,,,,,,,,,,,,,,,,,,,,,,,,,,,,,,,,,,,,,,,,,,,,,,,,,,,,,,,,,,,,,,,,,,,,,,,,,,,,,,,,,,,,,,,,,,,,,,,,,,,,,,false,2020
Crowe,,Cathal-Crowe.D.2020-02-08,Cathal,Fianna_Fáil,,2024-11-29,Fianna Fáil,34th Dáil,house,34,dail,,2025-05-01 00:00:00+00:00,Joint Committee on Education and Youth,Shadow Department,Live - Primary,,2025-05-13 00:00:00+00:00,Live,,2025-05-07 00:00:00+00:00,Sessional,,2025-05-01 00:00:00+00:00,Joint Committee on Transport,Shadow Department,Live - Primary,,2025-05-13 00:00:00+00:00,Live,,2025-05-07 00:00:00+00:00,Sessional,,2025-01-29 00:00:00+00:00,Working Group of Committee Cathaoirligh,The Committee System and Parliamentary Administration,Live - Primary,,2025-02-12 00:00:00+00:00,Live,,2025-05-07 00:00:00+00:00,Standing,,2024-11-29,Clare,Clare,Cathal Crowe,,2025-05-07 00:00:00+00:00,Cathaoirleach,,,,,2025-05-01 00:00:00+00:00,Select Committee on Education and Youth,Shadow Department,Live - Primary,,2025-04-30 00:00:00+00:00,Live,,2025-05-07 00:00:00+00:00,Sessional,,,,,,,,2025-05-01 00:00:00+00:00,Select Committee on Transport,Shadow Department,Live - Primary,,2025-04-30 00:00:00+00:00,Live,,2025-05-07 00:00:00+00:00,Sessional,,2024-11-29 00:00:00+00:00,Committee on Budgetary Oversight,Oversight,Live - Primary,,2024-12-18 00:00:00+00:00,Live,,2025-05-07 00:00:00+00:00,Standing,,,,,,,,,,,,,,,,,,,,,,,,,,,2025-05-07 00:00:00+00:00,Cathaoirleach,,,,,,,,,,,,,,,,,,,,,,,,,,,,,,,,,,,,,,,,,,,,,,,,,,,,,,,,,,,,,,,,,,,,,,,,,,,,,,,,,,,,,,,,,,,,,,,,,,,,,,false,2020
Crowe,,Seán-Crowe.D.2002-06-06,Seán,Sinn_Féin,,2024-11-29,Sinn Féin,34th Dáil,house,34,dail,,2025-05-01 00:00:00+00:00,Joint Committee on European Union Affairs,Shadow Department,Live - Primary,,2025-05-13 00:00:00+00:00,Live,,2025-05-07 00:00:00+00:00,Sessional,,2025-05-01 00:00:00+00:00,Joint Committee on the Implementation of the Good Friday Agreement ,Shadow Department,Live - Primary,,2025-05-12 00:00:00+00:00,Live,,2025-05-07 00:00:00+00:00,Sessional,,2025-05-01 00:00:00+00:00,Select Committee on the Implementation of the Good Friday Agreement ,Shadow Department,Live - Primary,,2025-04-30 00:00:00+00:00,Live,,2025-05-07 00:00:00+00:00,Sessional,,2024-11-29,Dublin-South-West,Dublin South-West,Seán Crowe,,,,,,,,2025-05-01 00:00:00+00:00,Select Committee on European Union Affairs,Shadow Department,Live - Primary,,2025-04-30 00:00:00+00:00,Live,,2025-05-07 00:00:00+00:00,Sessional,,,,,,,,,,,,,,,,,,,,,,,,,,,,,,,,,,,,,,,,,,,,,,,,,,,,,,,,,,,,,,,,,,,,,,,,,,,,,,,,,,,,,,,,,,,,,,,,,,,,,,,,,,,,,,,,,,,,,,,,,,,,,,,,,,,,,,,,,,,,,,,,,,,,,,,,,,,,,,false,2002
Cullinane,,David-Cullinane.S.2011-05-25,David,Sinn_Féin,,2024-11-29,Sinn Féin,34th Dáil,house,34,dail,,2025-05-01 00:00:00+00:00,Joint Committee on Health,Shadow Department,Live - Primary,,2025-05-13 00:00:00+00:00,Live,,2025-05-07 00:00:00+00:00,Sessional,,2025-05-01 00:00:00+00:00,Select Committee on Health,Shadow Department,Live - Primary,,2025-04-30 00:00:00+00:00,Live,,2025-05-07 00:00:00+00:00,Sessional,,,,,,,,,,,,,2024-11-29,Waterford,Waterford,David Cullinane,,,,,,,,,,,,,,,,,,,,,,,,,,,,,,,,,,,,,,,,,,,,,,,,,,,,,,,,,,,,,,,,,,,,,,,,,,,,,,,,,,,,,,,,,,,,,,,,,,,,,,,,,,,,,,,,,,,,,,,,,,,,,,,,,,,,,,,,,,,,,,,,,,,,,,,,,,,,,,,,,,,,,,,,,,,,,,,false,2011
Cummins,,Jen-Cummins.D.2024-11-29,Jen,Social_Democrats,,2024-11-29,Social Democrats,34th Dáil,house,34,dail,,2025-01-29 00:00:00+00:00,Joint Committee on Remit Oversight,Parliamentary Regulation and Reform,Live - Primary,,2025-02-12 00:00:00+00:00,Live,,2025-05-21 00:00:00+00:00,Standing,,2025-05-01 00:00:00+00:00,Joint Committee on Education and Youth,Shadow Department,Live - Primary,,2025-05-13 00:00:00+00:00,Live,,2025-05-07 00:00:00+00:00,Sessional,,2024-11-29 00:00:00+00:00,Committee on Parliamentary Privileges and Oversight (Dáil Éireann),Parliamentary Regulation and Reform,Live - Primary,,2024-12-18 00:00:00+00:00,Live,,2025-05-21 00:00:00+00:00,Standing,,2024-11-29,Dublin-South-Central,Dublin South-Central,Jen Cummins,,,,,,,,2025-01-29 00:00:00+00:00,Committee on Remit Oversight (Dáil Éireann),Parliamentary Regulation and Reform,Live - Primary,,2024-12-18 00:00:00+00:00,Live,,2025-05-21 00:00:00+00:00,Standing,,,,,,,,2025-05-01 00:00:00+00:00,Select Committee on Education and Youth,Shadow Department,Live - Primary,,2025-04-30 00:00:00+00:00,Live,,2025-05-07 00:00:00+00:00,Sessional,,,,,,,,,,,,,,,,,,,,,,,,,,,,,,,,,,,,,,,,,,,,,,,,,,,,,,,,,,,,,,,,,,,,,,,,,,,,,,,,,,,,,,,,,,,,,,,,,,,,,,,,,,,,,,,,,,,,,,,,,,,,,,,,,,,,,,,,,,,,,false,2024
Cummins,,John-Cummins.S.2020-03-30,John,Fine_Gael,,2024-11-29,Fine Gael,34th Dáil,house,34,dail,,,,,,,,,,,,,,,,,,,,,,,,,,,,,,,,,,,2024-11-29,Waterford,Waterford,John Cummins,,,,,,,,,,,,,,,,,,,,,,,,,,,,,,,,,,,,,,,,,,,,,,,,,,,,,,,,,,,,,,,,,,,,,,,,,,,,,,,,,,,,,,,,,,,,,,,,,,,,"Minister of State at the Department of Housing, Local Government and Heritage",,2025-01-29,,,,,,,,,,,,,,,,,,,,,,,,,,,,,,,,,,,,,,,,,,,,,,,,,,,,,,,,,,,,,,,,,,,,,,,,,true,2020
Currie,,Emer-Currie.S.2020-06-29,Emer,Fine_Gael,,2024-11-29,Fine Gael,34th Dáil,house,34,dail,,2025-05-01 00:00:00+00:00,Joint Committee on Education and Youth,Shadow Department,Live - Primary,,2025-05-13 00:00:00+00:00,Live,2026-05-26 00:00:00+00:00,2025-05-07 00:00:00+00:00,Sessional,,2025-01-29 00:00:00+00:00,Joint Committee on Remit Oversight,Parliamentary Regulation and Reform,Live - Primary,,2025-02-12 00:00:00+00:00,Live,,2025-05-21 00:00:00+00:00,Standing,,2025-05-01 00:00:00+00:00,Joint Committee on Transport,Shadow Department,Live - Primary,,2025-05-13 00:00:00+00:00,Live,,2025-05-07 00:00:00+00:00,Sessional,,2024-11-29,Dublin-West,Dublin West,Emer Currie,,,,,,,,2025-05-01 00:00:00+00:00,Joint Committee on Children and Equality,Shadow Department,Live - Primary,,2025-05-13 00:00:00+00:00,Live,,2025-05-07 00:00:00+00:00,Sessional,,,,,2025-05-01 00:00:00+00:00,Joint Committee on Children and Equality,,2024-11-29 00:00:00+00:00,Business Committee (Dáil Éireann),Parliamentary Business and Committee Membership,Live - Primary,,2024-12-18 00:00:00+00:00,Live,,2025-01-16 00:00:00+00:00,Standing,,2024-11-29 00:00:00+00:00,Committee of Selection (Dáil Éireann),Parliamentary Business and Committee Membership,Live - Primary,,2024-12-18 00:00:00+00:00,Live,,2025-01-16 00:00:00+00:00,Standing,,2025-01-29 00:00:00+00:00,Committee on Remit Oversight (Dáil Éireann),Parliamentary Regulation and Reform,Live - Primary,,2024-12-18 00:00:00+00:00,Live,,2025-05-21 00:00:00+00:00,Standing,,2025-05-01 00:00:00+00:00,Select Committee on Children and Equality,Shadow Department,Live - Primary,,2025-04-30 00:00:00+00:00,Live,,2025-05-07 00:00:00+00:00,Sessional,,,,,,,,,,,2024-11-29 00:00:00+00:00,Committee on Parliamentary Privileges and Oversight (Dáil Éireann),Parliamentary Regulation and Reform,Live - Primary,,2024-12-18 00:00:00+00:00,Live,,2025-05-21 00:00:00+00:00,Standing,,2024-11-29 00:00:00+00:00,Committee on Standing Orders and Dáil Reform,[],Parliamentary Regulation and Reform,Live - Primary,,2024-12-18 00:00:00+00:00,Live,,2025-01-16 00:00:00+00:00,Standing,,,,,,,,,,,,,,,,,,,,,,,2025-05-01 00:00:00+00:00,Select Committee on Children and Equality,,2025-05-01 00:00:00+00:00,Select Committee on Education and Youth,[],Shadow Department,Live - Primary,,2025-04-30 00:00:00+00:00,Live,2026-05-26 00:00:00+00:00,2025-05-07 00:00:00+00:00,Sessional,,2025-05-01 00:00:00+00:00,Select Committee on Transport,[],Shadow Department,Live - Primary,,2025-04-30 00:00:00+00:00,Live,,2025-05-07 00:00:00+00:00,Sessional,Committees' Secretariat,,,,,,,,,,,,,,,,,,,,,,,,,,,false,2020
Daly,,Martin-Daly.D.2024-11-29,Martin,Fianna_Fáil,,2024-11-29,Fianna Fáil,34th Dáil,house,34,dail,,2025-05-01 00:00:00+00:00,Joint Committee on Disability Matters,Shadow Department,Live - Primary,,2025-05-13 00:00:00+00:00,Live,,2025-05-07 00:00:00+00:00,Sessional,,2025-05-01 00:00:00+00:00,Joint Committee on Health,Shadow Department,Live - Primary,,2025-05-13 00:00:00+00:00,Live,,2025-05-07 00:00:00+00:00,Sessional,,2025-05-01 00:00:00+00:00,Select Committee on Disability Matters,Shadow Department,Live - Primary,,2025-04-30 00:00:00+00:00,Live,,2025-05-07 00:00:00+00:00,Sessional,,2024-11-29,Roscommon-Galway,Roscommon-Galway,Martin Daly,,,,,,,,2025-05-01 00:00:00+00:00,Select Committee on Health,Shadow Department,Live - Primary,,2025-04-30 00:00:00+00:00,Live,,2025-05-07 00:00:00+00:00,Sessional,,,,,,,,,,,,,,,,,,,,,,,,,,,,,,,,,,,,,,,,,,,,,,,,,,,,,,,,,,,,,,,,,,,,,,,,,,,,,,,,,,,,,,,,,,,,,,,,,,,,,,,,,,,,,,,,,,,,,,,,,,,,,,,,,,,,,,,,,,,,,,,,,,,,,,,,,,,,,,false,2024
Daly,,Pa-Daly.D.2020-02-08,Pa,Sinn_Féin,,2024-11-29,Sinn Féin,34th Dáil,house,34,dail,,2025-05-01 00:00:00+00:00,Joint Committee on Transport,Shadow Department,Live - Primary,,2025-05-13 00:00:00+00:00,Live,,2025-05-07 00:00:00+00:00,Sessional,,2025-05-01 00:00:00+00:00,"Joint Committee on Climate, Environment and Energy",Shadow Department,Live - Primary,,2025-05-13 00:00:00+00:00,Live,,2025-05-07 00:00:00+00:00,Sessional,,2025-05-01 00:00:00+00:00,Select Committee on Transport,Shadow Department,Live - Primary,,2025-04-30 00:00:00+00:00,Live,,2025-05-07 00:00:00+00:00,Sessional,,2024-11-29,Kerry,Kerry,Pa Daly,,,,,,,,2025-05-01 00:00:00+00:00,"Select Committee on Climate, Environment and Energy",Shadow Department,Live - Primary,,2025-04-30 00:00:00+00:00,Live,,2025-05-07 00:00:00+00:00,Sessional,,,,,,,,,,,,,,,,,,,,,,,,,,,,,,,,,,,,,,,,,,,,,,,,,,,,,,,,,,,,,,,,,,,,,,,,,,,,,,,,,,,,,,,,,,,,,,,,,,,,,,,,,,,,,,,,,,,,,,,,,,,,,,,,,,,,,,,,,,,,,,,,,,,,,,,,,,,,,,false,2020
Dempsey,,Aisling-Dempsey.D.2024-11-29,Aisling,Fianna_Fáil,,2024-11-29,Fianna Fáil,34th Dáil,house,34,dail,,2025-05-01 00:00:00+00:00,Joint Committee on Disability Matters,Shadow Department,Live - Primary,,2025-05-13 00:00:00+00:00,Live,,2026-04-16 00:00:00+00:00,Sessional,,2025-05-01 00:00:00+00:00,Joint Committee on Children and Equality,Shadow Department,Live - Primary,,2025-05-13 00:00:00+00:00,Live,,2025-05-07 00:00:00+00:00,Sessional,,2025-05-01 00:00:00+00:00,Joint Committee on Education and Youth,Shadow Department,Live - Primary,,2025-05-13 00:00:00+00:00,Live,,2025-05-07 00:00:00+00:00,Sessional,,2024-11-29,Meath-West,Meath West,Aisling Dempsey,,,,,,,,2025-05-01 00:00:00+00:00,Select Committee on Education and Youth,Shadow Department,Live - Primary,,2025-04-30 00:00:00+00:00,Live,,2025-05-07 00:00:00+00:00,Sessional,,,,,,,,2025-05-01 00:00:00+00:00,Select Committee on Disability Matters,Shadow Department,Live - Primary,,2025-04-30 00:00:00+00:00,Live,,2026-04-16 00:00:00+00:00,Sessional,,2025-05-01 00:00:00+00:00,Select Committee on Children and Equality,Shadow Department,Live - Primary,,2025-04-30 00:00:00+00:00,Live,,2025-05-07 00:00:00+00:00,Sessional,,2024-11-29 00:00:00+00:00,Committee on Standing Orders and Dáil Reform,Parliamentary Regulation and Reform,Live - Primary,,2024-12-18 00:00:00+00:00,Live,,2025-01-24 00:00:00+00:00,Standing,,,,,,,,,,,,,2025-06-19 00:00:00+00:00,Leas-Chathaoirleach,,,,,,,,,,,,,,,,,,,,,,,,,,,,,,,,,,,,,,,,2025-06-19 00:00:00+00:00,Leas-Chathaoirleach,,,,,,,,2025-05-01 00:00:00+00:00,Joint Committee on Children and Equality,,,,,,,,,,,,,,,,,,,,,,,,,,,,,,2025-05-01 00:00:00+00:00,Select Committee on Children and Equality,,,,,,,,,,,,,,,,,,,,,,,,false,2024
Devine,,Máire-Devine.S.2016-04-25,Máire,Sinn_Féin,,2024-11-29,Sinn Féin,34th Dáil,house,34,dail,,2025-05-01 00:00:00+00:00,Joint Committee on Drugs Use,Policy,Live - Primary,,2025-05-13 00:00:00+00:00,Live,,2025-05-07 00:00:00+00:00,Special,,2024-11-29 00:00:00+00:00,Committee on Budgetary Oversight,Oversight,Live - Primary,,2024-12-18 00:00:00+00:00,Live,,2025-05-07 00:00:00+00:00,Standing,,2025-05-01 00:00:00+00:00,Select Committee on Drugs Use,Policy,Live - Primary,,2025-04-30 00:00:00+00:00,Live,,2025-05-07 00:00:00+00:00,Special,,2024-11-29,Dublin-South-Central,Dublin South-Central,Máire Devine,,,,,,,,,,,,,,,,,,,,,,,,,,,,,,,,,,,,,,,,,,,,,,,,,,,,,,,,,,,,,,,,,,,,,,,,,,,,,,,,,,,,,,,,,,,,,,,,,,,,,,,,,,,,,,,,,,,,,,,,,,,,,,,,,,,,,,,,,,,,,,,,,,,,,,,,,,,,,,,,,,,,,,,,,,,,,,,false,2016
Devlin,,Cormac-Devlin.D.2020-02-08,Cormac,Fianna_Fáil,,2024-11-29,Fianna Fáil,34th Dáil,house,34,dail,,2025-01-29 00:00:00+00:00,Working Group of Committee Cathaoirligh,The Committee System and Parliamentary Administration,Live - Primary,,2025-02-12 00:00:00+00:00,Live,2025-05-07 00:00:00+00:00,2025-05-07 00:00:00+00:00,Standing,,2025-05-01 00:00:00+00:00,Joint Committee on the Implementation of the Good Friday Agreement ,Shadow Department,Live - Primary,,2025-05-12 00:00:00+00:00,Live,,2025-05-07 00:00:00+00:00,Sessional,,2025-05-01 00:00:00+00:00,Select Committee on the Implementation of the Good Friday Agreement ,Shadow Department,Live - Primary,,2025-04-30 00:00:00+00:00,Live,,2025-05-07 00:00:00+00:00,Sessional,,2024-11-29,Dún-Laoghaire,Dún Laoghaire,Cormac Devlin,,,,,2025-05-07 00:00:00+00:00,Cathaoirleach,,2024-11-29 00:00:00+00:00,Committee on Standing Orders and Dáil Reform,Parliamentary Regulation and Reform,Live - Primary,,2024-12-18 00:00:00+00:00,Live,,2025-01-24 00:00:00+00:00,Standing,,,,,,,,2024-11-29 00:00:00+00:00,Committee on Budgetary Oversight,Oversight,Live - Primary,,2024-12-18 00:00:00+00:00,Live,,2025-05-07 00:00:00+00:00,Standing,,,,,,,,,,,,,,,,,,,,,,,,,,,,,,,,,,,2025-05-07 00:00:00+00:00,Cathaoirleach,,,,,,,,,,,,,,,,,,,,,,,,,,,,,,,,,,,,,,,,,,,,,,,,,,,,,,,,,,,,,,,,,,,,,,,,,,,,,,,,,,,,,,,,,,,,,,,,,,,,,,,,,false,2020
Dillon,,Alan-Dillon.D.2020-02-08,Alan,Fine_Gael,,2024-11-29,Fine Gael,34th Dáil,house,34,dail,,,,,,,,,,,,,,,,,,,,,,,,,,,,,,,,,,,2024-11-29,Mayo,Mayo,Alan Dillon,,,,,,,,,,,,,,,,,,,,,,,,,,,,,,,,,,,,,,,,,,,,,,,,,,,,,,,,,,,,,,,,,,,,,,,,,,,,,,,,,,,,,,,,,,,,,,,,,,,,"Minister of State at the Department of Enterprise, Trade and Employment and at the Department of the Environment, Climate and Communications",2025-06-01,2025-01-29,"Minister of State at the Department of Enterprise, Tourism and Employment and at the Department of Climate, Energy and the Environment",,2025-06-02,,,,,,,,,,,,,,,,,,,,,,,,,,,,,,,,,,,,,,,,,,,,,,,,,,,,,,,,,,,,,,,,,,,,,,true,2020
Doherty,,Pearse-Doherty.S.2007-07-23,Pearse,Sinn_Féin,,2024-11-29,Sinn Féin,34th Dáil,house,34,dail,,2025-05-01 00:00:00+00:00,"Joint Committee on Finance, Public Expenditure, Public Service Reform and Digitalisation, and Taoiseach",Shadow Department,Live - Primary,,2025-05-07 00:00:00+00:00,Live,,2025-05-07 00:00:00+00:00,Sessional,,2025-05-01 00:00:00+00:00,"Select Committee on Finance, Public Expenditure, Public Service Reform and Digitalisation, and Taoiseach",Shadow Department,Live - Primary,,2025-04-30 00:00:00+00:00,Live,,2025-05-07 00:00:00+00:00,Sessional,,,,,,,,,,,,,2024-11-29,Donegal,Donegal,Pearse Doherty,,,,,,,,,,,,,,,,,,,,,,,,,,,,,,,,,,,,,,,,,,,,,,,,,,,,,,,,,,,,,,,,,,,,,,,,,,,,,,,,,,,,,,,,,,,,,,,,,,,,,,,,,,,,,,,,,,,,,,,,,,,,,,,,,,,,,,,,,,,,,,,,,,,,,,,,,,,,,,,,,,,,,,,,,,,,,,,false,2007
Dolan,,Albert-Dolan.D.2024-11-29,Albert,Fianna_Fáil,,2024-11-29,Fianna Fáil,34th Dáil,house,34,dail,,2025-05-01 00:00:00+00:00,"Joint Committee on Enterprise, Tourism and Employment",Shadow Department,Live - Primary,,2025-05-13 00:00:00+00:00,Live,,2025-05-07 00:00:00+00:00,Sessional,,2025-01-29 00:00:00+00:00,Joint Committee on Public Petitions and the Ombudsmen,Oversight,Live - Primary,,2025-02-12 00:00:00+00:00,Live,2026-04-16 00:00:00+00:00,2025-05-07 00:00:00+00:00,Standing,,2025-05-01 00:00:00+00:00,"Joint Committee on Justice, Home Affairs and Migration",Shadow Department,Live - Primary,,2025-05-13 00:00:00+00:00,Live,,2026-01-28 00:00:00+00:00,Sessional,,2024-11-29,Galway-East,Galway East,Albert Dolan,,,,,,,,2025-05-01 00:00:00+00:00,"Select Committee on Justice, Home Affairs and Migration",Shadow Department,Live - Primary,,2025-04-30 00:00:00+00:00,Live,,2026-01-28 00:00:00+00:00,Sessional,,,,,,,,2025-05-01 00:00:00+00:00,"Select Committee on Enterprise, Tourism and Employment",Shadow Department,Live - Primary,,2025-04-30 00:00:00+00:00,Live,,2025-05-07 00:00:00+00:00,Sessional,,2025-01-29 00:00:00+00:00,Select Committee on Public Petitions and the Ombudsmen,Oversight,Live - Primary,,2025-02-12 00:00:00+00:00,Live,2026-04-16 00:00:00+00:00,2025-05-07 00:00:00+00:00,Standing,,2024-11-29 00:00:00+00:00,Committee of Public Accounts,Oversight,Live - Primary,,2024-12-18 00:00:00+00:00,Live,,2025-05-07 00:00:00+00:00,Standing,,,,,,,,,,,,2026-04-16 00:00:00+00:00,2025-05-27 00:00:00+00:00,Leas-Chathaoirleach,,,,,,,,,,,,,,,,,,,,,,,,,,,,,,,,,,,,,,,,,,,,,,,,,,,,,,,,,,,,,,,,,,,,,,,,,,,,,,,,,,,,,,,,,,,,,,,,,,,,,,,,,false,2024
Donnelly,,Paul-Donnelly.D.2020-02-08,Paul,Sinn_Féin,,2024-11-29,Sinn Féin,34th Dáil,house,34,dail,,2025-05-01 00:00:00+00:00,"Joint Committee on Enterprise, Tourism and Employment",Shadow Department,Live - Primary,,2025-05-13 00:00:00+00:00,Live,,2025-05-07 00:00:00+00:00,Sessional,,2025-05-01 00:00:00+00:00,"Select Committee on Enterprise, Tourism and Employment",Shadow Department,Live - Primary,,2025-04-30 00:00:00+00:00,Live,,2025-05-07 00:00:00+00:00,Sessional,,,,,,,,,,,,,2024-11-29,Dublin-West,Dublin West,Paul Donnelly,,,,,,,,,,,,,,,,,,,,,,,,,,,,,,,,,,,,,,,,,,,,,,,,,,,,,,,,,,,,,,,,,,,,,,,,,,,,,,,,,,,,,,,,,,,,,,,,,,,,,,,,,,,,,,,,,,,,,,,,,,,,,,,,,,,,,,,,,,,,,,,,,,,,,,,,,,,,,,,,,,,,,,,,,,,,,,,false,2020
Donohoe,,Paschal-Donohoe.S.2007-07-23,Paschal,Fine_Gael,2025-11-21,2024-11-29,Fine Gael,34th Dáil,house,34,dail,,,,,,,,,,,,,,,,,,,,,,,,,,,,,,,,,,2025-11-21,2024-11-29,Dublin-Central,Dublin Central,Paschal Donohoe,,,,,,,,,,,,,,,,,,,,,,,,,,,,,,,,,,,,,,,,,,,,,,,,,,,,,,,,,,,,,,,,,,,,,,,,,,,,,,,,,,,,,,,,,,,,,,,,,,,,Minister for Finance,2025-11-18,2025-01-23,,,,,,,,,,,,,,,,,,,,,,,,,,,,,,,,,,,,,,,,,,,,,,,,,,,,,,,,,,,,,,,,,,,,,,,,,true,2007
Dooley,,Timmy-Dooley.S.2002-09-12,Timmy,Fianna_Fáil,,2024-11-29,Fianna Fáil,34th Dáil,house,34,dail,,,,,,,,,,,,,,,,,,,,,,,,,,,,,,,,,,,2024-11-29,Clare,Clare,Timmy Dooley,,,,,,,,,,,,,,,,,,,,,,,,,,,,,,,,,,,,,,,,,,,,,,,,,,,,,,,,,,,,,,,,,,,,,,,,,,,,,,,,,,,,,,,,,,,,,,,,,,,,"Minister of State at the Department of Agriculture, Food and the Marine and at the Department of Climate, Energy and the Environment",,2025-06-02,"Minister of State at the Department of Agriculture, Food and the Marine and at the Department of the Environment, Climate and Communications",2025-06-01,2025-02-25,,,,,,,,,,,,,,,,,,,,,,,,,,,,,,,,,,,,,,,,,,,,,,,,,,,,,,,,,,,,,,,,,,,,,,true,2002
