Standing,2025-02-12 00:00:00+00:00,,Joint Committee on Remit Oversight,2025-01-29 00:00:00+00:00,,Parliamentary Regulation and Reform,2025-05-21 00:00:00+00:00,,Live - Primary,Live,Standing,2024-12-18 00:00:00+00:00,,Committee on Parliamentary Privileges and Oversight (Dáil Éireann),2024-11-29 00:00:00+00:00,,Parliamentary Regulation and Reform,2025-05-21 00:00:00+00:00,,Live - Primary,Live,Standing,2024-12-18 00:00:00+00:00,,Committee on Remit Oversight (Dáil Éireann),2025-01-29 00:00:00+00:00,,Parliamentary Regulation and Reform,2025-05-21 00:00:00+00:00,,Live - Primary,Live,Fianna Fáil,Fianna_Fáil,2024-11-29,,Carlow-Kilkenny,Carlow-Kilkenny,34th Dáil,dail,house,34,2024-11-29,,John,John-McGuinness.D.1997-06-26,McGuinness,,John McGuinness,,,,,,,,,,,,,,,,,,Leas-Cheann Comhairle,2025-02-19,,,,,,,,,,,,,,,,,,,,,,,,,,,,,,,,,,,,,,,,,,,,,,,,,,,,,,,,,,,,,,,,,,,,,,,,,,,,,,,,,,,,,,,,,,,,,,,,,,,,,,,,,,,,,,,,,,,,,,,,,,,,,,,,,,,,,,,,,,,,,,,,,,,,,,,,,,,,false,1997
Standing,2025-02-12 00:00:00+00:00,,Joint Committee on Remit Oversight,2025-01-29 00:00:00+00:00,,Parliamentary Regulation and Reform,2025-05-21 00:00:00+00:00,,Live - Primary,Live,Standing,2024-12-18 00:00:00+00:00,,Committee on Standing Orders and Dáil Reform,2024-11-29 00:00:00+00:00,,Parliamentary Regulation and Reform,2025-01-24 00:00:00+00:00,,Live - Primary,Live,Standing,2024-12-18 00:00:00+00:00,,Committee on Parliamentary Privileges and Oversight (Dáil Éireann),2024-11-29 00:00:00+00:00,,Parliamentary Regulation and Reform,2025-05-21 00:00:00+00:00,,Live - Primary,Live,Sinn Féin,Sinn_Féin,2024-11-29,,Dublin-Bay-North,Dublin Bay North,34th Dáil,dail,house,34,2024-11-29,,Denise,Denise-Mitchell.D.2016-10-03,Mitchell,,Denise Mitchell,,,,,,,Standing,2024-12-18 00:00:00+00:00,,Committee on Remit Oversight (Dáil Éireann),2025-01-29 00:00:00+00:00,,Parliamentary Regulation and Reform,2025-05-21 00:00:00+00:00,,Live - Primary,Live,,,,,,,,,,,,,,,,,,,,,,,,,,,,,,,,,,,,,,,,,,,,,,,,,,,,,,,,,,,,,,,,,,,,,,,,,,,,,,,,,,,,,,,,,,,,,,,,,,,,,,,,,,,,,,,,,,,,,,,,,,,,,,,,,,,,,,,,,,,,,,,,,,,,,,,,,,,,,,false,2016
,,,,,,,,,,,,,,,,,,,,,,,,,,,,,,,,,Independent,Independent,2024-11-29,,Longford-Westmeath,Longford-Westmeath,34th Dáil,dail,house,34,2024-11-29,,Kevin Boxer,Kevin-Boxer-Moran.D.2016-10-03,Moran,,Kevin Boxer Moran,,,,,,,,,,,,,,,,,,"Minister of State at the Department of Public Expenditure, National Development Plan Delivery and Reform",2025-01-29,2025-06-04,,,,,,,,,,,,,,,,,,,,,,,,,,,,,,,,,,,,,,,,,,,,,,,,,,,,,,,,,,,,,,,,,,,,,,,,,,,,,,,,,,,"Minister of State at the Department of Public Expenditure, Infrastructure, Public Service Reform and Digitalisation",2025-06-05,,,,,,,,,,,,,,,,,,,,,,,,,,,,,,,,,,,,,,,,,,,,,,,,,,,,,,,,,,,,,,,,,,,,,,,true,2016
Sessional,2025-05-07 00:00:00+00:00,,"Joint Committee on Finance, Public Expenditure, Public Service Reform and Digitalisation, and Taoiseach",2025-05-01 00:00:00+00:00,,Shadow Department,2025-05-07 00:00:00+00:00,2026-01-20 00:00:00+00:00,Live - Primary,Live,Standing,2025-02-12 00:00:00+00:00,,Working Group of Committee Cathaoirligh,2025-01-29 00:00:00+00:00,,The Committee System and Parliamentary Administration,2025-05-07 00:00:00+00:00,,Live - Primary,Live,Sessional,2025-05-07 00:00:00+00:00,,Joint Committee on Agriculture and Food,2025-05-01 00:00:00+00:00,,Shadow Department,2025-05-07 00:00:00+00:00,,Live - Primary,Live,Fianna Fáil,Fianna_Fáil,2024-11-29,,Cork-North-West,Cork North-West,34th Dáil,dail,house,34,2024-11-29,,Aindrias,Aindrias-Moynihan.D.2016-10-03,Moynihan,,Aindrias Moynihan,,,,Cathaoirleach,2025-05-07 00:00:00+00:00,,Sessional,2025-04-30 00:00:00+00:00,,Select Committee on Agriculture and Food,2025-05-01 00:00:00+00:00,,Shadow Department,2025-05-07 00:00:00+00:00,,Live - Primary,Live,,,,,,,,,,Standing,2024-12-18 00:00:00+00:00,,Committee on Budgetary Oversight,2024-11-29 00:00:00+00:00,,Oversight,2026-01-20 00:00:00+00:00,,Live - Primary,Live,Sessional,2025-04-30 00:00:00+00:00,,"Select Committee on Finance, Public Expenditure, Public Service Reform and Digitalisation, and Taoiseach",2025-05-01 00:00:00+00:00,,Shadow Department,2025-05-07 00:00:00+00:00,2026-01-20 00:00:00+00:00,Live - Primary,Live,Standing transitional,2025-01-23 00:00:00+00:00,2025-05-07 00:00:00+00:00,Select Committee on Subsidiarity (European Union Legislative Scrutiny),2025-01-21 16:29:34.896666+00:00,,Shadow Department,2025-02-13 00:00:00+00:00,2025-05-07 00:00:00+00:00,Dissolved,Dissolved,,,,,,,,,,,,,,,Cathaoirleach,2025-05-07 00:00:00+00:00,,,,,,,,,,,,,,,,,,,,,,,,,,,,,,,,,,,,,,,,,,,,,,,,,,,,,,,,,,,,,,,,,,,,,,,,,,,,,,,,,,,,,,,,,,,,,,,,,,,,false,2016
,,,,,,,,,,,,,,,,,,,,,,,,,,,,,,,,,Fianna Fáil,Fianna_Fáil,2024-11-29,,Cork-North-West,Cork North-West,34th Dáil,dail,house,34,2024-11-29,,Michael,Michael-Moynihan.D.1997-06-26,Moynihan,,Michael Moynihan,,,,,,,,,,,,,,,,,,Minister of State at the Department of Education and Youth,2025-05-02,,,,,,,,,,,,,,,,,,,,,,,,,,,,,,,,,,,,,,,,,,,,,,,,,,,,,,,,,,,,,,,,,,,,,,,,,,,,,,,,,,,,Minister of State at the Department of Education,2025-01-29,2025-05-01,,,,,,,,,,,,,,,,,,,,,,,,,,,,,,,,,,,,,,,,,,,,,,,,,,,,,,,,,,,,,,,,,,,,,,true,1997
Standing,2025-02-12 00:00:00+00:00,,"Comhchoiste na Gaeilge, na Gaeltachta agus Phobal Labhartha na Gaeilge",2025-01-29 00:00:00+00:00,,Policy,2025-05-07 00:00:00+00:00,,Live - Primary,Live,Sessional,2025-05-13 00:00:00+00:00,,Joint Committee on Transport,2025-05-01 00:00:00+00:00,,Shadow Department,2025-05-07 00:00:00+00:00,,Live - Primary,Live,Sessional,2025-05-12 00:00:00+00:00,,Joint Committee on the Implementation of the Good Friday Agreement ,2025-05-01 00:00:00+00:00,,Shadow Department,2025-05-07 00:00:00+00:00,,Live - Primary,Live,Fianna Fáil,Fianna_Fáil,2024-11-29,,Dublin-Mid-West,Dublin Mid-West,34th Dáil,dail,house,34,2024-11-29,,Shane,Shane-Moynihan.D.2024-11-29,Moynihan,,Shane Moynihan,,,,,,,Standing,2025-02-12 00:00:00+00:00,,"Roghchoiste na Gaeilge, na Gaeltachta agus Phobal Labhartha na Gaeilge",2025-01-29 00:00:00+00:00,,Policy,2025-05-07 00:00:00+00:00,,Live - Primary,Live,,,,,,,,,,Sessional,2025-04-30 00:00:00+00:00,,Select Committee on Transport,2025-05-01 00:00:00+00:00,,Shadow Department,2025-05-07 00:00:00+00:00,,Live - Primary,Live,Sessional,2025-04-30 00:00:00+00:00,,Select Committee on the Implementation of the Good Friday Agreement ,2025-05-01 00:00:00+00:00,,Shadow Department,2025-05-07 00:00:00+00:00,,Live - Primary,Live,,,,,,,,,,,,,,,,,,,,,,,Leas-Chathaoirleach,2025-05-28 00:00:00+00:00,,,,,,,,,,,,,,,,,,,,,,,,,,,,,,,,,,Leas-Chathaoirleach,2025-05-28 00:00:00+00:00,,,,,,,,,,,,,,,,,,,,,,,,,,,,,,,,,,,,,,,,,,,,,,,,,,,,,,,,,,,,,,,,,,,,false,2024
,,,,,,,,,,,,,,,,,,,,,,,,,,,,,,,,,Fianna Fáil,Fianna_Fáil,2024-11-29,,Carlow-Kilkenny,Carlow-Kilkenny,34th Dáil,dail,house,34,2024-11-29,,Jennifer,Jennifer-Murnane-O'Connor.S.2016-04-25,Murnane O'Connor,,Jennifer Murnane O'Connor,,,,,,,,,,,,,,,,,,Minister of State at the Department of Health,2025-01-29,,,,,,,,,,,,,,,,,,,,,,,,,,,,,,,,,,,,,,,,,,,,,,,,,,,,,,,,,,,,,,,,,,,,,,,,,,,,,,,,,,,,,,,,,,,,,,,,,,,,,,,,,,,,,,,,,,,,,,,,,,,,,,,,,,,,,,,,,,,,,,,,,,,,,,,,,,,,true,2016
Standing,2025-02-12 00:00:00+00:00,,Working Group of Committee Cathaoirligh,2025-01-29 00:00:00+00:00,,The Committee System and Parliamentary Administration,2025-05-07 00:00:00+00:00,,Live - Primary,Live,Sessional,2025-05-13 00:00:00+00:00,,Joint Committee on Transport,2025-05-01 00:00:00+00:00,,Shadow Department,2025-05-07 00:00:00+00:00,,Live - Primary,Live,Standing,2025-02-12 00:00:00+00:00,,Joint Committee on Public Petitions and the Ombudsmen,2025-01-29 00:00:00+00:00,,Oversight,2025-05-07 00:00:00+00:00,2026-05-26 00:00:00+00:00,Live - Primary,Live,Fine Gael,Fine_Gael,2024-11-29,,Tipperary-South,Tipperary South,34th Dáil,dail,house,34,2024-11-29,,Michael,Michael-Murphy.D.2024-11-29,Murphy,,Michael Murphy,,,,,,,Sessional,2025-05-13 00:00:00+00:00,,Joint Committee on European Union Affairs,2025-05-01 00:00:00+00:00,,Shadow Department,2025-05-07 00:00:00+00:00,,Live - Primary,Live,,,,,,,,,,Sessional,2025-04-30 00:00:00+00:00,,Select Committee on Transport,2025-05-01 00:00:00+00:00,,Shadow Department,2025-05-07 00:00:00+00:00,,Live - Primary,Live,Standing,2025-02-12 00:00:00+00:00,,Select Committee on Public Petitions and the Ombudsmen,2025-01-29 00:00:00+00:00,,Oversight,2025-05-07 00:00:00+00:00,2026-05-26 00:00:00+00:00,Live - Primary,Live,Standing transitional,2025-01-23 00:00:00+00:00,2025-05-07 00:00:00+00:00,Select Committee on Subsidiarity (European Union Legislative Scrutiny),2025-01-21 16:29:34.896666+00:00,,Shadow Department,2025-02-13 00:00:00+00:00,2025-05-07 00:00:00+00:00,Dissolved,Dissolved,Sessional,2025-04-30 00:00:00+00:00,,Select Committee on European Union Affairs,2025-05-01 00:00:00+00:00,,Shadow Department,2025-05-07 00:00:00+00:00,,Live - Primary,Live,Cathaoirleach,2025-05-07 00:00:00+00:00,,,,,,,,,,,,,,,,,,,,,,,,,,,,,,,,,,Cathaoirleach,2025-05-07 00:00:00+00:00,,,,,,,,,,,,,,,,,,,,,,,,,,,,,,,,,,,,,,,,,,,,,,,,,,,,,,,,,,,,,,,,,,,,false,2024
Sessional,2025-05-13 00:00:00+00:00,,"Joint Committee on Further and Higher Education, Research, Innovation and Science",2025-05-01 00:00:00+00:00,,Shadow Department,2025-05-07 00:00:00+00:00,2026-02-05 00:00:00+00:00,Live - Primary,Live,Special,2025-05-12 00:00:00+00:00,,Joint Committee on Artificial Intelligence,2025-05-01 00:00:00+00:00,,Policy,2025-05-07 00:00:00+00:00,,Live - Primary,Live,Sessional,2025-04-30 00:00:00+00:00,,"Select Committee on Further and Higher Education, Research, Innovation and Science",2025-05-01 00:00:00+00:00,,Shadow Department,2025-05-07 00:00:00+00:00,2026-02-05 00:00:00+00:00,Live - Primary,Live,People Before Profit-Solidarity,People_Before_Profit_Solidarity,2024-11-29,,Dublin-South-West,Dublin South-West,34th Dáil,dail,house,34,2024-11-29,,Paul,Paul-Murphy.D.2014-10-10,Murphy,,Paul Murphy,,,,,,,Special,2025-04-30 00:00:00+00:00,,Select Committee on Artificial Intelligence,2025-05-01 00:00:00+00:00,,Policy,2025-05-07 00:00:00+00:00,,Live - Primary,Live,,,,,,,,,,Standing,2024-12-18 00:00:00+00:00,,Committee on Standing Orders and Dáil Reform,2024-11-29 00:00:00+00:00,,Parliamentary Regulation and Reform,2025-01-24 00:00:00+00:00,,Live - Primary,Live,Standing,2024-12-18 00:00:00+00:00,,Committee of Public Accounts,2024-11-29 00:00:00+00:00,,Oversight,2025-11-26 00:00:00+00:00,,Live - Primary,Live,Standing transitional,2025-01-23 00:00:00+00:00,2025-05-07 00:00:00+00:00,Select Committee on Subsidiarity (European Union Legislative Scrutiny),2025-01-21 16:29:34.896666+00:00,,Shadow Department,2025-02-13 00:00:00+00:00,2025-05-07 00:00:00+00:00,Dissolved,Dissolved,,,,,,,,,,,,,,,,,,,,,,,,,,,,,,,,,,,,,,,,,,,,,,,,,,,,,,,,,,,,,,,,,,,,,,,,,,,,,,,,,,,,,,,,,,,,,,,,,,,,,,,,,,,,,,,,,,,,false,2014
Standing,2025-02-12 00:00:00+00:00,,Working Group of Committee Cathaoirligh,2025-01-29 00:00:00+00:00,,The Committee System and Parliamentary Administration,2024-12-18 00:00:00+00:00,2025-02-13 00:00:00+00:00,Live - Primary,Live,Standing,2025-02-12 00:00:00+00:00,,Joint Committee on Remit Oversight,2025-01-29 00:00:00+00:00,,Parliamentary Regulation and Reform,2024-12-18 00:00:00+00:00,,Live - Primary,Live,Standing,2024-12-18 00:00:00+00:00,,Committee on Parliamentary Privileges and Oversight (Dáil Éireann),2024-11-29 00:00:00+00:00,,Parliamentary Regulation and Reform,2024-12-18 00:00:00+00:00,,Live - Primary,Live,Independent,Independent,2024-11-29,,Wexford,Wexford,34th Dáil,dail,house,34,2024-11-29,,Verona,Verona-Murphy.D.2020-02-08,Murphy,,Verona Murphy,,,,Cathaoirleach,2024-12-18 00:00:00+00:00,,Standing,2024-12-18 00:00:00+00:00,,Business Committee (Dáil Éireann),2024-11-29 00:00:00+00:00,,Parliamentary Business and Committee Membership,2024-12-18 00:00:00+00:00,,Live - Primary,Live,Ceann Comhairle,2024-12-18,,,,,,,,Standing,2024-12-18 00:00:00+00:00,,Committee on Remit Oversight (Dáil Éireann),2025-01-29 00:00:00+00:00,,Parliamentary Regulation and Reform,2024-12-18 00:00:00+00:00,,Live - Primary,Live,Standing,2024-12-18 00:00:00+00:00,,Committee of Selection (Dáil Éireann),2024-11-29 00:00:00+00:00,,Parliamentary Business and Committee Membership,2024-12-18 00:00:00+00:00,,Live - Primary,Live,Standing,2024-12-18 00:00:00+00:00,,Committee on Standing Orders and Dáil Reform,2024-11-29 00:00:00+00:00,,Parliamentary Regulation and Reform,2024-12-18 00:00:00+00:00,,Live - Primary,Live,,,,,,,,,,,,Cathaoirleach,2024-12-18 00:00:00+00:00,,Cathaoirleach,2024-12-18 00:00:00+00:00,,Cathaoirleach,2024-12-18 00:00:00+00:00,,,,,,,,,,,,,,,,,,,,,,,,,,,,Cathaoirleach,2024-12-18 00:00:00+00:00,,Cathaoirleach,2024-12-18 00:00:00+00:00,,,,,,,,,,,,,,,,,,,,,,,,,,,,,,,,,,,,,,,,,,,,,,,,,,,,,,,,,,,,,,,,,false,2020
Special,2025-05-12 00:00:00+00:00,,Joint Committee on Artificial Intelligence,2025-05-01 00:00:00+00:00,,Policy,2025-05-07 00:00:00+00:00,,Live - Primary,Live,Special,2025-04-30 00:00:00+00:00,,Select Committee on Artificial Intelligence,2025-05-01 00:00:00+00:00,,Policy,2025-05-07 00:00:00+00:00,,Live - Primary,Live,,,,,,,,,,,,Sinn Féin,Sinn_Féin,2024-11-29,,Wexford,Wexford,34th Dáil,dail,house,34,2024-11-29,,Johnny,Johnny-Mythen.D.2020-02-08,Mythen,,Johnny Mythen,,,,,,,,,,,,,,,,,,,,,,,,,,,,,,,,,,,,,,,,,,,,,,,,,,,,,,,,,,,,,,,,,,,,,,,,,,,,,,,,,,,,,,,,,,,,,,,,,,,,,,,,,,,,,,,,,,,,,,,,,,,,,,,,,,,,,,,,,,,,,,,,,,,,,,,,,,,,,,,,,,,,,,,,,,,,,,,false,2020
Sessional,2025-05-07 00:00:00+00:00,,"Joint Committee on Finance, Public Expenditure, Public Service Reform and Digitalisation, and Taoiseach",2025-05-01 00:00:00+00:00,,Shadow Department,2025-05-07 00:00:00+00:00,,Live - Primary,Live,Standing,2025-02-12 00:00:00+00:00,,Joint Committee on Remit Oversight,2025-01-29 00:00:00+00:00,,Parliamentary Regulation and Reform,2025-05-21 00:00:00+00:00,,Live - Primary,Live,Sessional,2025-04-30 00:00:00+00:00,,"Select Committee on Finance, Public Expenditure, Public Service Reform and Digitalisation, and Taoiseach",2025-05-01 00:00:00+00:00,,Shadow Department,2025-05-07 00:00:00+00:00,,Live - Primary,Live,Labour Party,Labour_Party,2024-11-29,,Louth,Louth,34th Dáil,dail,house,34,2024-11-29,,Ged,Gerald-Nash.D.2011-03-09,Nash,,Ged Nash,,,,,,,Standing,2024-12-18 00:00:00+00:00,,Committee on Parliamentary Privileges and Oversight (Dáil Éireann),2024-11-29 00:00:00+00:00,,Parliamentary Regulation and Reform,2025-05-21 00:00:00+00:00,,Live - Primary,Live,,,,,,,,,,Standing,2024-12-18 00:00:00+00:00,,Committee on Budgetary Oversight,2024-11-29 00:00:00+00:00,,Oversight,2025-05-07 00:00:00+00:00,,Live - Primary,Live,Standing,2024-12-18 00:00:00+00:00,,Committee on Remit Oversight (Dáil Éireann),2025-01-29 00:00:00+00:00,,Parliamentary Regulation and Reform,2025-05-21 00:00:00+00:00,,Live - Primary,Live,,,,,,,,,,,,,,,,,,,,,,,,,,,,,,,,,,,,,,,,,,,,,,,,,,,,,,,,,,,,,,,,,,,,,,,,,,,,,,,,,,,,,,,,,,,,,,,,,,,,,,,,,,,,,,,,,,,,,,,,,,,,,,,false,2011
,,,,,,,,,,,,,,,,,,,,,,,,,,,,,,,,,Fine Gael,Fine_Gael,2024-11-29,,Galway-West,Galway West,34th Dáil,dail,house,34,2024-11-29,,Hildegarde,Hildegarde-Naughton.S.2013-07-19,Naughton,,Hildegarde Naughton,,,,,,,,,,,,,,,,,,"Minister of State at the Department of Children, Equality, Disability, Integration and Youth with responsibility for Disability",2025-01-23,2025-05-01,,,,,,,,,,,,,,,,,,,,,,,,,,,,,,,,,,,,,,,,,,,,,,,,,,,,,,,,,,,,,,,,,,,,,,,,,,,,,,,,,,,"Minister of State at the Department of Children, Disability and Equality",2025-05-02,2025-11-18,,,,,,,Minister for Education and Youth,2025-11-18,,,,,,,,,,,,,,,,,,,,,,,,,,,,,,,,,,,,,,,,,,,,,,,,,,,,,,,,,,,,,,true,2013
Sessional,2025-05-07 00:00:00+00:00,,Joint Committee on Infrastructure and National Development Plan Delivery,2025-05-01 00:00:00+00:00,,Shadow Department,2025-05-07 00:00:00+00:00,,Live - Primary,Live,Standing,2024-12-18 00:00:00+00:00,,Committee on Budgetary Oversight,2024-11-29 00:00:00+00:00,,Oversight,2025-05-07 00:00:00+00:00,,Live - Primary,Live,Standing,2024-12-18 00:00:00+00:00,,Committee of Public Accounts,2024-11-29 00:00:00+00:00,,Oversight,2025-05-07 00:00:00+00:00,,Live - Primary,Live,Fine Gael,Fine_Gael,2024-11-29,,Kildare-North,Kildare North,34th Dáil,dail,house,34,2024-11-29,,Joe,Joe-Neville.D.2024-11-29,Neville,,Joe Neville,Leas-Chathaoirleach,2025-05-28 00:00:00+00:00,,,,,Sessional,2025-04-30 00:00:00+00:00,,Select Committee on Infrastructure and National Development Plan Delivery,2025-05-01 00:00:00+00:00,,Shadow Department,2025-05-07 00:00:00+00:00,,Live - Primary,Live,,,,,,,,,,,,,,,,,,,,,,,,,,,,,,,,,,,,,,,,,,,,,,,,,,,,,,,,,Leas-Chathaoirleach,2025-05-28 00:00:00+00:00,,,,,,,,,,,,,,,,,,,,,,,,,,,,,,,,,,,,,,,,,,,,,,,,,,,,,,,,,,,,,,,,,,,,,,,,,,,,,,,,,,,,,,,,,,,,,,,,,,,,false,2024
Sessional,2025-05-07 00:00:00+00:00,,Joint Committee on Agriculture and Food,2025-05-01 00:00:00+00:00,,Shadow Department,2025-05-07 00:00:00+00:00,,Live - Primary,Live,Sessional,2025-04-30 00:00:00+00:00,,Select Committee on Agriculture and Food,2025-05-01 00:00:00+00:00,,Shadow Department,2025-05-07 00:00:00+00:00,,Live - Primary,Live,,,,,,,,,,,,Sinn Féin,Sinn_Féin,2024-11-29,,Carlow-Kilkenny,Carlow-Kilkenny,34th Dáil,dail,house,34,2024-11-29,,Natasha,Natasha-Newsome-Drennan.D.2024-11-29,Newsome Drennan,,Natasha Newsome Drennan,,,,,,,,,,,,,,,,,,,,,,,,,,,,,,,,,,,,,,,,,,,,,,,,,,,,,,,,,,,,,,,,,,,,,,,,,,,,,,,,,,,,,,,,,,,,,,,,,,,,,,,,,,,,,,,,,,,,,,,,,,,,,,,,,,,,,,,,,,,,,,,,,,,,,,,,,,,,,,,,,,,,,,,,,,,,,,,false,2024
,,,,,,,,,,,,,,,,,,,,,,,,,,,,,,,,,Independent,Independent,2024-11-29,,Offaly,Offaly,34th Dáil,dail,house,34,2024-11-29,,Carol,Carol-Nolan.D.2016-10-03,Nolan,,Carol Nolan,,,,,,,,,,,,,,,,,,,,,,,,,,,,,,,,,,,,,,,,,,,,,,,,,,,,,,,,,,,,,,,,,,,,,,,,,,,,,,,,,,,,,,,,,,,,,,,,,,,,,,,,,,,,,,,,,,,,,,,,,,,,,,,,,,,,,,,,,,,,,,,,,,,,,,,,,,,,,,,,,,,,,,,,,,,,,,,false,2016
Standing,2025-02-12 00:00:00+00:00,,"Comhchoiste na Gaeilge, na Gaeltachta agus Phobal Labhartha na Gaeilge",2025-01-29 00:00:00+00:00,,Policy,2025-05-07 00:00:00+00:00,,Live - Primary,Live,Sessional,2025-05-13 00:00:00+00:00,,Joint Committee on Education and Youth,2025-05-01 00:00:00+00:00,,Shadow Department,2025-05-07 00:00:00+00:00,,Live - Primary,Live,Standing,2025-02-12 00:00:00+00:00,,"Roghchoiste na Gaeilge, na Gaeltachta agus Phobal Labhartha na Gaeilge",2025-01-29 00:00:00+00:00,,Policy,2025-05-07 00:00:00+00:00,,Live - Primary,Live,Sinn Féin,Sinn_Féin,2024-11-29,,Kildare-South,Kildare South,34th Dáil,dail,house,34,2024-11-29,,Shónagh,Shónagh-Ní-Raghallaigh.D.2024-11-29,Ní Raghallaigh,,Shónagh Ní Raghallaigh,,,,,,,Sessional,2025-04-30 00:00:00+00:00,,Select Committee on Education and Youth,2025-05-01 00:00:00+00:00,,Shadow Department,2025-05-07 00:00:00+00:00,,Live - Primary,Live,,,,,,,,,,,,,,,,,,,,,,,,,,,,,,,,,,,,,,,,,,,,,,,,,,,,,,,,,,,,,,,,,,,,,,,,,,,,,,,,,,,,,,,,,,,,,,,,,,,,,,,,,,,,,,,,,,,,,,,,,,,,,,,,,,,,,,,,,,,,,,,,,,,,,,,,,,,,,,false,2024
,,,,,,,,,,,,,,,,,,,,,,,,,,,,,,,,,Fianna Fáil,Fianna_Fáil,2024-11-29,,Dublin-Fingal-East,Dublin Fingal East,34th Dáil,dail,house,34,2024-11-29,,Darragh,Darragh-O'Brien.D.2007-06-14,O'Brien,,Darragh O'Brien,,,,,,,,,,,,,,,,,,"Minister for Environment, Climate and Communications",2025-01-23,2025-06-01,,,,,,,,,,,,,,,,,,,,,,,,,,,,,,,,,,,,,,,,,,,,,,,,,,,,,,,,,,,,,,,,,,,,,,,,,,,,,,,,,,,Minister for Transport,2025-06-02,,,,,,,,"Minister for Climate, Energy and the Environment",2025-06-02,,Minister for Transport,2025-01-23,2025-06-01,,,,,,,,,,,,,,,,,,,,,,,,,,,,,,,,,,,,,,,,,,,,,,,,,,,,,,,,,,true,2007
Sessional,2025-05-07 00:00:00+00:00,,"Joint Committee on Finance, Public Expenditure, Public Service Reform and Digitalisation, and Taoiseach",2025-05-01 00:00:00+00:00,,Shadow Department,2025-05-07 00:00:00+00:00,,Live - Primary,Live,Standing,2024-12-18 00:00:00+00:00,,Business Committee (Dáil Éireann),2024-11-29 00:00:00+00:00,,Parliamentary Business and Committee Membership,2025-01-16 00:00:00+00:00,,Live - Primary,Live,Standing,2024-12-18 00:00:00+00:00,,Committee on Standing Orders and Dáil Reform,2024-11-29 00:00:00+00:00,,Parliamentary Regulation and Reform,2025-01-16 00:00:00+00:00,,Live - Primary,Live,Social Democrats,Social_Democrats,2024-11-29,,Dublin-Bay-North,Dublin Bay North,34th Dáil,dail,house,34,2024-11-29,,Cian,Cian-O'Callaghan.D.2020-02-08,O'Callaghan,,Cian O'Callaghan,,,,,,,Standing,2024-12-18 00:00:00+00:00,,Committee on Budgetary Oversight,2024-11-29 00:00:00+00:00,,Oversight,2025-05-07 00:00:00+00:00,,Live - Primary,Live,,,,,,,,,,Standing,2024-12-18 00:00:00+00:00,,Committee of Selection (Dáil Éireann),2024-11-29 00:00:00+00:00,,Parliamentary Business and Committee Membership,2025-01-16 00:00:00+00:00,,Live - Primary,Live,Sessional,2025-04-30 00:00:00+00:00,,"Select Committee on Finance, Public Expenditure, Public Service Reform and Digitalisation, and Taoiseach",2025-05-01 00:00:00+00:00,,Shadow Department,2025-05-07 00:00:00+00:00,,Live - Primary,Live,,,,,,,,,,,,,,,,,,,,,,,,,,,,,,,,,,,,,,,,,,,,,,,,,,,,,,,,,,,,,,,,,,,,,,,,,,,,,,,,,,,,,,,,,,,,,,,,,,,,,,,,,,,,,,,,,,,,,,,,,,,,,,,false,2020
,,,,,,,,,,,,,,,,,,,,,,,,,,,,,,,,,Fianna Fáil,Fianna_Fáil,2024-11-29,,Dublin-Bay-South,Dublin Bay South,34th Dáil,dail,house,34,2024-11-29,,Jim,Jim-O'Callaghan.D.2016-10-03,O'Callaghan,,Jim O'Callaghan,,,,,,,,,,,,,,,,,,Minister for Justice,2025-01-23,2025-06-04,,,,,,,,,,,,,,,,,,,,,,,,,,,,,,,,,,,,,,,,,,,,,,,,,,,,,,,,,,,,,,,,,,,,,,,,,,,,,,,,,,,"Minister for Justice, Home Affairs and Migration",2025-06-05,,,,,,,,,,,,,,,,,,,,,,,,,,,,,,,,,,,,,,,,,,,,,,,,,,,,,,,,,,,,,,,,,,,,,,,true,2016
Sessional,2025-05-13 00:00:00+00:00,,Joint Committee on Defence and National Security,2025-05-01 00:00:00+00:00,,Shadow Department,2025-05-07 00:00:00+00:00,,Live - Primary,Live,Sessional,2025-05-13 00:00:00+00:00,,"Joint Committee on Further and Higher Education, Research, Innovation and Science",2025-05-01 00:00:00+00:00,,Shadow Department,2025-05-07 00:00:00+00:00,,Live - Primary,Live,Standing,2025-02-12 00:00:00+00:00,,Joint Committee on Public Petitions and the Ombudsmen,2025-01-29 00:00:00+00:00,,Oversight,2026-05-26 00:00:00+00:00,,Live - Primary,Live,Fine Gael,Fine_Gael,2024-11-29,,Dublin-Rathdown,Dublin Rathdown,34th Dáil,dail,house,34,2024-11-29,,Maeve,Maeve-O'Connell.D.2024-11-29,O'Connell,,Maeve O'Connell,,,,,,,Sessional,2025-04-30 00:00:00+00:00,,"Select Committee on Further and Higher Education, Research, Innovation and Science",2025-05-01 00:00:00+00:00,,Shadow Department,2025-05-07 00:00:00+00:00,,Live - Primary,Live,,,,,,,,,,Standing,2025-02-12 00:00:00+00:00,,Select Committee on Public Petitions and the Ombudsmen,2025-01-29 00:00:00+00:00,,Oversight,2026-05-26 00:00:00+00:00,,Live - Primary,Live,Sessional,2025-04-30 00:00:00+00:00,,Select Committee on Defence and National Security,2025-05-01 00:00:00+00:00,,Shadow Department,2025-05-07 00:00:00+00:00,,Live - Primary,Live,,,,,,,,,,,,,,,,,,,,,,,Leas-Chathaoirleach,2025-06-11 00:00:00+00:00,,Leas-Chathaoirleach,2025-06-11 00:00:00+00:00,,,,,,,,,,,,,,,,,,,,,,,,,,,,,,,,,,,,,,,,,,,,,,,,,,,,,,,,,,,,,,,,,,,,,,,,,,,,,,,,,,,,,,,,,,,,,,,,,,,,false,2024
Special,2025-05-12 00:00:00+00:00,,Joint Committee on Artificial Intelligence,2025-05-01 00:00:00+00:00,,Policy,2025-05-07 00:00:00+00:00,,Live - Primary,Live,Special,2025-05-13 00:00:00+00:00,,Joint Committee on Drugs Use,2025-05-01 00:00:00+00:00,,Policy,2025-05-07 00:00:00+00:00,,Live - Primary,Live,Sessional,2025-05-13 00:00:00+00:00,,"Joint Committee on Enterprise, Tourism and Employment",2025-05-01 00:00:00+00:00,,Shadow Department,2025-05-07 00:00:00+00:00,,Live - Primary,Live,Fianna Fáil,Fianna_Fáil,2024-11-29,,Cork-East,Cork East,34th Dáil,dail,house,34,2024-11-29,,James,James-O'Connor.D.2020-02-08,O'Connor,,James O'Connor,,,,Cathaoirleach,2025-05-07 00:00:00+00:00,,Standing,2025-02-12 00:00:00+00:00,,Working Group of Committee Cathaoirligh,2025-01-29 00:00:00+00:00,,The Committee System and Parliamentary Administration,2025-05-07 00:00:00+00:00,,Live - Primary,Live,,,,,,,,,,Sessional,2025-04-30 00:00:00+00:00,,"Select Committee on Enterprise, Tourism and Employment",2025-05-01 00:00:00+00:00,,Shadow Department,2025-05-07 00:00:00+00:00,,Live - Primary,Live,Special,2025-04-30 00:00:00+00:00,,Select Committee on Artificial Intelligence,2025-05-01 00:00:00+00:00,,Policy,2025-05-07 00:00:00+00:00,,Live - Primary,Live,Special,2025-04-30 00:00:00+00:00,,Select Committee on Drugs Use,2025-05-01 00:00:00+00:00,,Policy,2025-05-07 00:00:00+00:00,,Live - Primary,Live,,,,,,,,,,,,,,,,,,,,,,,,,,,,,,,,,,,,,,,,,,,,,,,Cathaoirleach,2025-05-07 00:00:00+00:00,,,,,,,,,,,,,,,,,,,,,,,,,,,,,,,,,,,,,,,,,,,,,,,,,,,,,,,,,,,,,,,,,,,,false,2020
Sessional,2025-05-07 00:00:00+00:00,,"Joint Committee on Housing, Local Government and Heritage",2025-05-01 00:00:00+00:00,,Shadow Department,2025-05-07 00:00:00+00:00,2025-06-18 00:00:00+00:00,Live - Primary,Live,Special,2025-05-13 00:00:00+00:00,,Joint Committee on Drugs Use,2025-05-01 00:00:00+00:00,,Policy,2025-05-07 00:00:00+00:00,,Live - Primary,Live,Standing,2024-12-18 00:00:00+00:00,,Committee on Members' Interests of Dáil Éireann,2024-11-29 00:00:00+00:00,,Statutory,2025-05-07 00:00:00+00:00,,Live - Primary,Live,Fianna Fáil,Fianna_Fáil,2024-11-29,,Limerick-City,Limerick City,34th Dáil,dail,house,34,2024-11-29,,Willie,Willie-O'Dea.D.1982-03-09,O'Dea,,Willie O'Dea,,,,,,,Sessional,2025-04-30 00:00:00+00:00,,"Select Committee on Housing, Local Government and Heritage",2025-05-01 00:00:00+00:00,,Shadow Department,2025-05-07 00:00:00+00:00,2025-06-18 00:00:00+00:00,Live - Primary,Live,,,,,,,,,,Special,2025-04-30 00:00:00+00:00,,Select Committee on Drugs Use,2025-05-01 00:00:00+00:00,,Policy,2025-05-07 00:00:00+00:00,,Live - Primary,Live,,,,,,,,,,,,,,,,,,,,,,,,,,,,,,,,,,,,,,,,,,,,,,,,,,,,,,,,,,,,,,,,,,,,,,,,,,,,,,,,,,,,,,,,,,,,,,,,,,,,,,,,,,,,,,,,,,,,,,,,,,,,,,,,,,,,,,,,,,false,1982
