Kenny,,Eoghan-Kenny.D.2024-11-29,Eoghan,Labour_Party,,2024-11-29,Labour Party,34th Dáil,house,34,dail,,2025-05-01 00:00:00+00:00,"Joint Committee on Further and Higher Education, Research, Innovation and Science",Shadow Department,Live - Primary,,2025-05-13 00:00:00+00:00,Live,,2025-05-07 00:00:00+00:00,Sessional,,2024-11-29 00:00:00+00:00,Committee of Public Accounts,Oversight,Live - Primary,,2024-12-18 00:00:00+00:00,Live,,2025-05-07 00:00:00+00:00,Standing,,2025-05-01 00:00:00+00:00,"Select Committee on Further and Higher Education, Research, Innovation and Science",Shadow Department,Live - Primary,,2025-04-30 00:00:00+00:00,Live,,2025-05-07 00:00:00+00:00,Sessional,,2024-11-29,Cork-North-Central,Cork North-Central,Eoghan Kenny,,,,,,,,,,,,,,,,,,,,,,,,,,,,,,,,,,,,,,,,,,,,,,,,,,,,,,,,,,,,,,,,,,,,,,,,,,,,,,,,,,,,,,,,,,,,,,,,,,,,,,,,,,,,,,,,,,,,,,,,,,,,,,,,,,,,,,,,,,,,,,,,,,,,,,,,,,,,,,,,,,,,,,,,,,,,,,,false,2024
Kenny,,Martin-Kenny.D.2016-10-03,Martin,Sinn_Féin,,2024-11-29,Sinn Féin,34th Dáil,house,34,dail,,2025-05-01 00:00:00+00:00,Joint Committee on Agriculture and Food,Shadow Department,Live - Primary,,2025-05-07 00:00:00+00:00,Live,,2025-05-07 00:00:00+00:00,Sessional,,2025-05-01 00:00:00+00:00,Select Committee on Agriculture and Food,Shadow Department,Live - Primary,,2025-04-30 00:00:00+00:00,Live,,2025-05-07 00:00:00+00:00,Sessional,,,,,,,,,,,,,2024-11-29,Sligo-Leitrim,Sligo-Leitrim,Martin Kenny,,,,,,,,,,,,,,,,,,,,,,,,,,,,,,,,,,,,,,,,,,,,,,,,,,,,,,,,,,,,,,,,,,,,,,,,,,,,,,,,,,,,,,,,,,,,,,,,,,,,,,,,,,,,,,,,,,,,,,,,,,,,,,,,,,,,,,,,,,,,,,,,,,,,,,,,,,,,,,,,,,,,,,,,,,,,,,,false,2016
Keogh,,Keira-Keogh.D.2024-11-29,Keira,Fine_Gael,,2024-11-29,Fine Gael,34th Dáil,house,34,dail,,2025-01-29 00:00:00+00:00,Working Group of Committee Cathaoirligh,The Committee System and Parliamentary Administration,Live - Primary,,2025-02-12 00:00:00+00:00,Live,,2025-05-07 00:00:00+00:00,Standing,,2025-05-01 00:00:00+00:00,Joint Committee on Disability Matters,Shadow Department,Live - Primary,,2025-05-13 00:00:00+00:00,Live,,2025-05-07 00:00:00+00:00,Sessional,,2025-05-01 00:00:00+00:00,Joint Committee on Children and Equality,Shadow Department,Live - Primary,,2025-05-13 00:00:00+00:00,Live,,2025-05-07 00:00:00+00:00,Sessional,,2024-11-29,Mayo,Mayo,Keira Keogh,,,,,2025-05-07 00:00:00+00:00,Cathaoirleach,,2025-05-01 00:00:00+00:00,Joint Committee on Artificial Intelligence,Policy,Live - Primary,,2025-05-12 00:00:00+00:00,Live,,2025-05-07 00:00:00+00:00,Special,,,,,,,,2025-05-01 00:00:00+00:00,Select Committee on Disability Matters,Shadow Department,Live - Primary,,2025-04-30 00:00:00+00:00,Live,,2025-05-07 00:00:00+00:00,Sessional,,2025-05-01 00:00:00+00:00,Select Committee on Children and Equality,Shadow Department,Live - Primary,,2025-04-30 00:00:00+00:00,Live,,2025-05-07 00:00:00+00:00,Sessional,,2024-11-29 00:00:00+00:00,Committee on Standing Orders and Dáil Reform,Parliamentary Regulation and Reform,Live - Primary,,2024-12-18 00:00:00+00:00,Live,,2025-01-24 00:00:00+00:00,Standing,,2025-05-01 00:00:00+00:00,Select Committee on Artificial Intelligence,Policy,Live - Primary,,2025-04-30 00:00:00+00:00,Live,,2025-05-07 00:00:00+00:00,Special,,,,,,,,,,,,,,,,,,,,,,,,,,,,,,,,,,,,,,,,,,,2025-05-07 00:00:00+00:00,Cathaoirleach,,,,,,,,,,,,,,,,,,,,,,,,,,,,,,,,,,,,,,,2025-05-01 00:00:00+00:00,Select Committee on Children and Equality,,2025-05-01 00:00:00+00:00,Joint Committee on Children and Equality,,,,,,,,,,,,,,,,,,,,,false,2024
Kerrane,,Claire-Kerrane.D.2020-02-08,Claire,Sinn_Féin,,2024-11-29,Sinn Féin,34th Dáil,house,34,dail,,2025-05-01 00:00:00+00:00,Joint Committee on Children and Equality,Shadow Department,Live - Primary,,2025-05-13 00:00:00+00:00,Live,,2025-05-07 00:00:00+00:00,Sessional,,2025-05-01 00:00:00+00:00,Joint Committee on Disability Matters,Shadow Department,Live - Primary,,2025-05-13 00:00:00+00:00,Live,2025-05-28 00:00:00+00:00,2025-05-07 00:00:00+00:00,Sessional,,2025-05-01 00:00:00+00:00,Select Committee on Children and Equality,Shadow Department,Live - Primary,,2025-04-30 00:00:00+00:00,Live,,2025-05-07 00:00:00+00:00,Sessional,,2024-11-29,Roscommon-Galway,Roscommon-Galway,Claire Kerrane,,,,,,,,2025-05-01 00:00:00+00:00,Select Committee on Disability Matters,Shadow Department,Live - Primary,,2025-04-30 00:00:00+00:00,Live,2025-05-28 00:00:00+00:00,2025-05-07 00:00:00+00:00,Sessional,,2025-05-01 00:00:00+00:00,Joint Committee on Children and Equality,,,,,,,,,,,,,,,,,,,,,,,,,,,,,,,,,,,,,,,,,,,,,,,,,,,,,,,,,,,,,,,,,,,,,,,,,,,,,,,,,,,,,,,,,,,,,,,,,,,,,,,,,,,,,,,,,,,,,,,,,,,,,,,,,,,,,2025-05-01 00:00:00+00:00,Select Committee on Children and Equality,,,,,,,,,,,,,,,,,,,,,false,2020
Kyne,,Seán-Kyne.D.2011-03-09,Seán,Fine_Gael,,2026-05-25,Fine Gael,34th Dáil,house,34,dail,,,,,,,,,,,,,,,,,,,,,,,,,,,,,,,,,,,2026-05-25,Galway-West,Galway West,Seán Kyne,,,,,,,,,,,,,,,,,,,,,,,,,,,,,,,,,,,,,,,,,,,,,,,,,,,,,,,,,,,,,,,,,,,,,,,,,,,,,,,,,,,,,,,,,,,,,,,,,,,,,,,,,,,,,,,,,,,,,,,,,,,,,,,,,,,,,,,,,,,,,,,,,,,,,,,,,,,,,,,,,,,,,,,,,,,,,,,false,2011
Lahart,,John-Lahart.D.2016-10-03,John,Fianna_Fáil,,2024-11-29,Fianna Fáil,34th Dáil,house,34,dail,,2025-05-01 00:00:00+00:00,Joint Committee on Foreign Affairs and Trade,Shadow Department,Live - Primary,,2025-05-07 00:00:00+00:00,Live,,2025-05-07 00:00:00+00:00,Sessional,,2025-05-01 00:00:00+00:00,Joint Committee on European Union Affairs,Shadow Department,Live - Primary,,2025-05-13 00:00:00+00:00,Live,,2025-05-07 00:00:00+00:00,Sessional,,2025-01-29 00:00:00+00:00,Working Group of Committee Cathaoirligh,The Committee System and Parliamentary Administration,Live - Primary,,2025-02-12 00:00:00+00:00,Live,,2025-05-07 00:00:00+00:00,Standing,,2024-11-29,Dublin-South-West,Dublin South-West,John Lahart,,2025-05-07 00:00:00+00:00,Cathaoirleach,,,,,2025-05-01 00:00:00+00:00,Select Committee on European Union Affairs,Shadow Department,Live - Primary,,2025-04-30 00:00:00+00:00,Live,,2025-05-07 00:00:00+00:00,Sessional,,,,,,,,2024-11-29 00:00:00+00:00,Committee on Standing Orders and Dáil Reform,Parliamentary Regulation and Reform,Live - Primary,,2024-12-18 00:00:00+00:00,Live,2025-07-17 00:00:00+00:00,2025-01-24 00:00:00+00:00,Standing,,2024-11-29 00:00:00+00:00,Committee on Members' Interests of Dáil Éireann,Statutory,Live - Primary,,2024-12-18 00:00:00+00:00,Live,,2025-05-07 00:00:00+00:00,Standing,,2025-05-01 00:00:00+00:00,Select Committee on Foreign Affairs and Trade,Shadow Department,Live - Primary,,2025-04-30 00:00:00+00:00,Live,,2025-05-07 00:00:00+00:00,Sessional,,,,,,,,,,,,,,,,,,,2025-05-07 00:00:00+00:00,Cathaoirleach,,,,,,,,,,,,,,,,,,,,,,,,,,,,,,,,,,,,,,,,,,,,,,,,,,,,,,,,,,,,,,,,,,,,,,,,,,,,,,,,,,,,,,,,,,,,,,,,,,,false,2016
Lawless,,James-Lawless.D.2016-10-03,James,Fianna_Fáil,,2024-11-29,Fianna Fáil,34th Dáil,house,34,dail,,,,,,,,,,,,,,,,,,,,,,,,,,,,,,,,,,,2024-11-29,Kildare-North,Kildare North,James Lawless,,,,,,,,,,,,,,,,,,,,,,,,,,,,,,,,,,,,,,,,,,,,,,,,,,,,,,,,,,,,,,,,,,,,,,,,,,,,,,,,,,,,,,,,,,,,,,,,,,,,"Minister for Further and Higher Education, Research, Innovation and Science",,2025-01-23,,,,,,,,,,,,,,,,,,,,,,,,,,,,,,,,,,,,,,,,,,,,,,,,,,,,,,,,,,,,,,,,,,,,,,,,,true,2016
Lawless,,Paul-Lawless.D.2024-11-29,Paul,Aontú,,2024-11-29,Aontú,34th Dáil,house,34,dail,,2025-05-01 00:00:00+00:00,Joint Committee on Agriculture and Food,Shadow Department,Live - Primary,,2025-05-07 00:00:00+00:00,Live,,2025-05-07 00:00:00+00:00,Sessional,,2025-05-01 00:00:00+00:00,Select Committee on Agriculture and Food,Shadow Department,Live - Primary,,2025-04-30 00:00:00+00:00,Live,,2025-05-07 00:00:00+00:00,Sessional,,,,,,,,,,,,,2024-11-29,Mayo,Mayo,Paul Lawless,,,,,,,,,,,,,,,,,,,,,,,,,,,,,,,,,,,,,,,,,,,,,,,,,,,,,,,,,,,,,,,,,,,,,,,,,,,,,,,,,,,,,,,,,,,,,,,,,,,,,,,,,,,,,,,,,,,,,,,,,,,,,,,,,,,,,,,,,,,,,,,,,,,,,,,,,,,,,,,,,,,,,,,,,,,,,,,false,2024
Lawlor,,George-Lawlor.D.2024-11-29,George,Labour_Party,,2024-11-29,Labour Party,34th Dáil,house,34,dail,,2025-01-29 00:00:00+00:00,Working Group of Committee Cathaoirligh,The Committee System and Parliamentary Administration,Live - Primary,,2025-02-12 00:00:00+00:00,Live,2025-05-07 00:00:00+00:00,2025-05-07 00:00:00+00:00,Standing,,2025-05-01 00:00:00+00:00,"Joint Committee on Enterprise, Tourism and Employment",Shadow Department,Live - Primary,,2025-05-13 00:00:00+00:00,Live,,2025-05-07 00:00:00+00:00,Sessional,,2025-05-01 00:00:00+00:00,Joint Committee on Key Issues Affecting the Traveller Community,Policy,Live - Primary,,2025-05-12 00:00:00+00:00,Live,,2025-05-07 00:00:00+00:00,Sessional,,2024-11-29,Wexford,Wexford,George Lawlor,,,,,2025-05-07 00:00:00+00:00,Cathaoirleach,,2025-05-01 00:00:00+00:00,"Select Committee on Enterprise, Tourism and Employment",Shadow Department,Live - Primary,,2025-04-30 00:00:00+00:00,Live,,2025-05-07 00:00:00+00:00,Sessional,,,,,,,,2025-05-01 00:00:00+00:00,Select Committee on Key Issues Affecting the Traveller Community,Policy,Live - Primary,,2025-04-30 00:00:00+00:00,Live,,2025-05-07 00:00:00+00:00,Sessional,,,,,,,,,,,,,,,,,,,,,,,,,,,,,,,,,,,,,,,,,,,,,,,,,,,,,,,,,,,,,,,,,,,,,,,,,2025-05-07 00:00:00+00:00,Cathaoirleach,,,,,,,,,,,,,,,,,,,,,,,,,,,,,,,,,,,,,,,,,,,,,,,,,,,,,,,,,,,,,,,,,,,false,2024
Lowry,,Michael-Lowry.D.1987-03-10,Michael,Independent,,2024-11-29,Independent,34th Dáil,house,34,dail,,,,,,,,,,,,,,,,,,,,,,,,,,,,,,,,,,,2024-11-29,Tipperary-North,Tipperary North,Michael Lowry,,,,,,,,,,,,,,,,,,,,,,,,,,,,,,,,,,,,,,,,,,,,,,,,,,,,,,,,,,,,,,,,,,,,,,,,,,,,,,,,,,,,,,,,,,,,,,,,,,,,,,,,,,,,,,,,,,,,,,,,,,,,,,,,,,,,,,,,,,,,,,,,,,,,,,,,,,,,,,,,,,,,,,,,,,,,,,,false,1987
Mac Lochlainn,,Pádraig-MacLochlainn.D.2011-03-09,Pádraig,Sinn_Féin,,2024-11-29,Sinn Féin,34th Dáil,house,34,dail,,2025-05-01 00:00:00+00:00,Joint Committee on Fisheries and Maritime Affairs,Shadow Department,Live - Primary,,2025-05-07 00:00:00+00:00,Live,,2025-05-07 00:00:00+00:00,Sessional,,2025-01-29 00:00:00+00:00,Joint Committee on Remit Oversight,Parliamentary Regulation and Reform,Live - Primary,,2025-02-12 00:00:00+00:00,Live,,2025-05-21 00:00:00+00:00,Standing,,2025-05-01 00:00:00+00:00,Select Committee on Fisheries and Maritime Affairs,Shadow Department,Live - Primary,,2025-04-30 00:00:00+00:00,Live,,2025-05-07 00:00:00+00:00,Sessional,,2024-11-29,Donegal,Donegal,Pádraig Mac Lochlainn,,,,,,,,2024-11-29 00:00:00+00:00,Business Committee (Dáil Éireann),Parliamentary Business and Committee Membership,Live - Primary,,2024-12-18 00:00:00+00:00,Live,,2025-01-16 00:00:00+00:00,Standing,,,,,,,,2024-11-29 00:00:00+00:00,Committee on Standing Orders and Dáil Reform,Parliamentary Regulation and Reform,Live - Primary,,2024-12-18 00:00:00+00:00,Live,,2025-01-16 00:00:00+00:00,Standing,,2024-11-29 00:00:00+00:00,Committee of Selection (Dáil Éireann),Parliamentary Business and Committee Membership,Live - Primary,,2024-12-18 00:00:00+00:00,Live,,2025-01-16 00:00:00+00:00,Standing,,2024-11-29 00:00:00+00:00,Committee on Parliamentary Privileges and Oversight (Dáil Éireann),Parliamentary Regulation and Reform,Live - Primary,,2024-12-18 00:00:00+00:00,Live,,2025-05-21 00:00:00+00:00,Standing,,2025-01-29 00:00:00+00:00,Committee on Remit Oversight (Dáil Éireann),Parliamentary Regulation and Reform,Live - Primary,,2024-12-18 00:00:00+00:00,Live,,2025-05-21 00:00:00+00:00,Standing,,,,,,,,,,,,,,,,,,,,,,,,,,,,,,,,,,,,,,,,,,,,,,,,,,,,,,,,,,,,,,,,,,,,,,,,,,,,,,,,,,,,,,,,,,,,,,,,,,,,,,,,,,,,false,2011
Martin,,Micheál-Martin.D.1989-06-29,Micheál,Fianna_Fáil,,2024-11-29,Fianna Fáil,34th Dáil,house,34,dail,,,,,,,,,,,,,,,,,,,,,,,,,,,,,,,,,,,2024-11-29,Cork-South-Central,Cork South-Central,Micheál Martin,,,,,,,,,,,,,,,,,,,,,,,,,,,,,,,,,,,,,,,,,,,,,,,,,,,,,,,,,,,,,,,,,,,,,,,,,,,,,,,,,,,,,,,,,,,,,,,,,,,,Taoiseach,,2025-01-23,,,,,,,,,,,,,,,,,,,,,,,,,,,,,,,,,,,,,,,,,,,,,,,,,,,,,,,,,,,,,,,,,,,,,,,,,false,1989
Maxwell,,David-Maxwell.D.2024-11-29,David,Fine_Gael,,2024-11-29,Fine Gael,34th Dáil,house,34,dail,,2025-01-29 00:00:00+00:00,Joint Committee on Public Petitions and the Ombudsmen,Oversight,Live - Primary,,2025-02-12 00:00:00+00:00,Live,,2025-05-07 00:00:00+00:00,Standing,,2025-05-01 00:00:00+00:00,Joint Committee on Fisheries and Maritime Affairs,Shadow Department,Live - Primary,,2025-05-07 00:00:00+00:00,Live,,2025-05-07 00:00:00+00:00,Sessional,,2025-05-01 00:00:00+00:00,Joint Committee on the Implementation of the Good Friday Agreement ,Shadow Department,Live - Primary,,2025-05-12 00:00:00+00:00,Live,,2025-05-07 00:00:00+00:00,Sessional,,2024-11-29,Cavan-Monaghan,Cavan-Monaghan,David Maxwell,,,,,2025-06-10 00:00:00+00:00,Leas-Chathaoirleach,,2025-01-29 00:00:00+00:00,Select Committee on Public Petitions and the Ombudsmen,Oversight,Live - Primary,,2025-02-12 00:00:00+00:00,Live,,2025-05-07 00:00:00+00:00,Standing,,,,,,,,2025-05-01 00:00:00+00:00,Select Committee on Fisheries and Maritime Affairs,Shadow Department,Live - Primary,,2025-04-30 00:00:00+00:00,Live,,2025-05-07 00:00:00+00:00,Sessional,,2025-05-01 00:00:00+00:00,Select Committee on the Implementation of the Good Friday Agreement ,Shadow Department,Live - Primary,,2025-04-30 00:00:00+00:00,Live,,2025-05-07 00:00:00+00:00,Sessional,,,,,,,,,,,,,,,,,,,,,,,,,,,,,,,,,,,,,,,,,,,,,,,,,,,,,,,,,,,,,,,,,,,,,,,,,,,,,,,,,,,,,,,,,,,,,,,,,,,,,,,,,,,,,,,,,,,,,,,,,,,,,,,,,,false,2024
McAuliffe,,Paul-McAuliffe.D.2020-02-08,Paul,Fianna_Fáil,,2024-11-29,Fianna Fáil,34th Dáil,house,34,dail,,2025-01-29 00:00:00+00:00,Joint Committee on Remit Oversight,Parliamentary Regulation and Reform,Live - Primary,,2025-02-12 00:00:00+00:00,Live,,2025-05-21 00:00:00+00:00,Standing,,2025-05-01 00:00:00+00:00,Joint Committee on Disability Matters,Shadow Department,Live - Primary,,2025-05-13 00:00:00+00:00,Live,2025-07-02 00:00:00+00:00,2025-05-07 00:00:00+00:00,Sessional,,2025-05-01 00:00:00+00:00,"Joint Committee on Housing, Local Government and Heritage",Shadow Department,Live - Primary,,2025-05-07 00:00:00+00:00,Live,,2025-06-18 00:00:00+00:00,Sessional,,2024-11-29,Dublin-North-West,Dublin North-West,Paul McAuliffe,,,,,,,,2025-05-01 00:00:00+00:00,Select Committee on Disability Matters,Shadow Department,Live - Primary,,2025-04-30 00:00:00+00:00,Live,2025-07-02 00:00:00+00:00,2025-05-07 00:00:00+00:00,Sessional,,,,,,,,2025-05-01 00:00:00+00:00,"Select Committee on Housing, Local Government and Heritage",Shadow Department,Live - Primary,,2025-04-30 00:00:00+00:00,Live,,2025-06-18 00:00:00+00:00,Sessional,,2024-11-29 00:00:00+00:00,Committee on Standing Orders and Dáil Reform,Parliamentary Regulation and Reform,Live - Primary,,2024-12-18 00:00:00+00:00,Live,,2025-01-24 00:00:00+00:00,Standing,,2024-11-29 00:00:00+00:00,Committee on Parliamentary Privileges and Oversight (Dáil Éireann),Parliamentary Regulation and Reform,Live - Primary,,2024-12-18 00:00:00+00:00,Live,,2025-05-21 00:00:00+00:00,Standing,,2024-11-29 00:00:00+00:00,Committee of Public Accounts,Oversight,Live - Primary,,2024-12-18 00:00:00+00:00,Live,,2025-05-07 00:00:00+00:00,Standing,,,,,,,,,,,2025-01-29 00:00:00+00:00,Committee on Remit Oversight (Dáil Éireann),Parliamentary Regulation and Reform,Live - Primary,,2024-12-18 00:00:00+00:00,Live,,2025-05-21 00:00:00+00:00,Standing,,,,,,,,,,,,,,,,,,,,,,,,,,,,,,,,,,,,,,,,,,,,,,,,,,,,,,,,,,,,,,,,,,,,,,,,,,,,,,,,,,,2025-05-22 00:00:00+00:00,Leas-Chathaoirleach,,,,false,2020
McCarthy,,Noel-McCarthy.D.2024-11-29,Noel,Fine_Gael,,2024-11-29,Fine Gael,34th Dáil,house,34,dail,,2025-05-01 00:00:00+00:00,Joint Committee on Foreign Affairs and Trade,Shadow Department,Live - Primary,,2025-05-07 00:00:00+00:00,Live,,2025-05-07 00:00:00+00:00,Sessional,,2025-05-01 00:00:00+00:00,Joint Committee on the Implementation of the Good Friday Agreement ,Shadow Department,Live - Primary,,2025-05-12 00:00:00+00:00,Live,,2025-05-07 00:00:00+00:00,Sessional,,2025-05-01 00:00:00+00:00,Select Committee on Foreign Affairs and Trade,Shadow Department,Live - Primary,,2025-04-30 00:00:00+00:00,Live,,2025-05-07 00:00:00+00:00,Sessional,,2024-11-29,Cork-East,Cork East,Noel McCarthy,,,,,,,,2025-05-01 00:00:00+00:00,Select Committee on the Implementation of the Good Friday Agreement ,Shadow Department,Live - Primary,,2025-04-30 00:00:00+00:00,Live,,2025-05-07 00:00:00+00:00,Sessional,,,,,,,,,,,,,,,,,,,,,,,,,,,,,,,,,,,,,,,,,,,,,,,,,,,,,,,,,,,,,,,,,,,,,,,,,,,,,,,,,,,,,,,,,,,,,,,,,,,,,,,,,,,,,,,,,,,,,,,,,,,,,,,,,,,,,,,,,,,,,,,,,,,,,,,,,,,,,,false,2024
McConalogue,,Charlie-McConalogue.D.2011-03-09,Charlie,Fianna_Fáil,,2024-11-29,Fianna Fáil,34th Dáil,house,34,dail,,,,,,,,,,,,,,,,,,,,,,,,,,,,,,,,,,,2024-11-29,Donegal,Donegal,Charlie McConalogue,,,,,,,,,,,,,,,,,,,,,,,,,,,,,,,,,,,,,,,,,,,,,,,,,,,,,,,,,,,,,,,,,,,,,,,,,,,,,,,,,,,,,,,,,,,,,,,,,,,,"Minister of State at the Department of Culture, Communications and Sport",,2025-06-02,"Minister of State at the Department of Tourism, Culture, Arts, Gaeltacht, Sport and Media",2025-06-01,2025-01-29,,,,,,,,,,,,,,,,,,,,,,,,,,,,,,,,,,,,,,,,,,,,,,,,,,,,,,,,,,,,,,,,,,,,,,true,2011
McCormack,,Tony-McCormack.D.2024-11-29,Tony,Fianna_Fáil,,2024-11-29,Fianna Fáil,34th Dáil,house,34,dail,,2025-05-01 00:00:00+00:00,"Joint Committee on Enterprise, Tourism and Employment",Shadow Department,Live - Primary,,2025-05-13 00:00:00+00:00,Live,,2025-05-07 00:00:00+00:00,Sessional,,2025-05-01 00:00:00+00:00,Joint Committee on Key Issues Affecting the Traveller Community,Policy,Live - Primary,,2025-05-12 00:00:00+00:00,Live,,2025-05-07 00:00:00+00:00,Sessional,,2025-05-01 00:00:00+00:00,Joint Committee on Infrastructure and National Development Plan Delivery,Shadow Department,Live - Primary,,2025-05-07 00:00:00+00:00,Live,,2025-05-07 00:00:00+00:00,Sessional,,2024-11-29,Offaly,Offaly,Tony McCormack,,,,,,,,2025-05-01 00:00:00+00:00,"Select Committee on Enterprise, Tourism and Employment",Shadow Department,Live - Primary,,2025-04-30 00:00:00+00:00,Live,,2025-05-07 00:00:00+00:00,Sessional,,,,,,,,2025-05-01 00:00:00+00:00,Select Committee on Key Issues Affecting the Traveller Community,Policy,Live - Primary,,2025-04-30 00:00:00+00:00,Live,,2025-05-07 00:00:00+00:00,Sessional,,2025-05-01 00:00:00+00:00,Select Committee on Infrastructure and National Development Plan Delivery,Shadow Department,Live - Primary,,2025-04-30 00:00:00+00:00,Live,,2025-05-07 00:00:00+00:00,Sessional,,,,,,,,,,,,,,,,,,,,,,,,,,,,,,,,,,,,,,,,,,,,,,,,,,,,,,,,,,,,,,,,,,,,,,,,,,,,,,,,,,,,,,,,,,,,,,,,,,,,,,,,,,,,,,,,,,,,,,,,,,,,,,,,,,false,2024
McDonald,,Mary-Lou-McDonald.D.2011-03-09,Mary Lou,Sinn_Féin,,2024-11-29,Sinn Féin,34th Dáil,house,34,dail,,,,,,,,,,,,,,,,,,,,,,,,,,,,,,,,,,,2024-11-29,Dublin-Central,Dublin Central,Mary Lou McDonald,,,,,,,,,,,,,,,,,,,,,,,,,,,,,,,,,,,,,,,,,,,,,,,,,,,,,,,,,,,,,,,,,,,,,,,,,,,,,,,,,,,,,,,,,,,,,,,,,,,,,,,,,,,,,,,,,,,,,,,,,,,,,,,,,,,,,,,,,,,,,,,,,,,,,,,,,,,,,,,,,,,,,,,,,,,,,,,false,2011
McEntee,,Helen-McEntee.D.2013-03-27,Helen,Fine_Gael,,2024-11-29,Fine Gael,34th Dáil,house,34,dail,,,,,,,,,,,,,,,,,,,,,,,,,,,,,,,,,,,2024-11-29,Meath-East,Meath East,Helen McEntee,,,,,,,,,,,,,,,,,,,,,,,,,,,,,,,,,,,,,,,,,,,,,,,,,,,,,,,,,,,,,,,,,,,,,,,,,,,,,,,,,,,,,,,,,,,,,,,,,,,,Minister for Education,2025-05-01,2025-01-23,Minister for Education and Youth,2025-11-18,2025-05-02,,,,,,,Minister for Defence,,2025-11-18,Minister for Foreign Affairs and Trade,,2025-11-18,,,,,,,,,,,,,,,,,,,,,,,,,,,,,,,,,,,,,,,,,,,,,,,,,,,,,,,,,,true,2013
McGettigan,,Donna-McGettigan.D.2024-11-29,Donna,Sinn_Féin,,2024-11-29,Sinn Féin,34th Dáil,house,34,dail,,2025-05-01 00:00:00+00:00,"Joint Committee on Further and Higher Education, Research, Innovation and Science",Shadow Department,Live - Primary,,2025-05-13 00:00:00+00:00,Live,,2025-05-07 00:00:00+00:00,Sessional,,2025-05-01 00:00:00+00:00,"Select Committee on Further and Higher Education, Research, Innovation and Science",Shadow Department,Live - Primary,,2025-04-30 00:00:00+00:00,Live,,2025-05-07 00:00:00+00:00,Sessional,,,,,,,,,,,,,2024-11-29,Clare,Clare,Donna McGettigan,,,,,,,,,,,,,,,,,,,,,,,,,,,,,,,,,,,,,,,,,,,,,,,,,,,,,,,,,,,,,,,,,,,,,,,,,,,,,,,,,,,,,,,,,,,,,,,,,,,,,,,,,,,,,,,,,,,,,,,,,,,,,,,,,,,,,,,,,,,,,,,,,,,,,,,,,,,,,,,,,,,,,,,,,,,,,,,false,2024
McGrath,,Mattie-McGrath.D.2007-06-14,Mattie,Independent,,2024-11-29,Independent,34th Dáil,house,34,dail,,2025-01-29 00:00:00+00:00,Joint Committee on Remit Oversight,Parliamentary Regulation and Reform,Live - Primary,,2025-02-12 00:00:00+00:00,Live,,2025-05-21 00:00:00+00:00,Standing,,2024-11-29 00:00:00+00:00,Committee on Parliamentary Privileges and Oversight (Dáil Éireann),Parliamentary Regulation and Reform,Live - Primary,,2024-12-18 00:00:00+00:00,Live,,2025-05-21 00:00:00+00:00,Standing,,2024-11-29 00:00:00+00:00,Committee on Budgetary Oversight,Oversight,Live - Primary,,2024-12-18 00:00:00+00:00,Live,,2025-05-07 00:00:00+00:00,Standing,,2024-11-29,Tipperary-South,Tipperary South,Mattie McGrath,,,,,,,,2025-01-29 00:00:00+00:00,Committee on Remit Oversight (Dáil Éireann),Parliamentary Regulation and Reform,Live - Primary,,2024-12-18 00:00:00+00:00,Live,,2025-05-21 00:00:00+00:00,Standing,,,,,,,,,,,,,,,,,,,,,,,,,,,,,,,,,,,,,,,,,,,,,,,,,,,,,,,,,,,,,,,,,,,,,,,,,,,,,,,,,,,,,,,,,,,,,,,,,,,,,,,,,,,,,,,,,,,,,,,,,,,,,,,,,,,,,,,,,,,,,,,,,,,,,,,,,,,,,,false,2007
McGrath,,Séamus-McGrath.D.2024-11-29,Séamus,Fianna_Fáil,,2024-11-29,Fianna Fáil,34th Dáil,house,34,dail,,2025-05-01 00:00:00+00:00,"Joint Committee on Housing, Local Government and Heritage",Shadow Department,Live - Primary,,2025-05-07 00:00:00+00:00,Live,,2025-05-07 00:00:00+00:00,Sessional,,2025-05-01 00:00:00+00:00,Joint Committee on Key Issues Affecting the Traveller Community,Policy,Live - Primary,,2025-05-12 00:00:00+00:00,Live,,2025-05-07 00:00:00+00:00,Sessional,,2024-11-29 00:00:00+00:00,Committee of Public Accounts,Oversight,Live - Primary,,2024-12-18 00:00:00+00:00,Live,,2025-05-07 00:00:00+00:00,Standing,,2024-11-29,Cork-South-Central,Cork South-Central,Séamus McGrath,,2025-05-20 00:00:00+00:00,Leas-Chathaoirleach,,,,,2025-05-01 00:00:00+00:00,"Select Committee on Housing, Local Government and Heritage",Shadow Department,Live - Primary,,2025-04-30 00:00:00+00:00,Live,,2025-05-07 00:00:00+00:00,Sessional,,,,,,,,2025-05-01 00:00:00+00:00,Select Committee on Key Issues Affecting the Traveller Community,Policy,Live - Primary,,2025-04-30 00:00:00+00:00,Live,,2025-05-07 00:00:00+00:00,Sessional,,,,,,,,,,,,,,,,,,,,,,,,,,,,,,,,,,,,,,2025-05-20 00:00:00+00:00,Leas-Chathaoirleach,,,,,,,,,,,,,,,,,,,,,,,,,,,,,,,,,,,,,,,,,,,,,,,,,,,,,,,,,,,,,,,,,,,,,,,,,,,,,,,,,,,,,,,,,,,,,,,,,,,,,,false,2024
McGreehan,,Erin-McGreehan.S.2020-06-29,Erin,Fianna_Fáil,,2024-11-29,Fianna Fáil,34th Dáil,house,34,dail,,2025-05-01 00:00:00+00:00,"Joint Committee on Finance, Public Expenditure, Public Service Reform and Digitalisation, and Taoiseach",Shadow Department,Live - Primary,,2025-05-07 00:00:00+00:00,Live,,2025-05-07 00:00:00+00:00,Sessional,,2025-05-01 00:00:00+00:00,"Joint Committee on Further and Higher Education, Research, Innovation and Science",Shadow Department,Live - Primary,,2025-05-13 00:00:00+00:00,Live,,2025-05-07 00:00:00+00:00,Sessional,,2025-01-29 00:00:00+00:00,Working Group of Committee Cathaoirligh,The Committee System and Parliamentary Administration,Live - Primary,,2025-02-12 00:00:00+00:00,Live,,2025-05-07 00:00:00+00:00,Standing,,2024-11-29,Louth,Louth,Erin McGreehan,,,,,,,,2025-05-01 00:00:00+00:00,Joint Committee on the Implementation of the Good Friday Agreement ,Shadow Department,Live - Primary,,2025-05-12 00:00:00+00:00,Live,,2025-05-07 00:00:00+00:00,Sessional,,,,,,,,2025-05-01 00:00:00+00:00,"Select Committee on Finance, Public Expenditure, Public Service Reform and Digitalisation, and Taoiseach",Shadow Department,Live - Primary,,2025-04-30 00:00:00+00:00,Live,,2025-05-07 00:00:00+00:00,Sessional,,2025-05-01 00:00:00+00:00,"Select Committee on Further and Higher Education, Research, Innovation and Science",Shadow Department,Live - Primary,,2025-04-30 00:00:00+00:00,Live,,2025-05-07 00:00:00+00:00,Sessional,,2025-05-01 00:00:00+00:00,Select Committee on the Implementation of the Good Friday Agreement ,Shadow Department,Live - Primary,,2025-04-30 00:00:00+00:00,Live,,2025-05-07 00:00:00+00:00,Sessional,,2025-01-21 16:29:34.896666+00:00,Select Committee on Subsidiarity (European Union Legislative Scrutiny),Shadow Department,Dissolved,2025-05-07 00:00:00+00:00,2025-01-23 00:00:00+00:00,Dissolved,2025-05-07 00:00:00+00:00,2025-02-13 00:00:00+00:00,Standing transitional,,2025-05-07 00:00:00+00:00,Cathaoirleach,,,,,,,,,,,,,,,,,,,,,,,,,,,,,,,,,,,,,,,,2025-05-07 00:00:00+00:00,Cathaoirleach,,,,,,,,,,,,,,,,,,,,,,,,,,,,,,,,,,,,,,,,,,,,,,,,,,,,,,,,,,,,,,,,false,2020
McGuinness,,Conor-D-McGuinness.D.2024-11-29,Conor D,Sinn_Féin,,2024-11-29,Sinn Féin,34th Dáil,house,34,dail,,2025-01-29 00:00:00+00:00,Working Group of Committee Cathaoirligh,The Committee System and Parliamentary Administration,Live - Primary,,2025-02-12 00:00:00+00:00,Live,,2025-05-07 00:00:00+00:00,Standing,,2025-05-01 00:00:00+00:00,Joint Committee on Fisheries and Maritime Affairs,Shadow Department,Live - Primary,,2025-05-07 00:00:00+00:00,Live,,2025-05-07 00:00:00+00:00,Sessional,,2025-01-21 16:29:34.896666+00:00,Select Committee on Subsidiarity (European Union Legislative Scrutiny),Shadow Department,Dissolved,2025-05-07 00:00:00+00:00,2025-01-23 00:00:00+00:00,Dissolved,2025-05-07 00:00:00+00:00,2025-02-13 00:00:00+00:00,Standing transitional,,2024-11-29,Waterford,Waterford,Conor D McGuinness,,,,,,,,2025-05-01 00:00:00+00:00,Select Committee on Fisheries and Maritime Affairs,Shadow Department,Live - Primary,,2025-04-30 00:00:00+00:00,Live,,2025-05-07 00:00:00+00:00,Sessional,,,,,,,,,,,,,,,,,,,,,,,,,,,,,,,,,,,,,,,,,,,,,,,,,,,,2025-05-07 00:00:00+00:00,Cathaoirleach,,2025-05-07 00:00:00+00:00,Cathaoirleach,,,,,,,,,,,,,,,,,,,,,,,,,,,,,,,,,,,,,,,,,,,,,,,,,,,,,,,,,,,,,,,,,,,,,,,,,,,,,,,,,,,,,,,,,,,,,,,,,,,,,,false,2024
