Sessional,2025-05-13 00:00:00+00:00,,"Joint Committee on Further and Higher Education, Research, Innovation and Science",2025-05-01 00:00:00+00:00,,Shadow Department,2025-05-07 00:00:00+00:00,,Live - Primary,Live,Standing,2024-12-18 00:00:00+00:00,,Committee of Public Accounts,2024-11-29 00:00:00+00:00,,Oversight,2025-05-07 00:00:00+00:00,,Live - Primary,Live,Sessional,2025-04-30 00:00:00+00:00,,"Select Committee on Further and Higher Education, Research, Innovation and Science",2025-05-01 00:00:00+00:00,,Shadow Department,2025-05-07 00:00:00+00:00,,Live - Primary,Live,Labour Party,Labour_Party,2024-11-29,,Cork-North-Central,Cork North-Central,34th Dáil,dail,house,34,2024-11-29,,Eoghan,Eoghan-Kenny.D.2024-11-29,Kenny,,Eoghan Kenny,,,,,,,,,,,,,,,,,,,,,,,,,,,,,,,,,,,,,,,,,,,,,,,,,,,,,,,,,,,,,,,,,,,,,,,,,,,,,,,,,,,,,,,,,,,,,,,,,,,,,,,,,,,,,,,,,,,,,,,,,,,,,,,,,,,,,,,,,,,,,,,,,,,,,,,,,,,,,,,,,,,,,,,,,,,,,,,false,2024
Sessional,2025-05-07 00:00:00+00:00,,Joint Committee on Agriculture and Food,2025-05-01 00:00:00+00:00,,Shadow Department,2025-05-07 00:00:00+00:00,,Live - Primary,Live,Sessional,2025-04-30 00:00:00+00:00,,Select Committee on Agriculture and Food,2025-05-01 00:00:00+00:00,,Shadow Department,2025-05-07 00:00:00+00:00,,Live - Primary,Live,,,,,,,,,,,,Sinn Féin,Sinn_Féin,2024-11-29,,Sligo-Leitrim,Sligo-Leitrim,34th Dáil,dail,house,34,2024-11-29,,Martin,Martin-Kenny.D.2016-10-03,Kenny,,Martin Kenny,,,,,,,,,,,,,,,,,,,,,,,,,,,,,,,,,,,,,,,,,,,,,,,,,,,,,,,,,,,,,,,,,,,,,,,,,,,,,,,,,,,,,,,,,,,,,,,,,,,,,,,,,,,,,,,,,,,,,,,,,,,,,,,,,,,,,,,,,,,,,,,,,,,,,,,,,,,,,,,,,,,,,,,,,,,,,,,false,2016
Standing,2025-02-12 00:00:00+00:00,,Working Group of Committee Cathaoirligh,2025-01-29 00:00:00+00:00,,The Committee System and Parliamentary Administration,2025-05-07 00:00:00+00:00,,Live - Primary,Live,Sessional,2025-05-13 00:00:00+00:00,,Joint Committee on Disability Matters,2025-05-01 00:00:00+00:00,,Shadow Department,2025-05-07 00:00:00+00:00,,Live - Primary,Live,Sessional,2025-05-13 00:00:00+00:00,,Joint Committee on Children and Equality,2025-05-01 00:00:00+00:00,,Shadow Department,2025-05-07 00:00:00+00:00,,Live - Primary,Live,Fine Gael,Fine_Gael,2024-11-29,,Mayo,Mayo,34th Dáil,dail,house,34,2024-11-29,,Keira,Keira-Keogh.D.2024-11-29,Keogh,,Keira Keogh,,,,Cathaoirleach,2025-05-07 00:00:00+00:00,,Special,2025-05-12 00:00:00+00:00,,Joint Committee on Artificial Intelligence,2025-05-01 00:00:00+00:00,,Policy,2025-05-07 00:00:00+00:00,,Live - Primary,Live,,,,,,,,,,Sessional,2025-04-30 00:00:00+00:00,,Select Committee on Disability Matters,2025-05-01 00:00:00+00:00,,Shadow Department,2025-05-07 00:00:00+00:00,,Live - Primary,Live,Sessional,2025-04-30 00:00:00+00:00,,Select Committee on Children and Equality,2025-05-01 00:00:00+00:00,,Shadow Department,2025-05-07 00:00:00+00:00,,Live - Primary,Live,Standing,2024-12-18 00:00:00+00:00,,Committee on Standing Orders and Dáil Reform,2024-11-29 00:00:00+00:00,,Parliamentary Regulation and Reform,2025-01-24 00:00:00+00:00,,Live - Primary,Live,Special,2025-04-30 00:00:00+00:00,,Select Committee on Artificial Intelligence,2025-05-01 00:00:00+00:00,,Policy,2025-05-07 00:00:00+00:00,,Live - Primary,Live,,,,,,,,,,,,,,,,,,,,,,,,,,,,,,,,,,,,,,,Cathaoirleach,2025-05-07 00:00:00+00:00,,,,,,,,,,,,,,,,,,,,,,,,,,,,,,,,,,,,,,,Select Committee on Children and Equality,2025-05-01 00:00:00+00:00,,Joint Committee on Children and Equality,2025-05-01 00:00:00+00:00,,,,,,,,,,,,,,,,,,,,,,false,2024
Sessional,2025-05-13 00:00:00+00:00,,Joint Committee on Children and Equality,2025-05-01 00:00:00+00:00,,Shadow Department,2025-05-07 00:00:00+00:00,,Live - Primary,Live,Sessional,2025-05-13 00:00:00+00:00,,Joint Committee on Disability Matters,2025-05-01 00:00:00+00:00,,Shadow Department,2025-05-07 00:00:00+00:00,2025-05-28 00:00:00+00:00,Live - Primary,Live,Sessional,2025-04-30 00:00:00+00:00,,Select Committee on Children and Equality,2025-05-01 00:00:00+00:00,,Shadow Department,2025-05-07 00:00:00+00:00,,Live - Primary,Live,Sinn Féin,Sinn_Féin,2024-11-29,,Roscommon-Galway,Roscommon-Galway,34th Dáil,dail,house,34,2024-11-29,,Claire,Claire-Kerrane.D.2020-02-08,Kerrane,,Claire Kerrane,,,,,,,Sessional,2025-04-30 00:00:00+00:00,,Select Committee on Disability Matters,2025-05-01 00:00:00+00:00,,Shadow Department,2025-05-07 00:00:00+00:00,2025-05-28 00:00:00+00:00,Live - Primary,Live,,,,Joint Committee on Children and Equality,2025-05-01 00:00:00+00:00,,,,,,,,,,,,,,,,,,,,,,,,,,,,,,,,,,,,,,,,,,,,,,,,,,,,,,,,,,,,,,,,,,,,,,,,,,,,,,,,,,,,,,,,,,,,,,,,,,,,,,,,,,,,,,,,,,,,,,,,,,,,,,,,,,Select Committee on Children and Equality,2025-05-01 00:00:00+00:00,,,,,,,,,,,,,,,,,,,,,,false,2020
,,,,,,,,,,,,,,,,,,,,,,,,,,,,,,,,,Fine Gael,Fine_Gael,2026-05-25,,Galway-West,Galway West,34th Dáil,dail,house,34,2026-05-25,,Seán,Seán-Kyne.D.2011-03-09,Kyne,,Seán Kyne,,,,,,,,,,,,,,,,,,,,,,,,,,,,,,,,,,,,,,,,,,,,,,,,,,,,,,,,,,,,,,,,,,,,,,,,,,,,,,,,,,,,,,,,,,,,,,,,,,,,,,,,,,,,,,,,,,,,,,,,,,,,,,,,,,,,,,,,,,,,,,,,,,,,,,,,,,,,,,,,,,,,,,,,,,,,,,,false,2011
Sessional,2025-05-07 00:00:00+00:00,,Joint Committee on Foreign Affairs and Trade,2025-05-01 00:00:00+00:00,,Shadow Department,2025-05-07 00:00:00+00:00,,Live - Primary,Live,Sessional,2025-05-13 00:00:00+00:00,,Joint Committee on European Union Affairs,2025-05-01 00:00:00+00:00,,Shadow Department,2025-05-07 00:00:00+00:00,,Live - Primary,Live,Standing,2025-02-12 00:00:00+00:00,,Working Group of Committee Cathaoirligh,2025-01-29 00:00:00+00:00,,The Committee System and Parliamentary Administration,2025-05-07 00:00:00+00:00,,Live - Primary,Live,Fianna Fáil,Fianna_Fáil,2024-11-29,,Dublin-South-West,Dublin South-West,34th Dáil,dail,house,34,2024-11-29,,John,John-Lahart.D.2016-10-03,Lahart,,John Lahart,Cathaoirleach,2025-05-07 00:00:00+00:00,,,,,Sessional,2025-04-30 00:00:00+00:00,,Select Committee on European Union Affairs,2025-05-01 00:00:00+00:00,,Shadow Department,2025-05-07 00:00:00+00:00,,Live - Primary,Live,,,,,,,,,,Standing,2024-12-18 00:00:00+00:00,,Committee on Standing Orders and Dáil Reform,2024-11-29 00:00:00+00:00,,Parliamentary Regulation and Reform,2025-01-24 00:00:00+00:00,2025-07-17 00:00:00+00:00,Live - Primary,Live,Standing,2024-12-18 00:00:00+00:00,,Committee on Members' Interests of Dáil Éireann,2024-11-29 00:00:00+00:00,,Statutory,2025-05-07 00:00:00+00:00,,Live - Primary,Live,Sessional,2025-04-30 00:00:00+00:00,,Select Committee on Foreign Affairs and Trade,2025-05-01 00:00:00+00:00,,Shadow Department,2025-05-07 00:00:00+00:00,,Live - Primary,Live,,,,,,,,,,,,,,,,,,Cathaoirleach,2025-05-07 00:00:00+00:00,,,,,,,,,,,,,,,,,,,,,,,,,,,,,,,,,,,,,,,,,,,,,,,,,,,,,,,,,,,,,,,,,,,,,,,,,,,,,,,,,,,,,,,,,,,,,,,,,false,2016
,,,,,,,,,,,,,,,,,,,,,,,,,,,,,,,,,Fianna Fáil,Fianna_Fáil,2024-11-29,,Kildare-North,Kildare North,34th Dáil,dail,house,34,2024-11-29,,James,James-Lawless.D.2016-10-03,Lawless,,James Lawless,,,,,,,,,,,,,,,,,,"Minister for Further and Higher Education, Research, Innovation and Science",2025-01-23,,,,,,,,,,,,,,,,,,,,,,,,,,,,,,,,,,,,,,,,,,,,,,,,,,,,,,,,,,,,,,,,,,,,,,,,,,,,,,,,,,,,,,,,,,,,,,,,,,,,,,,,,,,,,,,,,,,,,,,,,,,,,,,,,,,,,,,,,,,,,,,,,,,,,,,,,,,,true,2016
Sessional,2025-05-07 00:00:00+00:00,,Joint Committee on Agriculture and Food,2025-05-01 00:00:00+00:00,,Shadow Department,2025-05-07 00:00:00+00:00,,Live - Primary,Live,Sessional,2025-04-30 00:00:00+00:00,,Select Committee on Agriculture and Food,2025-05-01 00:00:00+00:00,,Shadow Department,2025-05-07 00:00:00+00:00,,Live - Primary,Live,,,,,,,,,,,,Aontú,Aontú,2024-11-29,,Mayo,Mayo,34th Dáil,dail,house,34,2024-11-29,,Paul,Paul-Lawless.D.2024-11-29,Lawless,,Paul Lawless,,,,,,,,,,,,,,,,,,,,,,,,,,,,,,,,,,,,,,,,,,,,,,,,,,,,,,,,,,,,,,,,,,,,,,,,,,,,,,,,,,,,,,,,,,,,,,,,,,,,,,,,,,,,,,,,,,,,,,,,,,,,,,,,,,,,,,,,,,,,,,,,,,,,,,,,,,,,,,,,,,,,,,,,,,,,,,,false,2024
Standing,2025-02-12 00:00:00+00:00,,Working Group of Committee Cathaoirligh,2025-01-29 00:00:00+00:00,,The Committee System and Parliamentary Administration,2025-05-07 00:00:00+00:00,2025-05-07 00:00:00+00:00,Live - Primary,Live,Sessional,2025-05-13 00:00:00+00:00,,"Joint Committee on Enterprise, Tourism and Employment",2025-05-01 00:00:00+00:00,,Shadow Department,2025-05-07 00:00:00+00:00,,Live - Primary,Live,Sessional,2025-05-12 00:00:00+00:00,,Joint Committee on Key Issues Affecting the Traveller Community,2025-05-01 00:00:00+00:00,,Policy,2025-05-07 00:00:00+00:00,,Live - Primary,Live,Labour Party,Labour_Party,2024-11-29,,Wexford,Wexford,34th Dáil,dail,house,34,2024-11-29,,George,George-Lawlor.D.2024-11-29,Lawlor,,George Lawlor,,,,Cathaoirleach,2025-05-07 00:00:00+00:00,,Sessional,2025-04-30 00:00:00+00:00,,"Select Committee on Enterprise, Tourism and Employment",2025-05-01 00:00:00+00:00,,Shadow Department,2025-05-07 00:00:00+00:00,,Live - Primary,Live,,,,,,,,,,Sessional,2025-04-30 00:00:00+00:00,,Select Committee on Key Issues Affecting the Traveller Community,2025-05-01 00:00:00+00:00,,Policy,2025-05-07 00:00:00+00:00,,Live - Primary,Live,,,,,,,,,,,,,,,,,,,,,,,,,,,,,,,,,,,,,,,,,,,,,,,,,,,,,,,,,,,,,,,,,,,,,Cathaoirleach,2025-05-07 00:00:00+00:00,,,,,,,,,,,,,,,,,,,,,,,,,,,,,,,,,,,,,,,,,,,,,,,,,,,,,,,,,,,,,,,,,,,,false,2024
,,,,,,,,,,,,,,,,,,,,,,,,,,,,,,,,,Independent,Independent,2024-11-29,,Tipperary-North,Tipperary North,34th Dáil,dail,house,34,2024-11-29,,Michael,Michael-Lowry.D.1987-03-10,Lowry,,Michael Lowry,,,,,,,,,,,,,,,,,,,,,,,,,,,,,,,,,,,,,,,,,,,,,,,,,,,,,,,,,,,,,,,,,,,,,,,,,,,,,,,,,,,,,,,,,,,,,,,,,,,,,,,,,,,,,,,,,,,,,,,,,,,,,,,,,,,,,,,,,,,,,,,,,,,,,,,,,,,,,,,,,,,,,,,,,,,,,,,false,1987
Sessional,2025-05-07 00:00:00+00:00,,Joint Committee on Fisheries and Maritime Affairs,2025-05-01 00:00:00+00:00,,Shadow Department,2025-05-07 00:00:00+00:00,,Live - Primary,Live,Standing,2025-02-12 00:00:00+00:00,,Joint Committee on Remit Oversight,2025-01-29 00:00:00+00:00,,Parliamentary Regulation and Reform,2025-05-21 00:00:00+00:00,,Live - Primary,Live,Sessional,2025-04-30 00:00:00+00:00,,Select Committee on Fisheries and Maritime Affairs,2025-05-01 00:00:00+00:00,,Shadow Department,2025-05-07 00:00:00+00:00,,Live - Primary,Live,Sinn Féin,Sinn_Féin,2024-11-29,,Donegal,Donegal,34th Dáil,dail,house,34,2024-11-29,,Pádraig,Pádraig-MacLochlainn.D.2011-03-09,Mac Lochlainn,,Pádraig Mac Lochlainn,,,,,,,Standing,2024-12-18 00:00:00+00:00,,Business Committee (Dáil Éireann),2024-11-29 00:00:00+00:00,,Parliamentary Business and Committee Membership,2025-01-16 00:00:00+00:00,,Live - Primary,Live,,,,,,,,,,Standing,2024-12-18 00:00:00+00:00,,Committee on Standing Orders and Dáil Reform,2024-11-29 00:00:00+00:00,,Parliamentary Regulation and Reform,2025-01-16 00:00:00+00:00,,Live - Primary,Live,Standing,2024-12-18 00:00:00+00:00,,Committee of Selection (Dáil Éireann),2024-11-29 00:00:00+00:00,,Parliamentary Business and Committee Membership,2025-01-16 00:00:00+00:00,,Live - Primary,Live,Standing,2024-12-18 00:00:00+00:00,,Committee on Parliamentary Privileges and Oversight (Dáil Éireann),2024-11-29 00:00:00+00:00,,Parliamentary Regulation and Reform,2025-05-21 00:00:00+00:00,,Live - Primary,Live,Standing,2024-12-18 00:00:00+00:00,,Committee on Remit Oversight (Dáil Éireann),2025-01-29 00:00:00+00:00,,Parliamentary Regulation and Reform,2025-05-21 00:00:00+00:00,,Live - Primary,Live,,,,,,,,,,,,,,,,,,,,,,,,,,,,,,,,,,,,,,,,,,,,,,,,,,,,,,,,,,,,,,,,,,,,,,,,,,,,,,,,,,,,,,,,,,,,,,,,,,,,,,,,,false,2011
,,,,,,,,,,,,,,,,,,,,,,,,,,,,,,,,,Fianna Fáil,Fianna_Fáil,2024-11-29,,Cork-South-Central,Cork South-Central,34th Dáil,dail,house,34,2024-11-29,,Micheál,Micheál-Martin.D.1989-06-29,Martin,,Micheál Martin,,,,,,,,,,,,,,,,,,Taoiseach,2025-01-23,,,,,,,,,,,,,,,,,,,,,,,,,,,,,,,,,,,,,,,,,,,,,,,,,,,,,,,,,,,,,,,,,,,,,,,,,,,,,,,,,,,,,,,,,,,,,,,,,,,,,,,,,,,,,,,,,,,,,,,,,,,,,,,,,,,,,,,,,,,,,,,,,,,,,,,,,,,,false,1989
Standing,2025-02-12 00:00:00+00:00,,Joint Committee on Public Petitions and the Ombudsmen,2025-01-29 00:00:00+00:00,,Oversight,2025-05-07 00:00:00+00:00,,Live - Primary,Live,Sessional,2025-05-07 00:00:00+00:00,,Joint Committee on Fisheries and Maritime Affairs,2025-05-01 00:00:00+00:00,,Shadow Department,2025-05-07 00:00:00+00:00,,Live - Primary,Live,Sessional,2025-05-12 00:00:00+00:00,,Joint Committee on the Implementation of the Good Friday Agreement ,2025-05-01 00:00:00+00:00,,Shadow Department,2025-05-07 00:00:00+00:00,,Live - Primary,Live,Fine Gael,Fine_Gael,2024-11-29,,Cavan-Monaghan,Cavan-Monaghan,34th Dáil,dail,house,34,2024-11-29,,David,David-Maxwell.D.2024-11-29,Maxwell,,David Maxwell,,,,Leas-Chathaoirleach,2025-06-10 00:00:00+00:00,,Standing,2025-02-12 00:00:00+00:00,,Select Committee on Public Petitions and the Ombudsmen,2025-01-29 00:00:00+00:00,,Oversight,2025-05-07 00:00:00+00:00,,Live - Primary,Live,,,,,,,,,,Sessional,2025-04-30 00:00:00+00:00,,Select Committee on Fisheries and Maritime Affairs,2025-05-01 00:00:00+00:00,,Shadow Department,2025-05-07 00:00:00+00:00,,Live - Primary,Live,Sessional,2025-04-30 00:00:00+00:00,,Select Committee on the Implementation of the Good Friday Agreement ,2025-05-01 00:00:00+00:00,,Shadow Department,2025-05-07 00:00:00+00:00,,Live - Primary,Live,,,,,,,,,,,,,,,,,,,,,,,,,,,,,,,,,,,,,,,,,,,,,,,,,,,,,,,,,,,,,,,,,,,,,,,,,,,,,,,,,,,,,,,,,,,,,,,,,,,,,,,,,,,,,,,,,,,,,,,,,,,,,,,false,2024
Standing,2025-02-12 00:00:00+00:00,,Joint Committee on Remit Oversight,2025-01-29 00:00:00+00:00,,Parliamentary Regulation and Reform,2025-05-21 00:00:00+00:00,,Live - Primary,Live,Sessional,2025-05-13 00:00:00+00:00,,Joint Committee on Disability Matters,2025-05-01 00:00:00+00:00,,Shadow Department,2025-05-07 00:00:00+00:00,2025-07-02 00:00:00+00:00,Live - Primary,Live,Sessional,2025-05-07 00:00:00+00:00,,"Joint Committee on Housing, Local Government and Heritage",2025-05-01 00:00:00+00:00,,Shadow Department,2025-06-18 00:00:00+00:00,,Live - Primary,Live,Fianna Fáil,Fianna_Fáil,2024-11-29,,Dublin-North-West,Dublin North-West,34th Dáil,dail,house,34,2024-11-29,,Paul,Paul-McAuliffe.D.2020-02-08,McAuliffe,,Paul McAuliffe,,,,,,,Sessional,2025-04-30 00:00:00+00:00,,Select Committee on Disability Matters,2025-05-01 00:00:00+00:00,,Shadow Department,2025-05-07 00:00:00+00:00,2025-07-02 00:00:00+00:00,Live - Primary,Live,,,,,,,,,,Sessional,2025-04-30 00:00:00+00:00,,"Select Committee on Housing, Local Government and Heritage",2025-05-01 00:00:00+00:00,,Shadow Department,2025-06-18 00:00:00+00:00,,Live - Primary,Live,Standing,2024-12-18 00:00:00+00:00,,Committee on Standing Orders and Dáil Reform,2024-11-29 00:00:00+00:00,,Parliamentary Regulation and Reform,2025-01-24 00:00:00+00:00,,Live - Primary,Live,Standing,2024-12-18 00:00:00+00:00,,Committee on Parliamentary Privileges and Oversight (Dáil Éireann),2024-11-29 00:00:00+00:00,,Parliamentary Regulation and Reform,2025-05-21 00:00:00+00:00,,Live - Primary,Live,Standing,2024-12-18 00:00:00+00:00,,Committee of Public Accounts,2024-11-29 00:00:00+00:00,,Oversight,2025-05-07 00:00:00+00:00,,Live - Primary,Live,,,,,,,,,,Standing,2024-12-18 00:00:00+00:00,,Committee on Remit Oversight (Dáil Éireann),2025-01-29 00:00:00+00:00,,Parliamentary Regulation and Reform,2025-05-21 00:00:00+00:00,,Live - Primary,Live,,,,,,,,,,,,,,,,,,,,,,,,,,,,,,,,,,,,,,,,,,,,,,,,,,,,,,,,,,,,,,,,,,,,,,,,,,,,,,,Leas-Chathaoirleach,2025-05-22 00:00:00+00:00,,,,,false,2020
Sessional,2025-05-07 00:00:00+00:00,,Joint Committee on Foreign Affairs and Trade,2025-05-01 00:00:00+00:00,,Shadow Department,2025-05-07 00:00:00+00:00,,Live - Primary,Live,Sessional,2025-05-12 00:00:00+00:00,,Joint Committee on the Implementation of the Good Friday Agreement ,2025-05-01 00:00:00+00:00,,Shadow Department,2025-05-07 00:00:00+00:00,,Live - Primary,Live,Sessional,2025-04-30 00:00:00+00:00,,Select Committee on Foreign Affairs and Trade,2025-05-01 00:00:00+00:00,,Shadow Department,2025-05-07 00:00:00+00:00,,Live - Primary,Live,Fine Gael,Fine_Gael,2024-11-29,,Cork-East,Cork East,34th Dáil,dail,house,34,2024-11-29,,Noel,Noel-McCarthy.D.2024-11-29,McCarthy,,Noel McCarthy,,,,,,,Sessional,2025-04-30 00:00:00+00:00,,Select Committee on the Implementation of the Good Friday Agreement ,2025-05-01 00:00:00+00:00,,Shadow Department,2025-05-07 00:00:00+00:00,,Live - Primary,Live,,,,,,,,,,,,,,,,,,,,,,,,,,,,,,,,,,,,,,,,,,,,,,,,,,,,,,,,,,,,,,,,,,,,,,,,,,,,,,,,,,,,,,,,,,,,,,,,,,,,,,,,,,,,,,,,,,,,,,,,,,,,,,,,,,,,,,,,,,,,,,,,,,,,,,,,,,,,,,false,2024
,,,,,,,,,,,,,,,,,,,,,,,,,,,,,,,,,Fianna Fáil,Fianna_Fáil,2024-11-29,,Donegal,Donegal,34th Dáil,dail,house,34,2024-11-29,,Charlie,Charlie-McConalogue.D.2011-03-09,McConalogue,,Charlie McConalogue,,,,,,,,,,,,,,,,,,"Minister of State at the Department of Tourism, Culture, Arts, Gaeltacht, Sport and Media",2025-01-29,2025-06-01,,,,,,,,,,,,,,,,,,,,,,,,,,,,,,,,,,,,,,,,,,,,,,,,,,,,,,,,,,,,,,,,,,,,,,,,,,,,,,,,,,,"Minister of State at the Department of Culture, Communications and Sport",2025-06-02,,,,,,,,,,,,,,,,,,,,,,,,,,,,,,,,,,,,,,,,,,,,,,,,,,,,,,,,,,,,,,,,,,,,,,,true,2011
Sessional,2025-05-13 00:00:00+00:00,,"Joint Committee on Enterprise, Tourism and Employment",2025-05-01 00:00:00+00:00,,Shadow Department,2025-05-07 00:00:00+00:00,,Live - Primary,Live,Sessional,2025-05-12 00:00:00+00:00,,Joint Committee on Key Issues Affecting the Traveller Community,2025-05-01 00:00:00+00:00,,Policy,2025-05-07 00:00:00+00:00,,Live - Primary,Live,Sessional,2025-05-07 00:00:00+00:00,,Joint Committee on Infrastructure and National Development Plan Delivery,2025-05-01 00:00:00+00:00,,Shadow Department,2025-05-07 00:00:00+00:00,,Live - Primary,Live,Fianna Fáil,Fianna_Fáil,2024-11-29,,Offaly,Offaly,34th Dáil,dail,house,34,2024-11-29,,Tony,Tony-McCormack.D.2024-11-29,McCormack,,Tony McCormack,,,,,,,Sessional,2025-04-30 00:00:00+00:00,,"Select Committee on Enterprise, Tourism and Employment",2025-05-01 00:00:00+00:00,,Shadow Department,2025-05-07 00:00:00+00:00,,Live - Primary,Live,,,,,,,,,,Sessional,2025-04-30 00:00:00+00:00,,Select Committee on Key Issues Affecting the Traveller Community,2025-05-01 00:00:00+00:00,,Policy,2025-05-07 00:00:00+00:00,,Live - Primary,Live,Sessional,2025-04-30 00:00:00+00:00,,Select Committee on Infrastructure and National Development Plan Delivery,2025-05-01 00:00:00+00:00,,Shadow Department,2025-05-07 00:00:00+00:00,,Live - Primary,Live,,,,,,,,,,,,,,,,,,,,,,,,,,,,,,,,,,,,,,,,,,,,,,,,,,,,,,,,,,,,,,,,,,,,,,,,,,,,,,,,,,,,,,,,,,,,,,,,,,,,,,,,,,,,,,,,,,,,,,,,,,,,,,,false,2024
,,,,,,,,,,,,,,,,,,,,,,,,,,,,,,,,,Sinn Féin,Sinn_Féin,2024-11-29,,Dublin-Central,Dublin Central,34th Dáil,dail,house,34,2024-11-29,,Mary Lou,Mary-Lou-McDonald.D.2011-03-09,McDonald,,Mary Lou McDonald,,,,,,,,,,,,,,,,,,,,,,,,,,,,,,,,,,,,,,,,,,,,,,,,,,,,,,,,,,,,,,,,,,,,,,,,,,,,,,,,,,,,,,,,,,,,,,,,,,,,,,,,,,,,,,,,,,,,,,,,,,,,,,,,,,,,,,,,,,,,,,,,,,,,,,,,,,,,,,,,,,,,,,,,,,,,,,,false,2011
,,,,,,,,,,,,,,,,,,,,,,,,,,,,,,,,,Fine Gael,Fine_Gael,2024-11-29,,Meath-East,Meath East,34th Dáil,dail,house,34,2024-11-29,,Helen,Helen-McEntee.D.2013-03-27,McEntee,,Helen McEntee,,,,,,,,,,,,,,,,,,Minister for Education and Youth,2025-05-02,2025-11-18,,,,,,,,,,,,,,,,,,,,,,,,,,,,,,,,,,,,,,,,,,,,,,,,,,,,,,,,,,,,,,,,,,,,,,,,,,,,,,,,,,,Minister for Foreign Affairs and Trade,2025-11-18,,,,,,,,Minister for Defence,2025-11-18,,Minister for Education,2025-01-23,2025-05-01,,,,,,,,,,,,,,,,,,,,,,,,,,,,,,,,,,,,,,,,,,,,,,,,,,,,,,,,,,true,2013
Sessional,2025-05-13 00:00:00+00:00,,"Joint Committee on Further and Higher Education, Research, Innovation and Science",2025-05-01 00:00:00+00:00,,Shadow Department,2025-05-07 00:00:00+00:00,,Live - Primary,Live,Sessional,2025-04-30 00:00:00+00:00,,"Select Committee on Further and Higher Education, Research, Innovation and Science",2025-05-01 00:00:00+00:00,,Shadow Department,2025-05-07 00:00:00+00:00,,Live - Primary,Live,,,,,,,,,,,,Sinn Féin,Sinn_Féin,2024-11-29,,Clare,Clare,34th Dáil,dail,house,34,2024-11-29,,Donna,Donna-McGettigan.D.2024-11-29,McGettigan,,Donna McGettigan,,,,,,,,,,,,,,,,,,,,,,,,,,,,,,,,,,,,,,,,,,,,,,,,,,,,,,,,,,,,,,,,,,,,,,,,,,,,,,,,,,,,,,,,,,,,,,,,,,,,,,,,,,,,,,,,,,,,,,,,,,,,,,,,,,,,,,,,,,,,,,,,,,,,,,,,,,,,,,,,,,,,,,,,,,,,,,,false,2024
Standing,2025-02-12 00:00:00+00:00,,Joint Committee on Remit Oversight,2025-01-29 00:00:00+00:00,,Parliamentary Regulation and Reform,2025-05-21 00:00:00+00:00,,Live - Primary,Live,Standing,2024-12-18 00:00:00+00:00,,Committee on Parliamentary Privileges and Oversight (Dáil Éireann),2024-11-29 00:00:00+00:00,,Parliamentary Regulation and Reform,2025-05-21 00:00:00+00:00,,Live - Primary,Live,Standing,2024-12-18 00:00:00+00:00,,Committee on Budgetary Oversight,2024-11-29 00:00:00+00:00,,Oversight,2025-05-07 00:00:00+00:00,,Live - Primary,Live,Independent,Independent,2024-11-29,,Tipperary-South,Tipperary South,34th Dáil,dail,house,34,2024-11-29,,Mattie,Mattie-McGrath.D.2007-06-14,McGrath,,Mattie McGrath,,,,,,,Standing,2024-12-18 00:00:00+00:00,,Committee on Remit Oversight (Dáil Éireann),2025-01-29 00:00:00+00:00,,Parliamentary Regulation and Reform,2025-05-21 00:00:00+00:00,,Live - Primary,Live,,,,,,,,,,,,,,,,,,,,,,,,,,,,,,,,,,,,,,,,,,,,,,,,,,,,,,,,,,,,,,,,,,,,,,,,,,,,,,,,,,,,,,,,,,,,,,,,,,,,,,,,,,,,,,,,,,,,,,,,,,,,,,,,,,,,,,,,,,,,,,,,,,,,,,,,,,,,,,false,2007
Sessional,2025-05-07 00:00:00+00:00,,"Joint Committee on Housing, Local Government and Heritage",2025-05-01 00:00:00+00:00,,Shadow Department,2025-05-07 00:00:00+00:00,,Live - Primary,Live,Sessional,2025-05-12 00:00:00+00:00,,Joint Committee on Key Issues Affecting the Traveller Community,2025-05-01 00:00:00+00:00,,Policy,2025-05-07 00:00:00+00:00,,Live - Primary,Live,Standing,2024-12-18 00:00:00+00:00,,Committee of Public Accounts,2024-11-29 00:00:00+00:00,,Oversight,2025-05-07 00:00:00+00:00,,Live - Primary,Live,Fianna Fáil,Fianna_Fáil,2024-11-29,,Cork-South-Central,Cork South-Central,34th Dáil,dail,house,34,2024-11-29,,Séamus,Séamus-McGrath.D.2024-11-29,McGrath,,Séamus McGrath,Leas-Chathaoirleach,2025-05-20 00:00:00+00:00,,,,,Sessional,2025-04-30 00:00:00+00:00,,"Select Committee on Housing, Local Government and Heritage",2025-05-01 00:00:00+00:00,,Shadow Department,2025-05-07 00:00:00+00:00,,Live - Primary,Live,,,,,,,,,,Sessional,2025-04-30 00:00:00+00:00,,Select Committee on Key Issues Affecting the Traveller Community,2025-05-01 00:00:00+00:00,,Policy,2025-05-07 00:00:00+00:00,,Live - Primary,Live,,,,,,,,,,,,,,,,,,,,,,,,,,,,,,,,,,,,,Leas-Chathaoirleach,2025-05-20 00:00:00+00:00,,,,,,,,,,,,,,,,,,,,,,,,,,,,,,,,,,,,,,,,,,,,,,,,,,,,,,,,,,,,,,,,,,,,,,,,,,,,,,,,,,,,,,,,,,,,,,,,,,,,false,2024
Sessional,2025-05-07 00:00:00+00:00,,"Joint Committee on Finance, Public Expenditure, Public Service Reform and Digitalisation, and Taoiseach",2025-05-01 00:00:00+00:00,,Shadow Department,2025-05-07 00:00:00+00:00,,Live - Primary,Live,Sessional,2025-05-13 00:00:00+00:00,,"Joint Committee on Further and Higher Education, Research, Innovation and Science",2025-05-01 00:00:00+00:00,,Shadow Department,2025-05-07 00:00:00+00:00,,Live - Primary,Live,Standing,2025-02-12 00:00:00+00:00,,Working Group of Committee Cathaoirligh,2025-01-29 00:00:00+00:00,,The Committee System and Parliamentary Administration,2025-05-07 00:00:00+00:00,,Live - Primary,Live,Fianna Fáil,Fianna_Fáil,2024-11-29,,Louth,Louth,34th Dáil,dail,house,34,2024-11-29,,Erin,Erin-McGreehan.S.2020-06-29,McGreehan,,Erin McGreehan,,,,,,,Sessional,2025-05-12 00:00:00+00:00,,Joint Committee on the Implementation of the Good Friday Agreement ,2025-05-01 00:00:00+00:00,,Shadow Department,2025-05-07 00:00:00+00:00,,Live - Primary,Live,,,,,,,,,,Sessional,2025-04-30 00:00:00+00:00,,"Select Committee on Finance, Public Expenditure, Public Service Reform and Digitalisation, and Taoiseach",2025-05-01 00:00:00+00:00,,Shadow Department,2025-05-07 00:00:00+00:00,,Live - Primary,Live,Sessional,2025-04-30 00:00:00+00:00,,"Select Committee on Further and Higher Education, Research, Innovation and Science",2025-05-01 00:00:00+00:00,,Shadow Department,2025-05-07 00:00:00+00:00,,Live - Primary,Live,Sessional,2025-04-30 00:00:00+00:00,,Select Committee on the Implementation of the Good Friday Agreement ,2025-05-01 00:00:00+00:00,,Shadow Department,2025-05-07 00:00:00+00:00,,Live - Primary,Live,Standing transitional,2025-01-23 00:00:00+00:00,2025-05-07 00:00:00+00:00,Select Committee on Subsidiarity (European Union Legislative Scrutiny),2025-01-21 16:29:34.896666+00:00,,Shadow Department,2025-02-13 00:00:00+00:00,2025-05-07 00:00:00+00:00,Dissolved,Dissolved,Cathaoirleach,2025-05-07 00:00:00+00:00,,,,,,,,,,,,,,,,,,,,,,,,,,,,,,,,,,,,,Cathaoirleach,2025-05-07 00:00:00+00:00,,,,,,,,,,,,,,,,,,,,,,,,,,,,,,,,,,,,,,,,,,,,,,,,,,,,,,,,,,,,,,,,,false,2020
Standing,2025-02-12 00:00:00+00:00,,Working Group of Committee Cathaoirligh,2025-01-29 00:00:00+00:00,,The Committee System and Parliamentary Administration,2025-05-07 00:00:00+00:00,,Live - Primary,Live,Sessional,2025-05-07 00:00:00+00:00,,Joint Committee on Fisheries and Maritime Affairs,2025-05-01 00:00:00+00:00,,Shadow Department,2025-05-07 00:00:00+00:00,,Live - Primary,Live,Standing transitional,2025-01-23 00:00:00+00:00,2025-05-07 00:00:00+00:00,Select Committee on Subsidiarity (European Union Legislative Scrutiny),2025-01-21 16:29:34.896666+00:00,,Shadow Department,2025-02-13 00:00:00+00:00,2025-05-07 00:00:00+00:00,Dissolved,Dissolved,Sinn Féin,Sinn_Féin,2024-11-29,,Waterford,Waterford,34th Dáil,dail,house,34,2024-11-29,,Conor D,Conor-D-McGuinness.D.2024-11-29,McGuinness,,Conor D McGuinness,,,,,,,Sessional,2025-04-30 00:00:00+00:00,,Select Committee on Fisheries and Maritime Affairs,2025-05-01 00:00:00+00:00,,Shadow Department,2025-05-07 00:00:00+00:00,,Live - Primary,Live,,,,,,,,,,,,,,,,,,,,,,,,,,,,,,,,,,,,,,,,,,,,,,,,,,,,,,Cathaoirleach,2025-05-07 00:00:00+00:00,,Cathaoirleach,2025-05-07 00:00:00+00:00,,,,,,,,,,,,,,,,,,,,,,,,,,,,,,,,,,,,,,,,,,,,,,,,,,,,,,,,,,,,,,,,,,,,,,,,,,,,,,,,,,,,,,,,,,,,,,,,,,,,false,2024
