Sessional,2025-05-12 00:00:00+00:00,,Joint Committee on Key Issues Affecting the Traveller Community,2025-05-01 00:00:00+00:00,,Policy,2025-05-07 00:00:00+00:00,,Live - Primary,Live,Sessional,2025-05-13 00:00:00+00:00,,Joint Committee on Children and Equality,2025-05-01 00:00:00+00:00,,Shadow Department,2026-01-20 00:00:00+00:00,,Live - Primary,Live,Sessional,2025-05-07 00:00:00+00:00,,Joint Committee on Fisheries and Maritime Affairs,2025-05-01 00:00:00+00:00,,Shadow Department,2025-07-02 00:00:00+00:00,2026-01-20 00:00:00+00:00,Live - Primary,Live,Fianna Fáil,Fianna_Fáil,2024-11-29,,Galway-West,Galway West,34th Dáil,dail,house,34,2024-11-29,,John,John-Connolly.D.2024-11-29,Connolly,,John Connolly,,,,,,,Sessional,2025-05-13 00:00:00+00:00,,"Joint Committee on Further and Higher Education, Research, Innovation and Science",2025-05-01 00:00:00+00:00,,Shadow Department,2025-05-07 00:00:00+00:00,,Live - Primary,Live,,,,,,,,,,Standing,2025-02-12 00:00:00+00:00,,"Comhchoiste na Gaeilge, na Gaeltachta agus Phobal Labhartha na Gaeilge",2025-01-29 00:00:00+00:00,,Policy,2025-05-07 00:00:00+00:00,,Live - Primary,Live,Sessional,2025-04-30 00:00:00+00:00,,Select Committee on Key Issues Affecting the Traveller Community,2025-05-01 00:00:00+00:00,,Policy,2025-05-07 00:00:00+00:00,,Live - Primary,Live,Standing,2025-02-12 00:00:00+00:00,,"Roghchoiste na Gaeilge, na Gaeltachta agus Phobal Labhartha na Gaeilge",2025-01-29 00:00:00+00:00,,Policy,2025-05-07 00:00:00+00:00,,Live - Primary,Live,Sessional,2025-04-30 00:00:00+00:00,,Select Committee on Children and Equality,2025-05-01 00:00:00+00:00,,Shadow Department,2026-01-20 00:00:00+00:00,,Live - Primary,Live,,,,,,,,,,Sessional,2025-04-30 00:00:00+00:00,,"Select Committee on Further and Higher Education, Research, Innovation and Science",2025-05-01 00:00:00+00:00,,Shadow Department,2025-05-07 00:00:00+00:00,,Live - Primary,Live,Sessional,2025-04-30 00:00:00+00:00,,Select Committee on Fisheries and Maritime Affairs,2025-05-01 00:00:00+00:00,,Shadow Department,2025-07-02 00:00:00+00:00,2026-01-20 00:00:00+00:00,Live - Primary,[],Live,,,,,,,,,,,,,,,,Joint Committee on Children and Equality,2025-05-01 00:00:00+00:00,,Select Committee on Children and Equality,2025-05-01 00:00:00+00:00,,,,,,,,,,,,,,,,,,,,,,,,,,,,,,,,,,,,,,,,,,,,,,,,,,,,,false,2024
Sessional,2025-05-12 00:00:00+00:00,,Joint Committee on the Implementation of the Good Friday Agreement ,2025-05-01 00:00:00+00:00,,Shadow Department,2025-05-07 00:00:00+00:00,,Live - Primary,Live,Sessional,2025-05-13 00:00:00+00:00,,"Joint Committee on Enterprise, Tourism and Employment",2025-05-01 00:00:00+00:00,,Shadow Department,2025-05-07 00:00:00+00:00,,Live - Primary,Live,Standing,2025-02-12 00:00:00+00:00,,Working Group of Committee Cathaoirligh,2025-01-29 00:00:00+00:00,,The Committee System and Parliamentary Administration,2025-05-07 00:00:00+00:00,,Live - Primary,Live,Sinn Féin,Sinn_Féin,2024-11-29,,Mayo,Mayo,34th Dáil,dail,house,34,2024-11-29,,Rose,Rose-Conway-Walsh.S.2016-04-25,Conway-Walsh,,Rose Conway-Walsh,,,,,,,Sessional,2025-05-13 00:00:00+00:00,,Joint Committee on Defence and National Security,2025-05-01 00:00:00+00:00,,Shadow Department,2025-05-07 00:00:00+00:00,,Live - Primary,Live,,,,,,,,,,Sessional,2025-04-30 00:00:00+00:00,,Select Committee on Defence and National Security,2025-05-01 00:00:00+00:00,,Shadow Department,2025-05-07 00:00:00+00:00,,Live - Primary,Live,Sessional,2025-04-30 00:00:00+00:00,,Select Committee on the Implementation of the Good Friday Agreement ,2025-05-01 00:00:00+00:00,,Shadow Department,2025-05-07 00:00:00+00:00,,Live - Primary,Live,Sessional,2025-04-30 00:00:00+00:00,,"Select Committee on Enterprise, Tourism and Employment",2025-05-01 00:00:00+00:00,,Shadow Department,2025-05-07 00:00:00+00:00,,Live - Primary,Live,,,,,,,,,,,,,,,Cathaoirleach,2025-05-07 00:00:00+00:00,,,,,,,,,,,,,,,,,,,,,,,,,,,,,,,Cathaoirleach,2025-05-07 00:00:00+00:00,,,,,,,,,,,,,,,,,,,,,,,,,,,,,,,,,,,,,,,,,,,,,,,,,,,,,,,,,,,,,,,,,,,,false,2016
Sessional,2025-05-07 00:00:00+00:00,,Joint Committee on Agriculture and Food,2025-05-01 00:00:00+00:00,,Shadow Department,2025-05-07 00:00:00+00:00,,Live - Primary,Live,Sessional,2025-05-07 00:00:00+00:00,,Joint Committee on Fisheries and Maritime Affairs,2025-05-01 00:00:00+00:00,,Shadow Department,2025-05-07 00:00:00+00:00,,Live - Primary,Live,Sessional,2025-05-07 00:00:00+00:00,,"Joint Committee on Housing, Local Government and Heritage",2025-05-01 00:00:00+00:00,,Shadow Department,2025-05-07 00:00:00+00:00,,Live - Primary,Live,Fine Gael,Fine_Gael,2024-11-29,,Clare,Clare,34th Dáil,dail,house,34,2024-11-29,,Joe,Joe-Cooney.D.2024-11-29,Cooney,,Joe Cooney,,,,,,,Sessional,2025-04-30 00:00:00+00:00,,Select Committee on Agriculture and Food,2025-05-01 00:00:00+00:00,,Shadow Department,2025-05-07 00:00:00+00:00,,Live - Primary,Live,,,,,,,,,,Sessional,2025-04-30 00:00:00+00:00,,Select Committee on Fisheries and Maritime Affairs,2025-05-01 00:00:00+00:00,,Shadow Department,2025-05-07 00:00:00+00:00,,Live - Primary,Live,Sessional,2025-04-30 00:00:00+00:00,,"Select Committee on Housing, Local Government and Heritage",2025-05-01 00:00:00+00:00,,Shadow Department,2025-05-07 00:00:00+00:00,,Live - Primary,Live,,,,,,,,,,,,,,,,,,,,,,,,,,,,,,,,,,,,,,,,,,,,,,,,,,,,,,,,,,,,,,,,,,,,,,,,,,,,,,,,,,,,,,,,,,,,,,,,,,,,,,,,,,,,,,,,,,,,,,,,,,,,,,,false,2024
Standing,2025-02-12 00:00:00+00:00,,Joint Committee on Remit Oversight,2025-01-29 00:00:00+00:00,,Parliamentary Regulation and Reform,2025-05-21 00:00:00+00:00,,Live - Primary,Live,Sessional,2025-05-13 00:00:00+00:00,,Joint Committee on Education and Youth,2025-05-01 00:00:00+00:00,,Shadow Department,2025-05-07 00:00:00+00:00,,Live - Primary,Live,Standing,2024-12-18 00:00:00+00:00,,Committee on Parliamentary Privileges and Oversight (Dáil Éireann),2024-11-29 00:00:00+00:00,,Parliamentary Regulation and Reform,2025-05-21 00:00:00+00:00,,Live - Primary,Live,People Before Profit-Solidarity,People_Before_Profit_Solidarity,2024-11-29,,Dublin-West,Dublin West,34th Dáil,dail,house,34,2024-11-29,,Ruth,Ruth-Coppinger.D.2014-05-23,Coppinger,,Ruth Coppinger,,,,,,,Standing,2024-12-18 00:00:00+00:00,,Committee on Remit Oversight (Dáil Éireann),2025-01-29 00:00:00+00:00,,Parliamentary Regulation and Reform,2025-05-21 00:00:00+00:00,,Live - Primary,Live,,,,,,,,,,Sessional,2025-04-30 00:00:00+00:00,,Select Committee on Education and Youth,2025-05-01 00:00:00+00:00,,Shadow Department,2025-05-07 00:00:00+00:00,,Live - Primary,Live,,,,,,,,,,,,,,,,,,,,,,,,,,,,,,,,,,,,,,,,,,,,,,,,,,,,,,,,,,,,,,,,,,,,,,,,,,,,,,,,,,,,,,,,,,,,,,,,,,,,,,,,,,,,,,,,,,,,,,,,,,,,,,,,,,,,,,,,,,false,2014
Sessional,2025-05-07 00:00:00+00:00,,Joint Committee on Infrastructure and National Development Plan Delivery,2025-05-01 00:00:00+00:00,,Shadow Department,2025-05-07 00:00:00+00:00,,Live - Primary,Live,Sessional,2025-05-13 00:00:00+00:00,,"Joint Committee on Climate, Environment and Energy",2025-05-01 00:00:00+00:00,,Shadow Department,2025-05-07 00:00:00+00:00,,Live - Primary,Live,Sessional,2025-04-30 00:00:00+00:00,,Select Committee on Infrastructure and National Development Plan Delivery,2025-05-01 00:00:00+00:00,,Shadow Department,2025-05-07 00:00:00+00:00,,Live - Primary,Live,Sinn Féin,Sinn_Féin,2024-11-29,,Kildare-North,Kildare North,34th Dáil,dail,house,34,2024-11-29,,Réada,Réada-Cronin.D.2020-02-08,Cronin,,Réada Cronin,,,,,,,Sessional,2025-04-30 00:00:00+00:00,,"Select Committee on Climate, Environment and Energy",2025-05-01 00:00:00+00:00,,Shadow Department,2025-05-07 00:00:00+00:00,,Live - Primary,Live,,,,,,,,,,,,,,,,,,,,,,,,,,,,,,,,,,,,,,,,,,,,,,,,,,,,,,,,,,,,,,,,,,,,,,,,,,,,,,,,,,,,,,,,,,,,,,,,,,,,,,,,,,,,,,,,,,,,,,,,,,,,,,,,,,,,,,,,,,,,,,,,,,,,,,,,,,,,,,false,2020
Sessional,2025-05-13 00:00:00+00:00,,Joint Committee on Education and Youth,2025-05-01 00:00:00+00:00,,Shadow Department,2025-05-07 00:00:00+00:00,,Live - Primary,Live,Sessional,2025-05-13 00:00:00+00:00,,Joint Committee on Transport,2025-05-01 00:00:00+00:00,,Shadow Department,2025-05-07 00:00:00+00:00,,Live - Primary,Live,Standing,2025-02-12 00:00:00+00:00,,Working Group of Committee Cathaoirligh,2025-01-29 00:00:00+00:00,,The Committee System and Parliamentary Administration,2025-05-07 00:00:00+00:00,,Live - Primary,Live,Fianna Fáil,Fianna_Fáil,2024-11-29,,Clare,Clare,34th Dáil,dail,house,34,2024-11-29,,Cathal,Cathal-Crowe.D.2020-02-08,Crowe,,Cathal Crowe,Cathaoirleach,2025-05-07 00:00:00+00:00,,,,,Sessional,2025-04-30 00:00:00+00:00,,Select Committee on Education and Youth,2025-05-01 00:00:00+00:00,,Shadow Department,2025-05-07 00:00:00+00:00,,Live - Primary,Live,,,,,,,,,,Sessional,2025-04-30 00:00:00+00:00,,Select Committee on Transport,2025-05-01 00:00:00+00:00,,Shadow Department,2025-05-07 00:00:00+00:00,,Live - Primary,Live,Standing,2024-12-18 00:00:00+00:00,,Committee on Budgetary Oversight,2024-11-29 00:00:00+00:00,,Oversight,2025-05-07 00:00:00+00:00,,Live - Primary,Live,,,,,,,,,,,,,,,,,,,,,,,,,,Cathaoirleach,2025-05-07 00:00:00+00:00,,,,,,,,,,,,,,,,,,,,,,,,,,,,,,,,,,,,,,,,,,,,,,,,,,,,,,,,,,,,,,,,,,,,,,,,,,,,,,,,,,,,,,,,,,,,,,,,,,,,false,2020
Sessional,2025-05-13 00:00:00+00:00,,Joint Committee on European Union Affairs,2025-05-01 00:00:00+00:00,,Shadow Department,2025-05-07 00:00:00+00:00,,Live - Primary,Live,Sessional,2025-05-12 00:00:00+00:00,,Joint Committee on the Implementation of the Good Friday Agreement ,2025-05-01 00:00:00+00:00,,Shadow Department,2025-05-07 00:00:00+00:00,,Live - Primary,Live,Sessional,2025-04-30 00:00:00+00:00,,Select Committee on the Implementation of the Good Friday Agreement ,2025-05-01 00:00:00+00:00,,Shadow Department,2025-05-07 00:00:00+00:00,,Live - Primary,Live,Sinn Féin,Sinn_Féin,2024-11-29,,Dublin-South-West,Dublin South-West,34th Dáil,dail,house,34,2024-11-29,,Seán,Seán-Crowe.D.2002-06-06,Crowe,,Seán Crowe,,,,,,,Sessional,2025-04-30 00:00:00+00:00,,Select Committee on European Union Affairs,2025-05-01 00:00:00+00:00,,Shadow Department,2025-05-07 00:00:00+00:00,,Live - Primary,Live,,,,,,,,,,,,,,,,,,,,,,,,,,,,,,,,,,,,,,,,,,,,,,,,,,,,,,,,,,,,,,,,,,,,,,,,,,,,,,,,,,,,,,,,,,,,,,,,,,,,,,,,,,,,,,,,,,,,,,,,,,,,,,,,,,,,,,,,,,,,,,,,,,,,,,,,,,,,,,false,2002
Sessional,2025-05-13 00:00:00+00:00,,Joint Committee on Health,2025-05-01 00:00:00+00:00,,Shadow Department,2025-05-07 00:00:00+00:00,,Live - Primary,Live,Sessional,2025-04-30 00:00:00+00:00,,Select Committee on Health,2025-05-01 00:00:00+00:00,,Shadow Department,2025-05-07 00:00:00+00:00,,Live - Primary,Live,,,,,,,,,,,,Sinn Féin,Sinn_Féin,2024-11-29,,Waterford,Waterford,34th Dáil,dail,house,34,2024-11-29,,David,David-Cullinane.S.2011-05-25,Cullinane,,David Cullinane,,,,,,,,,,,,,,,,,,,,,,,,,,,,,,,,,,,,,,,,,,,,,,,,,,,,,,,,,,,,,,,,,,,,,,,,,,,,,,,,,,,,,,,,,,,,,,,,,,,,,,,,,,,,,,,,,,,,,,,,,,,,,,,,,,,,,,,,,,,,,,,,,,,,,,,,,,,,,,,,,,,,,,,,,,,,,,,false,2011
Standing,2025-02-12 00:00:00+00:00,,Joint Committee on Remit Oversight,2025-01-29 00:00:00+00:00,,Parliamentary Regulation and Reform,2025-05-21 00:00:00+00:00,,Live - Primary,Live,Sessional,2025-05-13 00:00:00+00:00,,Joint Committee on Education and Youth,2025-05-01 00:00:00+00:00,,Shadow Department,2025-05-07 00:00:00+00:00,,Live - Primary,Live,Standing,2024-12-18 00:00:00+00:00,,Committee on Parliamentary Privileges and Oversight (Dáil Éireann),2024-11-29 00:00:00+00:00,,Parliamentary Regulation and Reform,2025-05-21 00:00:00+00:00,,Live - Primary,Live,Social Democrats,Social_Democrats,2024-11-29,,Dublin-South-Central,Dublin South-Central,34th Dáil,dail,house,34,2024-11-29,,Jen,Jen-Cummins.D.2024-11-29,Cummins,,Jen Cummins,,,,,,,Standing,2024-12-18 00:00:00+00:00,,Committee on Remit Oversight (Dáil Éireann),2025-01-29 00:00:00+00:00,,Parliamentary Regulation and Reform,2025-05-21 00:00:00+00:00,,Live - Primary,Live,,,,,,,,,,Sessional,2025-04-30 00:00:00+00:00,,Select Committee on Education and Youth,2025-05-01 00:00:00+00:00,,Shadow Department,2025-05-07 00:00:00+00:00,,Live - Primary,Live,,,,,,,,,,,,,,,,,,,,,,,,,,,,,,,,,,,,,,,,,,,,,,,,,,,,,,,,,,,,,,,,,,,,,,,,,,,,,,,,,,,,,,,,,,,,,,,,,,,,,,,,,,,,,,,,,,,,,,,,,,,,,,,,,,,,,,,,,,false,2024
,,,,,,,,,,,,,,,,,,,,,,,,,,,,,,,,,Fine Gael,Fine_Gael,2024-11-29,,Waterford,Waterford,34th Dáil,dail,house,34,2024-11-29,,John,John-Cummins.S.2020-03-30,Cummins,,John Cummins,,,,,,,,,,,,,,,,,,"Minister of State at the Department of Housing, Local Government and Heritage",2025-01-29,,,,,,,,,,,,,,,,,,,,,,,,,,,,,,,,,,,,,,,,,,,,,,,,,,,,,,,,,,,,,,,,,,,,,,,,,,,,,,,,,,,,,,,,,,,,,,,,,,,,,,,,,,,,,,,,,,,,,,,,,,,,,,,,,,,,,,,,,,,,,,,,,,,,,,,,,,,,true,2020
Sessional,2025-05-13 00:00:00+00:00,,Joint Committee on Education and Youth,2025-05-01 00:00:00+00:00,,Shadow Department,2025-05-07 00:00:00+00:00,2026-05-26 00:00:00+00:00,Live - Primary,Live,Standing,2025-02-12 00:00:00+00:00,,Joint Committee on Remit Oversight,2025-01-29 00:00:00+00:00,,Parliamentary Regulation and Reform,2025-05-21 00:00:00+00:00,,Live - Primary,Live,Sessional,2025-05-13 00:00:00+00:00,,Joint Committee on Transport,2025-05-01 00:00:00+00:00,,Shadow Department,2025-05-07 00:00:00+00:00,,Live - Primary,Live,Fine Gael,Fine_Gael,2024-11-29,,Dublin-West,Dublin West,34th Dáil,dail,house,34,2024-11-29,,Emer,Emer-Currie.S.2020-06-29,Currie,,Emer Currie,,,,,,,Sessional,2025-05-13 00:00:00+00:00,,Joint Committee on Children and Equality,2025-05-01 00:00:00+00:00,,Shadow Department,2025-05-07 00:00:00+00:00,,Live - Primary,Live,,,,,,,Joint Committee on Children and Equality,2025-05-01 00:00:00+00:00,,Standing,2024-12-18 00:00:00+00:00,,Business Committee (Dáil Éireann),2024-11-29 00:00:00+00:00,,Parliamentary Business and Committee Membership,2025-01-16 00:00:00+00:00,,Live - Primary,Live,Standing,2024-12-18 00:00:00+00:00,,Committee of Selection (Dáil Éireann),2024-11-29 00:00:00+00:00,,Parliamentary Business and Committee Membership,2025-01-16 00:00:00+00:00,,Live - Primary,Live,Standing,2024-12-18 00:00:00+00:00,,Committee on Remit Oversight (Dáil Éireann),2025-01-29 00:00:00+00:00,,Parliamentary Regulation and Reform,2025-05-21 00:00:00+00:00,,Live - Primary,Live,Sessional,2025-04-30 00:00:00+00:00,,Select Committee on Children and Equality,2025-05-01 00:00:00+00:00,,Shadow Department,2025-05-07 00:00:00+00:00,,Live - Primary,Live,,,,,,,,,,Standing,2024-12-18 00:00:00+00:00,,Committee on Parliamentary Privileges and Oversight (Dáil Éireann),2024-11-29 00:00:00+00:00,,Parliamentary Regulation and Reform,2025-05-21 00:00:00+00:00,,Live - Primary,Live,Standing,2024-12-18 00:00:00+00:00,,Committee on Standing Orders and Dáil Reform,2024-11-29 00:00:00+00:00,,Parliamentary Regulation and Reform,2025-01-16 00:00:00+00:00,,Live - Primary,[],Live,,,,,,,,,,,,,,,,,,,Select Committee on Children and Equality,2025-05-01 00:00:00+00:00,,Sessional,2025-04-30 00:00:00+00:00,,Select Committee on Education and Youth,2025-05-01 00:00:00+00:00,,Shadow Department,2025-05-07 00:00:00+00:00,2026-05-26 00:00:00+00:00,Live - Primary,[],Live,Sessional,Committees' Secretariat,2025-04-30 00:00:00+00:00,,Select Committee on Transport,2025-05-01 00:00:00+00:00,,Shadow Department,2025-05-07 00:00:00+00:00,,Live - Primary,[],Live,,,,,,,,,,,,,,,,,,,,,,,,,,,false,2020
Sessional,2025-05-13 00:00:00+00:00,,Joint Committee on Disability Matters,2025-05-01 00:00:00+00:00,,Shadow Department,2025-05-07 00:00:00+00:00,,Live - Primary,Live,Sessional,2025-05-13 00:00:00+00:00,,Joint Committee on Health,2025-05-01 00:00:00+00:00,,Shadow Department,2025-05-07 00:00:00+00:00,,Live - Primary,Live,Sessional,2025-04-30 00:00:00+00:00,,Select Committee on Disability Matters,2025-05-01 00:00:00+00:00,,Shadow Department,2025-05-07 00:00:00+00:00,,Live - Primary,Live,Fianna Fáil,Fianna_Fáil,2024-11-29,,Roscommon-Galway,Roscommon-Galway,34th Dáil,dail,house,34,2024-11-29,,Martin,Martin-Daly.D.2024-11-29,Daly,,Martin Daly,,,,,,,Sessional,2025-04-30 00:00:00+00:00,,Select Committee on Health,2025-05-01 00:00:00+00:00,,Shadow Department,2025-05-07 00:00:00+00:00,,Live - Primary,Live,,,,,,,,,,,,,,,,,,,,,,,,,,,,,,,,,,,,,,,,,,,,,,,,,,,,,,,,,,,,,,,,,,,,,,,,,,,,,,,,,,,,,,,,,,,,,,,,,,,,,,,,,,,,,,,,,,,,,,,,,,,,,,,,,,,,,,,,,,,,,,,,,,,,,,,,,,,,,,false,2024
Sessional,2025-05-13 00:00:00+00:00,,Joint Committee on Transport,2025-05-01 00:00:00+00:00,,Shadow Department,2025-05-07 00:00:00+00:00,,Live - Primary,Live,Sessional,2025-05-13 00:00:00+00:00,,"Joint Committee on Climate, Environment and Energy",2025-05-01 00:00:00+00:00,,Shadow Department,2025-05-07 00:00:00+00:00,,Live - Primary,Live,Sessional,2025-04-30 00:00:00+00:00,,Select Committee on Transport,2025-05-01 00:00:00+00:00,,Shadow Department,2025-05-07 00:00:00+00:00,,Live - Primary,Live,Sinn Féin,Sinn_Féin,2024-11-29,,Kerry,Kerry,34th Dáil,dail,house,34,2024-11-29,,Pa,Pa-Daly.D.2020-02-08,Daly,,Pa Daly,,,,,,,Sessional,2025-04-30 00:00:00+00:00,,"Select Committee on Climate, Environment and Energy",2025-05-01 00:00:00+00:00,,Shadow Department,2025-05-07 00:00:00+00:00,,Live - Primary,Live,,,,,,,,,,,,,,,,,,,,,,,,,,,,,,,,,,,,,,,,,,,,,,,,,,,,,,,,,,,,,,,,,,,,,,,,,,,,,,,,,,,,,,,,,,,,,,,,,,,,,,,,,,,,,,,,,,,,,,,,,,,,,,,,,,,,,,,,,,,,,,,,,,,,,,,,,,,,,,false,2020
Sessional,2025-05-13 00:00:00+00:00,,Joint Committee on Disability Matters,2025-05-01 00:00:00+00:00,,Shadow Department,2026-04-16 00:00:00+00:00,,Live - Primary,Live,Sessional,2025-05-13 00:00:00+00:00,,Joint Committee on Children and Equality,2025-05-01 00:00:00+00:00,,Shadow Department,2025-05-07 00:00:00+00:00,,Live - Primary,Live,Sessional,2025-05-13 00:00:00+00:00,,Joint Committee on Education and Youth,2025-05-01 00:00:00+00:00,,Shadow Department,2025-05-07 00:00:00+00:00,,Live - Primary,Live,Fianna Fáil,Fianna_Fáil,2024-11-29,,Meath-West,Meath West,34th Dáil,dail,house,34,2024-11-29,,Aisling,Aisling-Dempsey.D.2024-11-29,Dempsey,,Aisling Dempsey,,,,,,,Sessional,2025-04-30 00:00:00+00:00,,Select Committee on Education and Youth,2025-05-01 00:00:00+00:00,,Shadow Department,2025-05-07 00:00:00+00:00,,Live - Primary,Live,,,,,,,,,,Sessional,2025-04-30 00:00:00+00:00,,Select Committee on Disability Matters,2025-05-01 00:00:00+00:00,,Shadow Department,2026-04-16 00:00:00+00:00,,Live - Primary,Live,Sessional,2025-04-30 00:00:00+00:00,,Select Committee on Children and Equality,2025-05-01 00:00:00+00:00,,Shadow Department,2025-05-07 00:00:00+00:00,,Live - Primary,Live,Standing,2024-12-18 00:00:00+00:00,,Committee on Standing Orders and Dáil Reform,2024-11-29 00:00:00+00:00,,Parliamentary Regulation and Reform,2025-01-24 00:00:00+00:00,,Live - Primary,Live,,,,,,,,,,,,Leas-Chathaoirleach,2025-06-19 00:00:00+00:00,,,,,,,,,,,,,,,,,,,,,,,,,,,,,,,,,,,,,Leas-Chathaoirleach,2025-06-19 00:00:00+00:00,,,,,,,,Joint Committee on Children and Equality,2025-05-01 00:00:00+00:00,,,,,,,,,,,,,,,,,,,,,,,,,,,,,,Select Committee on Children and Equality,2025-05-01 00:00:00+00:00,,,,,,,,,,,,,,,,,,,,,,,,,false,2024
Special,2025-05-13 00:00:00+00:00,,Joint Committee on Drugs Use,2025-05-01 00:00:00+00:00,,Policy,2025-05-07 00:00:00+00:00,,Live - Primary,Live,Standing,2024-12-18 00:00:00+00:00,,Committee on Budgetary Oversight,2024-11-29 00:00:00+00:00,,Oversight,2025-05-07 00:00:00+00:00,,Live - Primary,Live,Special,2025-04-30 00:00:00+00:00,,Select Committee on Drugs Use,2025-05-01 00:00:00+00:00,,Policy,2025-05-07 00:00:00+00:00,,Live - Primary,Live,Sinn Féin,Sinn_Féin,2024-11-29,,Dublin-South-Central,Dublin South-Central,34th Dáil,dail,house,34,2024-11-29,,Máire,Máire-Devine.S.2016-04-25,Devine,,Máire Devine,,,,,,,,,,,,,,,,,,,,,,,,,,,,,,,,,,,,,,,,,,,,,,,,,,,,,,,,,,,,,,,,,,,,,,,,,,,,,,,,,,,,,,,,,,,,,,,,,,,,,,,,,,,,,,,,,,,,,,,,,,,,,,,,,,,,,,,,,,,,,,,,,,,,,,,,,,,,,,,,,,,,,,,,,,,,,,,false,2016
Standing,2025-02-12 00:00:00+00:00,,Working Group of Committee Cathaoirligh,2025-01-29 00:00:00+00:00,,The Committee System and Parliamentary Administration,2025-05-07 00:00:00+00:00,2025-05-07 00:00:00+00:00,Live - Primary,Live,Sessional,2025-05-12 00:00:00+00:00,,Joint Committee on the Implementation of the Good Friday Agreement ,2025-05-01 00:00:00+00:00,,Shadow Department,2025-05-07 00:00:00+00:00,,Live - Primary,Live,Sessional,2025-04-30 00:00:00+00:00,,Select Committee on the Implementation of the Good Friday Agreement ,2025-05-01 00:00:00+00:00,,Shadow Department,2025-05-07 00:00:00+00:00,,Live - Primary,Live,Fianna Fáil,Fianna_Fáil,2024-11-29,,Dún-Laoghaire,Dún Laoghaire,34th Dáil,dail,house,34,2024-11-29,,Cormac,Cormac-Devlin.D.2020-02-08,Devlin,,Cormac Devlin,,,,Cathaoirleach,2025-05-07 00:00:00+00:00,,Standing,2024-12-18 00:00:00+00:00,,Committee on Standing Orders and Dáil Reform,2024-11-29 00:00:00+00:00,,Parliamentary Regulation and Reform,2025-01-24 00:00:00+00:00,,Live - Primary,Live,,,,,,,,,,Standing,2024-12-18 00:00:00+00:00,,Committee on Budgetary Oversight,2024-11-29 00:00:00+00:00,,Oversight,2025-05-07 00:00:00+00:00,,Live - Primary,Live,,,,,,,,,,,,,,,,,,,,,,,,,,,,,,,,,,Cathaoirleach,2025-05-07 00:00:00+00:00,,,,,,,,,,,,,,,,,,,,,,,,,,,,,,,,,,,,,,,,,,,,,,,,,,,,,,,,,,,,,,,,,,,,,,,,,,,,,,,,,,,,,,,,,,,,,,,,,,,,,,,false,2020
,,,,,,,,,,,,,,,,,,,,,,,,,,,,,,,,,Fine Gael,Fine_Gael,2024-11-29,,Mayo,Mayo,34th Dáil,dail,house,34,2024-11-29,,Alan,Alan-Dillon.D.2020-02-08,Dillon,,Alan Dillon,,,,,,,,,,,,,,,,,,"Minister of State at the Department of Enterprise, Trade and Employment and at the Department of the Environment, Climate and Communications",2025-01-29,2025-06-01,,,,,,,,,,,,,,,,,,,,,,,,,,,,,,,,,,,,,,,,,,,,,,,,,,,,,,,,,,,,,,,,,,,,,,,,,,,,,,,,,,,"Minister of State at the Department of Enterprise, Tourism and Employment and at the Department of Climate, Energy and the Environment",2025-06-02,,,,,,,,,,,,,,,,,,,,,,,,,,,,,,,,,,,,,,,,,,,,,,,,,,,,,,,,,,,,,,,,,,,,,,,true,2020
Sessional,2025-05-07 00:00:00+00:00,,"Joint Committee on Finance, Public Expenditure, Public Service Reform and Digitalisation, and Taoiseach",2025-05-01 00:00:00+00:00,,Shadow Department,2025-05-07 00:00:00+00:00,,Live - Primary,Live,Sessional,2025-04-30 00:00:00+00:00,,"Select Committee on Finance, Public Expenditure, Public Service Reform and Digitalisation, and Taoiseach",2025-05-01 00:00:00+00:00,,Shadow Department,2025-05-07 00:00:00+00:00,,Live - Primary,Live,,,,,,,,,,,,Sinn Féin,Sinn_Féin,2024-11-29,,Donegal,Donegal,34th Dáil,dail,house,34,2024-11-29,,Pearse,Pearse-Doherty.S.2007-07-23,Doherty,,Pearse Doherty,,,,,,,,,,,,,,,,,,,,,,,,,,,,,,,,,,,,,,,,,,,,,,,,,,,,,,,,,,,,,,,,,,,,,,,,,,,,,,,,,,,,,,,,,,,,,,,,,,,,,,,,,,,,,,,,,,,,,,,,,,,,,,,,,,,,,,,,,,,,,,,,,,,,,,,,,,,,,,,,,,,,,,,,,,,,,,,false,2007
Sessional,2025-05-13 00:00:00+00:00,,"Joint Committee on Enterprise, Tourism and Employment",2025-05-01 00:00:00+00:00,,Shadow Department,2025-05-07 00:00:00+00:00,,Live - Primary,Live,Standing,2025-02-12 00:00:00+00:00,,Joint Committee on Public Petitions and the Ombudsmen,2025-01-29 00:00:00+00:00,,Oversight,2025-05-07 00:00:00+00:00,2026-04-16 00:00:00+00:00,Live - Primary,Live,Sessional,2025-05-13 00:00:00+00:00,,"Joint Committee on Justice, Home Affairs and Migration",2025-05-01 00:00:00+00:00,,Shadow Department,2026-01-28 00:00:00+00:00,,Live - Primary,Live,Fianna Fáil,Fianna_Fáil,2024-11-29,,Galway-East,Galway East,34th Dáil,dail,house,34,2024-11-29,,Albert,Albert-Dolan.D.2024-11-29,Dolan,,Albert Dolan,,,,,,,Sessional,2025-04-30 00:00:00+00:00,,"Select Committee on Justice, Home Affairs and Migration",2025-05-01 00:00:00+00:00,,Shadow Department,2026-01-28 00:00:00+00:00,,Live - Primary,Live,,,,,,,,,,Sessional,2025-04-30 00:00:00+00:00,,"Select Committee on Enterprise, Tourism and Employment",2025-05-01 00:00:00+00:00,,Shadow Department,2025-05-07 00:00:00+00:00,,Live - Primary,Live,Standing,2025-02-12 00:00:00+00:00,,Select Committee on Public Petitions and the Ombudsmen,2025-01-29 00:00:00+00:00,,Oversight,2025-05-07 00:00:00+00:00,2026-04-16 00:00:00+00:00,Live - Primary,Live,Standing,2024-12-18 00:00:00+00:00,,Committee of Public Accounts,2024-11-29 00:00:00+00:00,,Oversight,2025-05-07 00:00:00+00:00,,Live - Primary,Live,,,,,,,,,,,,Leas-Chathaoirleach,2025-05-27 00:00:00+00:00,2026-04-16 00:00:00+00:00,,,,,,,,,,,,,,,,,,,,,,,,,,,,,,,,,,,,,,,,,,,,,,,,,,,,,,,,,,,,,,,,,,,,,,,,,,,,,,,,,,,,,,,,,,,,,,,,,,,,,,false,2024
Sessional,2025-05-13 00:00:00+00:00,,"Joint Committee on Enterprise, Tourism and Employment",2025-05-01 00:00:00+00:00,,Shadow Department,2025-05-07 00:00:00+00:00,,Live - Primary,Live,Sessional,2025-04-30 00:00:00+00:00,,"Select Committee on Enterprise, Tourism and Employment",2025-05-01 00:00:00+00:00,,Shadow Department,2025-05-07 00:00:00+00:00,,Live - Primary,Live,,,,,,,,,,,,Sinn Féin,Sinn_Féin,2024-11-29,,Dublin-West,Dublin West,34th Dáil,dail,house,34,2024-11-29,,Paul,Paul-Donnelly.D.2020-02-08,Donnelly,,Paul Donnelly,,,,,,,,,,,,,,,,,,,,,,,,,,,,,,,,,,,,,,,,,,,,,,,,,,,,,,,,,,,,,,,,,,,,,,,,,,,,,,,,,,,,,,,,,,,,,,,,,,,,,,,,,,,,,,,,,,,,,,,,,,,,,,,,,,,,,,,,,,,,,,,,,,,,,,,,,,,,,,,,,,,,,,,,,,,,,,,false,2020
,,,,,,,,,,,,,,,,,,,,,,,,,,,,,,,,,Fine Gael,Fine_Gael,2024-11-29,2025-11-21,Dublin-Central,Dublin Central,34th Dáil,dail,house,34,2024-11-29,2025-11-21,Paschal,Paschal-Donohoe.S.2007-07-23,Donohoe,,Paschal Donohoe,,,,,,,,,,,,,,,,,,Minister for Finance,2025-01-23,2025-11-18,,,,,,,,,,,,,,,,,,,,,,,,,,,,,,,,,,,,,,,,,,,,,,,,,,,,,,,,,,,,,,,,,,,,,,,,,,,,,,,,,,,,,,,,,,,,,,,,,,,,,,,,,,,,,,,,,,,,,,,,,,,,,,,,,,,,,,,,,,,,,,,,,,,,,,,,,,,true,2007
,,,,,,,,,,,,,,,,,,,,,,,,,,,,,,,,,Fianna Fáil,Fianna_Fáil,2024-11-29,,Clare,Clare,34th Dáil,dail,house,34,2024-11-29,,Timmy,Timmy-Dooley.S.2002-09-12,Dooley,,Timmy Dooley,,,,,,,,,,,,,,,,,,"Minister of State at the Department of Agriculture, Food and the Marine and at the Department of Climate, Energy and the Environment",2025-06-02,,,,,,,,,,,,,,,,,,,,,,,,,,,,,,,,,,,,,,,,,,,,,,,,,,,,,,,,,,,,,,,,,,,,,,,,,,,,,,,,,,,,"Minister of State at the Department of Agriculture, Food and the Marine and at the Department of the Environment, Climate and Communications",2025-02-25,2025-06-01,,,,,,,,,,,,,,,,,,,,,,,,,,,,,,,,,,,,,,,,,,,,,,,,,,,,,,,,,,,,,,,,,,,,,,true,2002
