first_name,dail_chamber_type,dail_number,dail_term,dail_code,committee_1_member_start_date,committee_1_member_end_date,committee_1_type,committee_1_status,committee_1_name_start_date,committee_1_name_end_date,committee_1_name_en,committee_1_main_status,committee_1_start_date,committee_1_end_date,committee_1_expiry_type,committee_2_member_start_date,committee_2_member_end_date,committee_2_type,committee_2_status,committee_2_name_start_date,committee_2_name_end_date,committee_2_name_en,committee_2_main_status,committee_2_start_date,committee_2_end_date,committee_2_expiry_type,committee_3_member_start_date,committee_3_member_end_date,committee_3_type,committee_3_status,committee_3_name_start_date,committee_3_name_end_date,committee_3_name_en,committee_3_main_status,committee_3_start_date,committee_3_end_date,committee_3_expiry_type,committee_4_member_start_date,committee_4_member_end_date,committee_4_type,committee_4_status,committee_4_name_start_date,committee_4_name_end_date,committee_4_name_en,committee_4_main_status,committee_4_start_date,committee_4_end_date,committee_4_expiry_type,committee_5_member_start_date,committee_5_member_end_date,committee_5_type,committee_5_status,committee_5_name_start_date,committee_5_name_end_date,committee_5_name_en,committee_5_main_status,committee_5_start_date,committee_5_end_date,committee_5_expiry_type,committee_6_member_start_date,committee_6_member_end_date,committee_6_type,member_memberships_0_membership_committees_5_houseCode,member_memberships_0_membership_committees_5_houseNo,committee_6_status,committee_6_name_start_date,committee_6_name_end_date,committee_6_name_en,committee_6_main_status,committee_6_start_date,committee_6_end_date,committee_6_expiry_type,committee_6_role_title,committee_6_role_start_date,committee_6_role_end_date,party_start_date,party_end_date,party,party_code,constituency_code,constituency_name,membership_start_date,membership_end_date,full_name,unique_member_code,last_name,date_of_death,committee_1_alt_name_start_date,committee_1_alt_name_end_date,committee_1_alt_name_en,committee_1_role_title,committee_1_role_start_date,committee_1_role_end_date,committee_2_role_title,committee_2_role_start_date,committee_2_role_end_date,committee_3_role_title,committee_3_role_start_date,committee_3_role_end_date,committee_7_member_start_date,committee_7_member_end_date,committee_7_type,member_memberships_0_membership_committees_6_houseCode,member_memberships_0_membership_committees_6_houseNo,committee_7_status,committee_7_name_start_date,committee_7_name_end_date,committee_7_name_en,committee_7_main_status,committee_7_start_date,committee_7_end_date,committee_7_expiry_type,committee_8_member_start_date,committee_8_member_end_date,committee_8_type,member_memberships_0_membership_committees_7_houseCode,member_memberships_0_membership_committees_7_houseNo,committee_8_status,committee_8_name_start_date,committee_8_name_end_date,committee_8_name_en,committee_8_main_status,committee_8_start_date,committee_8_end_date,committee_8_expiry_type,committee_4_role_title,committee_4_role_start_date,committee_4_role_end_date,party_1_start_date,party_1_end_date,party_1_name,party_1_code,office_1_name,office_1_start_date,office_1_end_date,committee_2_alt_name_start_date,committee_2_alt_name_end_date,committee_2_alt_name_en,ministerial_office,year_elected
Garret,house,27,27th Seanad,seanad,2025-02-26 00:00:00+00:00,,Parliamentary Regulation and Reform,Live - Primary,2025-01-29 00:00:00+00:00,,Committee on Parliamentary Privileges and Oversight (Seanad Éireann),Live,2025-02-12 00:00:00+00:00,,Standing,2025-02-26 00:00:00+00:00,,Parliamentary Business and Committee Membership,Live - Primary,2025-01-29 00:00:00+00:00,,Committee of Selection (Seanad Éireann),Live,2025-02-12 00:00:00+00:00,,Standing,2025-10-21 00:00:00+00:00,,Policy,Live - Primary,2025-07-09 00:00:00+00:00,,Seanad Select Committee on EU Scrutiny and Transparency,Live,2025-07-08 00:00:00+00:00,,Standing,2025-11-20 00:00:00+00:00,,Consultative,Live - Primary,2025-10-23 00:00:00+00:00,,Seanad Public Consultation Committee,Live,2025-10-22 00:00:00+00:00,,Sessional,2025-05-13 00:00:00+00:00,,Shadow Department,Live - Primary,2025-05-01 00:00:00+00:00,,"Joint Committee on Arts, Media, Communications, Culture and Sport",Live,2025-05-07 00:00:00+00:00,,Sessional,2025-05-13 00:00:00+00:00,,Shadow Department,dail,34.0,Live - Primary,2025-05-01 00:00:00+00:00,,Joint Committee on Foreign Affairs and Trade,Live,2025-05-07 00:00:00+00:00,,Sessional,Leas-Chathaoirleach,2025-05-20 00:00:00+00:00,,2025-01-29,,Fine Gael,Fine_Gael,Administrative-Panel,Administrative Panel,2025-01-29,,Garret Ahearn,Garret-Ahearn.S.2020-03-30,Ahearn,,,,,,,,,,,,,,,,,,,,,,,,,,,,,,,,,,,,,,,,,,,,,,,,,,,,,false,2020
Chris,house,27,27th Seanad,seanad,2025-04-02 00:00:00+00:00,2025-05-13 00:00:00+00:00,Shadow Department,Dissolved,2025-03-28 00:00:00+00:00,,Seanad Select Committee on Subsidiarity (European Union Legislative Scrutiny),Dissolved,2025-03-27 00:00:00+00:00,2025-05-13 00:00:00+00:00,Standing transitional,2025-05-13 00:00:00+00:00,,Statutory,Live - Primary,2025-01-29 00:00:00+00:00,,Committee on Members' Interests of Seanad Éireann,Live,2025-02-12 00:00:00+00:00,,Standing,2025-05-13 00:00:00+00:00,,Shadow Department,Live - Primary,2025-05-01 00:00:00+00:00,,Joint Committee on European Union Affairs,Live,2025-05-13 00:00:00+00:00,,Sessional,2025-05-13 00:00:00+00:00,,Oversight,Live - Primary,2025-01-29 00:00:00+00:00,,Joint Committee on Public Petitions and the Ombudsmen,Live,2025-02-12 00:00:00+00:00,,Standing,,,,,,,,,,,,,,,,,,,,,,,,,,,,2025-01-29,,Sinn Féin,Sinn_Féin,Labour-Panel,Labour Panel,2025-01-29,,Chris Andrews,Chris-Andrews.D.2007-06-14,Andrews,,,,,,,,,,,,,,,,,,,,,,,,,,,,,,,,,,,,,,,,,,,,,,,,,,,,,false,2007
Frances,house,27,27th Seanad,seanad,2025-11-20 00:00:00+00:00,,Consultative,Live - Primary,2025-10-23 00:00:00+00:00,,Seanad Public Consultation Committee,Live,2025-10-22 00:00:00+00:00,,Sessional,2025-05-13 00:00:00+00:00,,Shadow Department,Live - Primary,2025-05-01 00:00:00+00:00,,Joint Committee on the Implementation of the Good Friday Agreement ,Live,2025-05-12 00:00:00+00:00,,Sessional,,,,,,,,,,,,,,,,,,,,,,,,,,,,,,,,,,,,,,,,,,,,,,,,,,2025-01-29,,Independent,Independent,Industrial-and-Commercial-Panel,Industrial and Commercial Panel,2025-01-29,,Frances Black,Frances-Black.S.2016-04-25,Black,,,,,,,,,,,,,,,,,,,,,,,,,,,,,,,,,,,,,,,,,,,,,,,,,,,,,false,2016
Niall,house,27,27th Seanad,seanad,2025-05-13 00:00:00+00:00,,Shadow Department,Live - Primary,2025-05-01 00:00:00+00:00,,Joint Committee on the Implementation of the Good Friday Agreement ,Live,2025-05-12 00:00:00+00:00,,Sessional,2025-05-13 00:00:00+00:00,,Shadow Department,Live - Primary,2025-05-01 00:00:00+00:00,,Joint Committee on Fisheries and Maritime Affairs,Live,2025-05-07 00:00:00+00:00,,Sessional,,,,,,,,,,,,,,,,,,,,,,,,,,,,,,,,,,,,,,,,,,,,,,,,,,2025-01-29,,Fianna Fáil,Fianna_Fáil,Agricultural-Panel,Agricultural Panel,2025-01-29,,Niall Blaney,Niall-Blaney.D.2002-06-06,Blaney,,,,,,,,,,,,,,,,,,,,,,,,,,,,,,,,,,,,,,,,,,,,,,,,,,,,,false,2002
Victor,house,27,27th Seanad,seanad,2025-10-21 00:00:00+00:00,,Policy,Live - Primary,2025-07-09 00:00:00+00:00,,Seanad Select Committee on EU Scrutiny and Transparency,Live,2025-07-08 00:00:00+00:00,,Standing,2025-02-26 00:00:00+00:00,,Parliamentary Business and Committee Membership,Live - Primary,2025-01-29 00:00:00+00:00,,Committee of Selection (Seanad Éireann),Live,2025-02-12 00:00:00+00:00,,Standing,2025-05-13 00:00:00+00:00,2025-06-25 00:00:00+00:00,Shadow Department,Live - Primary,2025-05-01 00:00:00+00:00,,Joint Committee on Fisheries and Maritime Affairs,Live,2025-05-07 00:00:00+00:00,,Sessional,2025-05-13 00:00:00+00:00,,Shadow Department,Live - Primary,2025-05-01 00:00:00+00:00,,Joint Committee on Agriculture and Food,Live,2025-05-07 00:00:00+00:00,,Sessional,,,,,,,,,,,,,,,,,,,,,,,,,,,,2025-01-29,,Independent,Independent,Agricultural-Panel,Agricultural Panel,2025-01-29,,Victor Boyhan,Victor-Boyhan.S.2016-04-25,Boyhan,,,,,,,,,,,,,,,,,,,,,,,,,,,,,,,,,,,,,,,,,,,,,,,,,,,,,false,2016
Manus,house,27,27th Seanad,seanad,2025-05-13 00:00:00+00:00,,Shadow Department,Live - Primary,2025-05-01 00:00:00+00:00,,Joint Committee on Fisheries and Maritime Affairs,Live,2025-05-07 00:00:00+00:00,,Sessional,2025-05-13 00:00:00+00:00,,Shadow Department,Live - Primary,2025-05-01 00:00:00+00:00,,Joint Committee on Health,Live,2025-05-13 00:00:00+00:00,,Sessional,,,,,,,,,,,,,,,,,,,,,,,,,,,,,,,,,,,,,,,,,,,,,,,,,,2025-01-29,,Fine Gael,Fine_Gael,Nominated-by-the-Taoiseach,Nominated by the Taoiseach,2025-01-29,,Manus Boyle,Manus-Boyle.S.2025-01-29,Boyle,,,,,,,,,,,,,,,,,,,,,,,,,,,,,,,,,,,,,,,,,,,,,,,,,,,,,false,2025
Nikki,house,27,27th Seanad,seanad,2025-05-13 00:00:00+00:00,,Shadow Department,Live - Primary,2025-05-01 00:00:00+00:00,,Joint Committee on Children and Equality,Live,2025-05-13 00:00:00+00:00,,Sessional,2025-05-13 00:00:00+00:00,,Shadow Department,Live - Primary,2025-05-01 00:00:00+00:00,,Joint Committee on Disability Matters,Live,2025-05-13 00:00:00+00:00,,Sessional,,,,,,,,,,,,,,,,,,,,,,,,,,,,,,,,,,,,,,,,,,,,,,,,,,2025-01-29,,Fine Gael,Fine_Gael,Nominated-by-the-Taoiseach,Nominated by the Taoiseach,2025-01-29,,Nikki Bradley,Nikki-Bradley.S.2024-07-10,Bradley,,2025-05-01 00:00:00+00:00,,Joint Committee on Children and Equality,,,,,,,,,,,,,,,,,,,,,,,,,,,,,,,,,,,,,,,,,,,,,,,,,false,2024
Paraic,house,27,27th Seanad,seanad,2025-05-13 00:00:00+00:00,,Oversight,Live - Primary,2025-01-29 00:00:00+00:00,,Joint Committee on Public Petitions and the Ombudsmen,Live,2025-02-12 00:00:00+00:00,,Standing,2025-05-13 00:00:00+00:00,,Shadow Department,Live - Primary,2025-05-01 00:00:00+00:00,,Joint Committee on Agriculture and Food,Live,2025-05-07 00:00:00+00:00,,Sessional,,,,,,,,,,,,,,,,,,,,,,,,,,,,,,,,,,,,,,,,,,,,,,,,,,2025-01-29,,Fine Gael,Fine_Gael,Agricultural-Panel,Agricultural Panel,2025-01-29,,Paraic Brady,Paraic-Brady.S.2025-01-29,Brady,,,,,,,,,,,,,,,,,,,,,,,,,,,,,,,,,,,,,,,,,,,,,,,,,,,,,false,2025
Cathal,house,27,27th Seanad,seanad,2025-11-20 00:00:00+00:00,,Consultative,Live - Primary,2025-10-23 00:00:00+00:00,,Seanad Public Consultation Committee,Live,2025-10-22 00:00:00+00:00,,Sessional,2025-05-13 00:00:00+00:00,,Shadow Department,Live - Primary,2025-05-01 00:00:00+00:00,,"Joint Committee on Finance, Public Expenditure, Public Service Reform and Digitalisation, and Taoiseach",Live,2025-05-07 00:00:00+00:00,,Sessional,2025-05-13 00:00:00+00:00,,Shadow Department,Live - Primary,2025-05-01 00:00:00+00:00,,Joint Committee on Infrastructure and National Development Plan Delivery,Live,2025-05-07 00:00:00+00:00,,Sessional,,,,,,,,,,,,,,,,,,,,,,,,,,,,,,,,,,,,,,,2025-01-29,,Fine Gael,Fine_Gael,Cultural-and-Educational-Panel,Cultural and Educational Panel,2025-01-29,,Cathal Byrne,Cathal-Byrne.S.2025-01-29,Byrne,,,,,,,,,,,,,,,,,,,,,,,,,,,,,,,,,,,,,,,,,,,,,,,,,,,,,false,2025
Maria,house,27,27th Seanad,seanad,2025-02-26 00:00:00+00:00,,Parliamentary Regulation and Reform,Live - Primary,2025-01-29 00:00:00+00:00,,Committee on Parliamentary Privileges and Oversight (Seanad Éireann),Live,2025-02-12 00:00:00+00:00,,Standing,2025-02-26 00:00:00+00:00,,Parliamentary Business and Committee Membership,Live - Primary,2025-01-29 00:00:00+00:00,,Committee of Selection (Seanad Éireann),Live,2025-02-12 00:00:00+00:00,,Standing,2025-10-22 00:00:00+00:00,,Consultative,Live - Primary,2025-10-23 00:00:00+00:00,,Seanad Public Consultation Committee,Live,2025-10-22 00:00:00+00:00,,Sessional,2025-05-13 00:00:00+00:00,,Shadow Department,Live - Primary,2025-05-01 00:00:00+00:00,,Joint Committee on Disability Matters,Live,2025-05-13 00:00:00+00:00,,Sessional,2025-05-12 00:00:00+00:00,,The Committee System and Parliamentary Administration,Live - Primary,2025-01-29 00:00:00+00:00,,Working Group of Committee Cathaoirligh,Live,2025-02-12 00:00:00+00:00,,Standing,2025-05-13 00:00:00+00:00,,Policy,dail,34.0,Live - Primary,2025-05-01 00:00:00+00:00,,Joint Committee on Key Issues Affecting the Traveller Community,Live,2025-05-12 00:00:00+00:00,,Sessional,,,,2025-01-29,,Fine Gael,Fine_Gael,Agricultural-Panel,Agricultural Panel,2025-01-29,,Maria Byrne,Maria-Byrne.S.2016-04-25,Byrne,,,,,Leas-Chathaoirleach,2025-02-26 00:00:00+00:00,,Cathaoirleach,2025-02-26 00:00:00+00:00,,Cathaoirleach,2025-10-22 00:00:00+00:00,,2025-05-13 00:00:00+00:00,,Shadow Department,dail,34.0,Live - Primary,2025-05-01 00:00:00+00:00,,Joint Committee on Health,Live,2025-05-13 00:00:00+00:00,,Sessional,,,,,,,,,,,,,,,,,,,,,,,,,,,false,2016
Pat,house,27,27th Seanad,seanad,2025-04-02 00:00:00+00:00,2025-05-13 00:00:00+00:00,Shadow Department,Dissolved,2025-03-28 00:00:00+00:00,,Seanad Select Committee on Subsidiarity (European Union Legislative Scrutiny),Dissolved,2025-03-27 00:00:00+00:00,2025-05-13 00:00:00+00:00,Standing transitional,2025-10-21 00:00:00+00:00,,Policy,Live - Primary,2025-07-09 00:00:00+00:00,,Seanad Select Committee on EU Scrutiny and Transparency,Live,2025-07-08 00:00:00+00:00,,Standing,2025-11-20 00:00:00+00:00,,Consultative,Live - Primary,2025-10-23 00:00:00+00:00,,Seanad Public Consultation Committee,Live,2025-10-22 00:00:00+00:00,,Sessional,2025-02-26 00:00:00+00:00,,Parliamentary Regulation and Reform,Live - Primary,2025-01-29 00:00:00+00:00,,Committee on Parliamentary Privileges and Oversight (Seanad Éireann),Live,2025-02-12 00:00:00+00:00,,Standing,2025-02-26 00:00:00+00:00,,Parliamentary Business and Committee Membership,Live - Primary,2025-01-29 00:00:00+00:00,,Committee of Selection (Seanad Éireann),Live,2025-02-12 00:00:00+00:00,,Standing,2025-04-03 00:00:00+00:00,2025-05-11 00:00:00+00:00,The Committee System and Parliamentary Administration,dail,34.0,Live - Primary,2025-01-29 00:00:00+00:00,,Working Group of Committee Cathaoirligh,Live,2025-02-12 00:00:00+00:00,,Standing,,,,2025-01-29,,Fianna Fáil,Fianna_Fáil,Labour-Panel,Labour Panel,2025-01-29,,Pat Casey,Pat-Casey.D.2016-10-03,Casey,,,,,Cathaoirleach,2025-04-03 00:00:00+00:00,2025-05-13 00:00:00+00:00,,,,,,,2025-05-13 00:00:00+00:00,,Shadow Department,dail,34.0,Live - Primary,2025-05-01 00:00:00+00:00,,"Joint Committee on Finance, Public Expenditure, Public Service Reform and Digitalisation, and Taoiseach",Live,2025-05-07 00:00:00+00:00,,Sessional,2025-05-13 00:00:00+00:00,,Shadow Department,dail,34.0,Live - Primary,2025-05-01 00:00:00+00:00,,"Joint Committee on Housing, Local Government and Heritage",Live,2025-05-07 00:00:00+00:00,,Sessional,,,,,,,,,,,,,,false,2016
Lorraine,house,27,27th Seanad,seanad,2025-04-02 00:00:00+00:00,2025-05-13 00:00:00+00:00,Shadow Department,Dissolved,2025-03-28 00:00:00+00:00,,Seanad Select Committee on Subsidiarity (European Union Legislative Scrutiny),Dissolved,2025-03-27 00:00:00+00:00,2025-05-13 00:00:00+00:00,Standing transitional,2025-05-13 00:00:00+00:00,,Statutory,Live - Primary,2025-01-29 00:00:00+00:00,,Committee on Members' Interests of Seanad Éireann,Live,2025-02-12 00:00:00+00:00,,Standing,2025-07-10 00:00:00+00:00,,The Committee System and Parliamentary Administration,Live - Primary,2025-01-29 00:00:00+00:00,,Working Group of Committee Cathaoirligh,Live,2025-02-12 00:00:00+00:00,,Standing,2025-05-13 00:00:00+00:00,,Shadow Department,Live - Primary,2025-05-01 00:00:00+00:00,,"Joint Committee on Climate, Environment and Energy",Live,2025-05-13 00:00:00+00:00,,Sessional,2025-05-13 00:00:00+00:00,,Shadow Department,Live - Primary,2025-05-01 00:00:00+00:00,,Joint Committee on Transport,Live,2025-05-13 00:00:00+00:00,,Sessional,,,,,,,,,,,,,,,,,2025-01-29,,Fianna Fáil,Fianna_Fáil,Nominated-by-the-Taoiseach,Nominated by the Taoiseach,2025-01-29,,Lorraine Clifford-Lee,Lorraine-Clifford-Lee.S.2016-04-25,Clifford-Lee,,,,,,,,Cathaoirleach,2025-07-10 00:00:00+00:00,,,,,,,,,,,,,,,,,,,,,,,,,,,,,,,Leas-Chathaoirleach,2025-05-28 00:00:00+00:00,,,,,,,,,,,,false,2016
Tom,house,27,27th Seanad,seanad,2025-05-13 00:00:00+00:00,,Shadow Department,Live - Primary,2025-05-01 00:00:00+00:00,,Joint Committee on Defence and National Security,Live,2025-05-13 00:00:00+00:00,,Sessional,2025-05-13 00:00:00+00:00,,Shadow Department,Live - Primary,2025-05-01 00:00:00+00:00,,Joint Committee on Disability Matters,Live,2025-05-13 00:00:00+00:00,,Sessional,2025-05-13 00:00:00+00:00,,Shadow Department,Live - Primary,2025-05-01 00:00:00+00:00,,Joint Committee on Health,Live,2025-05-13 00:00:00+00:00,,Sessional,,,,,,,,,,,,,,,,,,,,,,,,,,,,,,,,,,,,,,,2025-01-29,,Independent,Independent,University-of-Dublin,University of Dublin,2025-01-29,,Tom Clonan,Tom-Clonan.S.2022-04-04,Clonan,,,,,,,,,,,,,,,,,,,,,,,,,,,,,,,,,,,,,,,,,,,,,,,,,,,,,false,2022
Joanne,house,27,27th Seanad,seanad,2025-05-13 00:00:00+00:00,,Shadow Department,Live - Primary,2025-05-01 00:00:00+00:00,,Joint Committee on Agriculture and Food,Live,2025-05-07 00:00:00+00:00,,Sessional,2025-05-13 00:00:00+00:00,,Shadow Department,Live - Primary,2025-05-01 00:00:00+00:00,,Joint Committee on Transport,Live,2025-05-13 00:00:00+00:00,,Sessional,,,,,,,,,,,,,,,,,,,,,,,,,,,,,,,,,,,,,,,,,,,,,,,,,,2025-01-29,,Sinn Féin,Sinn_Féin,Agricultural-Panel,Agricultural Panel,2025-01-29,,Joanne Collins,Joanne-Collins.S.2025-01-29,Collins,,,,,,,,,,,,,,,,,,,,,,,,,,,,,,,,,,,,,,,,,,,,,,,,,,,,,false,2025
Alison,house,27,27th Seanad,seanad,2025-05-13 00:00:00+00:00,,Shadow Department,Live - Primary,2025-05-01 00:00:00+00:00,,"Joint Committee on Arts, Media, Communications, Culture and Sport",Live,2025-05-07 00:00:00+00:00,,Sessional,2025-05-13 00:00:00+00:00,,Shadow Department,Live - Primary,2025-05-01 00:00:00+00:00,,Joint Committee on the Implementation of the Good Friday Agreement ,Live,2025-05-12 00:00:00+00:00,,Sessional,,,,,,,,,,,,,,,,,,,,,,,,,,,,,,,,,,,,,,,,,,,,,,,,,,2025-01-29,,Fianna Fáil,Fianna_Fáil,Nominated-by-the-Taoiseach,Nominated by the Taoiseach,2025-01-29,,Alison Comyn,Alison-Comyn.S.2025-01-29,Comyn,,,,,,,,,,,,,,,,,,,,,,,,,,,,,,,,,,,,,,,,,,,,,,,,,,,,,false,2025
Joe,house,27,27th Seanad,seanad,2025-05-13 00:00:00+00:00,,Policy,Live - Primary,2025-01-29 00:00:00+00:00,,"Comhchoiste na Gaeilge, na Gaeltachta agus Phobal Labhartha na Gaeilge",Live,2025-02-12 00:00:00+00:00,,Standing,2025-05-13 00:00:00+00:00,,Shadow Department,Live - Primary,2025-05-01 00:00:00+00:00,,Joint Committee on Education and Youth,Live,2025-05-13 00:00:00+00:00,,Sessional,,,,,,,,,,,,,,,,,,,,,,,,,,,,,,,,,,,,,,,,,,,,,,,,,,2025-01-29,,Independent,Independent,Cultural-and-Educational-Panel,Cultural and Educational Panel,2025-01-29,,Joe Conway,Joe-Conway.S.2025-01-29,Conway,,,,,,,,,,,,,,,,,,,,,,,,,,,,,,,,,,,,,,,,,,,,,,,,,,,,,false,2025
Martin,house,27,27th Seanad,seanad,,,,,,,,,,,,,,,,,,,,,,,,,,,,,,,,,,,,,,,,,,,,,,,,,,,,,,,,,,,,,,,,,,,,,,,,2025-01-29,2025-02-09,Fine Gael,Fine_Gael,Administrative-Panel,Administrative Panel,2025-01-29,,Martin Conway,Martin-Conway.S.2011-05-25,Conway,,,,,,,,,,,,,,,,,,,,,,,,,,,,,,,,,,,,,,,,,,,2025-02-09,,Independent,Independent,,,,,,,false,2011
Nessa,house,27,27th Seanad,seanad,2025-05-13 00:00:00+00:00,,Shadow Department,Live - Primary,2025-05-01 00:00:00+00:00,,Joint Committee on Children and Equality,Live,2025-05-13 00:00:00+00:00,,Sessional,2025-05-13 00:00:00+00:00,,Shadow Department,Live - Primary,2025-05-01 00:00:00+00:00,,Joint Committee on Transport,Live,2025-05-13 00:00:00+00:00,,Sessional,,,,,,,,,,,,,,,,,,,,,,,,,,,,,,,,,,,,,,,,,,,,,,,,,,2025-01-29,,Labour Party,Labour_Party,Labour-Panel,Labour Panel,2025-01-29,,Nessa Cosgrove,Nessa-Cosgrove.S.2025-01-29,Cosgrove,,2025-05-01 00:00:00+00:00,,Joint Committee on Children and Equality,,,,,,,,,,,,,,,,,,,,,,,,,,,,,,,,,,,,,,,,,,,,,,,,,false,2025
Teresa,house,27,27th Seanad,seanad,2025-05-13 00:00:00+00:00,,Shadow Department,Live - Primary,2025-05-01 00:00:00+00:00,,Joint Committee on Health,Live,2025-05-13 00:00:00+00:00,,Sessional,2025-05-13 00:00:00+00:00,,Policy,Live - Primary,2025-05-01 00:00:00+00:00,,Joint Committee on Drugs Use,Live,2025-05-13 00:00:00+00:00,,Special,,,,,,,,,,,,,,,,,,,,,,,,,,,,,,,,,,,,,,,,,,,,,,,,,,2025-01-29,,Fianna Fáil,Fianna_Fáil,Agricultural-Panel,Agricultural Panel,2025-01-29,,Teresa Costello,Teresa-Costello.S.2025-01-29,Costello,,,,,,,,,,,,,,,,,,,,,,,,,,,,,,,,,,,,,,,,,,,,,,,,,,,,,false,2025
Gerard P.,house,27,27th Seanad,seanad,2025-11-20 00:00:00+00:00,,Consultative,Live - Primary,2025-10-23 00:00:00+00:00,,Seanad Public Consultation Committee,Live,2025-10-22 00:00:00+00:00,,Sessional,2025-04-02 00:00:00+00:00,2025-05-13 00:00:00+00:00,Shadow Department,Dissolved,2025-03-28 00:00:00+00:00,,Seanad Select Committee on Subsidiarity (European Union Legislative Scrutiny),Dissolved,2025-03-27 00:00:00+00:00,2025-05-13 00:00:00+00:00,Standing transitional,2025-05-13 00:00:00+00:00,,Shadow Department,Live - Primary,2025-05-01 00:00:00+00:00,,Joint Committee on Fisheries and Maritime Affairs,Live,2025-05-07 00:00:00+00:00,,Sessional,2025-05-13 00:00:00+00:00,,Shadow Department,Live - Primary,2025-05-01 00:00:00+00:00,,Joint Committee on Defence and National Security,Live,2025-05-13 00:00:00+00:00,,Sessional,,,,,,,,,,,,,,,,,,,,,,,,,,,,2025-01-29,,Independent,Independent,Labour-Panel,Labour Panel,2025-01-29,,Gerard P. Craughwell,Gerard-P-Craughwell.S.2014-10-10,Craughwell,,,,,,,,,,,,,,,,,,,,,,,,,,,,,,,,,,,,,,,,,,,,,,,,,,,,,false,2014
Ollie,house,27,27th Seanad,seanad,2025-05-13 00:00:00+00:00,,Shadow Department,Live - Primary,2025-05-01 00:00:00+00:00,,"Joint Committee on Enterprise, Tourism and Employment",Live,2025-05-13 00:00:00+00:00,,Sessional,2025-05-13 00:00:00+00:00,,Shadow Department,Live - Primary,2025-05-01 00:00:00+00:00,,Joint Committee on Infrastructure and National Development Plan Delivery,Live,2025-05-07 00:00:00+00:00,,Sessional,,,,,,,,,,,,,,,,,,,,,,,,,,,,,,,,,,,,,,,,,,,,,,,,,,2025-01-29,,Fianna Fáil,Fianna_Fáil,Industrial-and-Commercial-Panel,Industrial and Commercial Panel,2025-01-29,,Ollie Crowe,Ollie-Crowe.S.2020-03-30,Crowe,,,,,,,,,,,,,,,,,,,,,,,,,,,,,,,,,,,,,,,,,,,,,,,,,,,,,false,2020
Shane,house,27,27th Seanad,seanad,2025-05-13 00:00:00+00:00,,Shadow Department,Live - Primary,2025-05-01 00:00:00+00:00,,Joint Committee on Education and Youth,Live,2025-05-13 00:00:00+00:00,,Sessional,2025-05-13 00:00:00+00:00,,Policy,Live - Primary,2025-01-29 00:00:00+00:00,,"Comhchoiste na Gaeilge, na Gaeltachta agus Phobal Labhartha na Gaeilge",Live,2025-02-12 00:00:00+00:00,,Standing,,,,,,,,,,,,,,,,,,,,,,,,,,,,,,,,,,,,,,,,,,,,,,,,,,2025-01-29,,Fianna Fáil,Fianna_Fáil,Cultural-and-Educational-Panel,Cultural and Educational Panel,2025-01-29,,Shane Curley,Shane-Curley.S.2025-01-29,Curley,,,,,,,,,,,,,,,,,,,,,,,,,,,,,,,,,,,,,,,,,,,,,,,,,,,,,false,2025
Mark,house,27,27th Seanad,seanad,2025-10-15 00:00:00+00:00,,Policy,Live - Primary,2025-07-09 00:00:00+00:00,,Seanad Select Committee on EU Scrutiny and Transparency,Live,2025-07-08 00:00:00+00:00,,Standing,2025-02-26 00:00:00+00:00,,Parliamentary Regulation and Reform,Live - Primary,2025-01-29 00:00:00+00:00,,Committee on Parliamentary Privileges and Oversight (Seanad Éireann),Live,2025-02-12 00:00:00+00:00,,Standing,2025-11-12 00:00:00+00:00,,The Committee System and Parliamentary Administration,Live - Primary,2025-01-29 00:00:00+00:00,,Working Group of Committee Cathaoirligh,Live,2025-02-12 00:00:00+00:00,,Standing,,,,,,,,,,,,,,,,,,,,,,,,,,,,,,,,,,,,,,,2025-01-29,,Fianna Fáil,Fianna_Fáil,Administrative-Panel,Administrative Panel,2025-01-29,,Mark Daly,Mark-Daly.S.2007-07-23,Daly,,,,,Cathaoirleach,2025-10-15 00:00:00+00:00,,Cathaoirleach,2025-02-26 00:00:00+00:00,,,,,,,,,,,,,,,,,,,,,,,,,,,,,,,,,,,,,,Cathaoirleach,2025-02-12,,,,,false,2007
Paul,house,27,27th Seanad,seanad,2025-04-02 00:00:00+00:00,2025-05-13 00:00:00+00:00,Shadow Department,Dissolved,2025-03-28 00:00:00+00:00,,Seanad Select Committee on Subsidiarity (European Union Legislative Scrutiny),Dissolved,2025-03-27 00:00:00+00:00,2025-05-13 00:00:00+00:00,Standing transitional,2025-05-13 00:00:00+00:00,,Statutory,Live - Primary,2025-01-29 00:00:00+00:00,,Committee on Members' Interests of Seanad Éireann,Live,2025-02-12 00:00:00+00:00,,Standing,2025-02-26 00:00:00+00:00,,Parliamentary Regulation and Reform,Live - Primary,2025-01-29 00:00:00+00:00,,Committee on Parliamentary Privileges and Oversight (Seanad Éireann),Live,2025-02-12 00:00:00+00:00,,Standing,2025-02-26 00:00:00+00:00,,Parliamentary Business and Committee Membership,Live - Primary,2025-01-29 00:00:00+00:00,,Committee of Selection (Seanad Éireann),Live,2025-02-12 00:00:00+00:00,,Standing,2025-05-13 00:00:00+00:00,,Shadow Department,Live - Primary,2025-05-01 00:00:00+00:00,,Joint Committee on Agriculture and Food,Live,2025-05-07 00:00:00+00:00,,Sessional,2025-05-13 00:00:00+00:00,,Shadow Department,dail,34.0,Live - Primary,2025-05-01 00:00:00+00:00,,"Joint Committee on Further and Higher Education, Research, Innovation and Science",Live,2025-05-13 00:00:00+00:00,,Sessional,,,,2025-01-29,,Fianna Fáil,Fianna_Fáil,Agricultural-Panel,Agricultural Panel,2025-01-29,,Paul Daly,Paul-Daly.S.2016-04-25,Daly,,,,,,,,,,,,,,,,,,,,,,,,,,,,,,,,,,,,,,,,,,,,,,,,,,,,,false,2016
Aidan,house,27,27th Seanad,seanad,2025-05-13 00:00:00+00:00,,Shadow Department,Live - Primary,2025-05-01 00:00:00+00:00,,Joint Committee on Infrastructure and National Development Plan Delivery,Live,2025-05-07 00:00:00+00:00,,Sessional,2025-05-13 00:00:00+00:00,,Shadow Department,Live - Primary,2025-05-01 00:00:00+00:00,,Joint Committee on European Union Affairs,Live,2025-05-13 00:00:00+00:00,,Sessional,,,,,,,,,,,,,,,,,,,,,,,,,,,,,,,,,,,,,,,,,,,,,,,,,,2025-01-29,,Fianna Fáil,Fianna_Fáil,Industrial-and-Commercial-Panel,Industrial and Commercial Panel,2025-01-29,,Aidan Davitt,Aidan-Davitt.S.2016-04-25,Davitt,,,,,,,,Leas-Chathaoirleach,2025-05-28 00:00:00+00:00,,,,,,,,,,,,,,,,,,,,,,,,,,,,,,,,,,,,,,,,,,,,false,2016
