Anne,house,27,27th Seanad,seanad,2025-10-21 00:00:00+00:00,,Policy,Live - Primary,2025-07-09 00:00:00+00:00,,Seanad Select Committee on EU Scrutiny and Transparency,Live,2025-07-08 00:00:00+00:00,,Standing,2025-05-13 00:00:00+00:00,,Shadow Department,Live - Primary,2025-05-01 00:00:00+00:00,,"Joint Committee on Justice, Home Affairs and Migration",Live,2025-05-13 00:00:00+00:00,,Sessional,2025-05-13 00:00:00+00:00,,Shadow Department,Live - Primary,2025-05-01 00:00:00+00:00,,"Joint Committee on Social Protection, Rural and Community Development",Live,2025-05-13 00:00:00+00:00,,Sessional,2025-05-13 00:00:00+00:00,,Policy,Live - Primary,2025-05-01 00:00:00+00:00,,Joint Committee on Key Issues Affecting the Traveller Community,Live,2025-05-12 00:00:00+00:00,,Sessional,,,,,,,,,,,,,,,,,,,,,,,,,,,,2025-01-29,,Fianna Fáil,Fianna_Fáil,Nominated-by-the-Taoiseach,Nominated by the Taoiseach,2025-01-29,,Anne Rabbitte,Anne-Rabbitte.D.2016-10-03,Rabbitte,,,,,,,,,,,Leas-Chathaoirleach,2025-06-11 00:00:00+00:00,,,,,,,,,,,,,,,,,,,,,,,,,,,,,,,,,,,,,,,,,false,2016
Lynn,house,27,27th Seanad,seanad,2025-05-13 00:00:00+00:00,,Statutory,Live - Primary,2025-01-29 00:00:00+00:00,,Committee on Members' Interests of Seanad Éireann,Live,2025-02-12 00:00:00+00:00,,Standing,2025-02-26 00:00:00+00:00,,Parliamentary Business and Committee Membership,Live - Primary,2025-01-29 00:00:00+00:00,,Committee of Selection (Seanad Éireann),Live,2025-02-12 00:00:00+00:00,,Standing,2025-05-13 00:00:00+00:00,,Shadow Department,Live - Primary,2025-05-01 00:00:00+00:00,,"Joint Committee on Justice, Home Affairs and Migration",Live,2025-05-13 00:00:00+00:00,,Sessional,2025-05-13 00:00:00+00:00,,Policy,Live - Primary,2025-05-01 00:00:00+00:00,,Joint Committee on Drugs Use,Live,2025-05-13 00:00:00+00:00,,Special,2025-05-13 00:00:00+00:00,,Policy,Live - Primary,2025-05-01 00:00:00+00:00,,Joint Committee on Artificial Intelligence,Live,2025-05-12 00:00:00+00:00,,Special,,,,,,,,,,,,,,,,,2025-01-29,,Independent,Independent,University-of-Dublin,University of Dublin,2025-01-29,,Lynn Ruane,Lynn-Ruane.S.2016-04-25,Ruane,,,,,,,,,,,,,,,,,,,,,,,,,,,,,,,,,,,,,,,,,,,,,,,,,,,,,false,2016
Dee,house,27,27th Seanad,seanad,2025-05-13 00:00:00+00:00,,Shadow Department,Live - Primary,2025-05-01 00:00:00+00:00,,"Joint Committee on Further and Higher Education, Research, Innovation and Science",Live,2025-05-13 00:00:00+00:00,,Sessional,2025-05-13 00:00:00+00:00,,Policy,Live - Primary,2025-05-01 00:00:00+00:00,,Joint Committee on Artificial Intelligence,Live,2025-05-12 00:00:00+00:00,,Special,,,,,,,,,,,,,,,,,,,,,,,,,,,,,,,,,,,,,,,,,,,,,,,,,,2025-01-29,,Fianna Fáil,Fianna_Fáil,Nominated-by-the-Taoiseach,Nominated by the Taoiseach,2025-01-29,,Dee Ryan,Dee-Ryan.S.2025-01-29,Ryan,,,,,,,,,,,,,,,,,,,,,,,,,,,,,,,,,,,,,,,,,,,,,,,,,,,,,false,2025
Nicole,house,27,27th Seanad,seanad,2025-05-13 00:00:00+00:00,,Policy,Live - Primary,2025-01-29 00:00:00+00:00,,"Comhchoiste na Gaeilge, na Gaeltachta agus Phobal Labhartha na Gaeilge",Live,2025-02-12 00:00:00+00:00,,Standing,2025-05-13 00:00:00+00:00,,Shadow Department,Live - Primary,2025-05-01 00:00:00+00:00,,Joint Committee on Health,Live,2025-05-13 00:00:00+00:00,,Sessional,2025-05-13 00:00:00+00:00,,Policy,Live - Primary,2025-05-01 00:00:00+00:00,,Joint Committee on Drugs Use,Live,2025-05-13 00:00:00+00:00,,Special,,,,,,,,,,,,,,,,,,,,,,,,,,,,,,,,,,,,,,,2025-01-29,,Sinn Féin,Sinn_Féin,Administrative-Panel,Administrative Panel,2025-01-29,,Nicole Ryan,Nicole-Ryan.S.2025-01-29,Ryan,,,,,,,,,,,,,,,,,,,,,,,,,,,,,,,,,,,,,,,,,,,,,,,,,,,,,false,2025
Gareth,house,27,27th Seanad,seanad,2025-05-13 00:00:00+00:00,,Shadow Department,Live - Primary,2025-05-01 00:00:00+00:00,,Joint Committee on Education and Youth,Live,2025-05-13 00:00:00+00:00,,Sessional,2025-05-13 00:00:00+00:00,,Policy,Live - Primary,2025-05-01 00:00:00+00:00,,Joint Committee on Artificial Intelligence,Live,2025-05-12 00:00:00+00:00,,Special,,,,,,,,,,,,,,,,,,,,,,,,,,,,,,,,,,,,,,,,,,,,,,,,,,2025-01-29,,Fine Gael,Fine_Gael,Nominated-by-the-Taoiseach,Nominated by the Taoiseach,2025-01-29,,Gareth Scahill,Gareth-Scahill.S.2025-01-29,Scahill,,,,,Leas-Chathaoirleach,2025-05-28 00:00:00+00:00,,,,,,,,,,,,,,,,,,,,,,,,,,,,,,,,,,,,,,,,,,,,,,,false,2025
Patricia,house,27,27th Seanad,seanad,2025-02-26 00:00:00+00:00,,Parliamentary Business and Committee Membership,Live - Primary,2025-01-29 00:00:00+00:00,,Committee of Selection (Seanad Éireann),Live,2025-02-12 00:00:00+00:00,,Standing,2025-05-13 00:00:00+00:00,,Shadow Department,Live - Primary,2025-05-01 00:00:00+00:00,,Joint Committee on the Implementation of the Good Friday Agreement ,Live,2025-05-12 00:00:00+00:00,,Sessional,2025-05-13 00:00:00+00:00,,Shadow Department,Live - Primary,2025-05-01 00:00:00+00:00,,Joint Committee on Infrastructure and National Development Plan Delivery,Live,2025-05-07 00:00:00+00:00,,Sessional,2025-05-13 00:00:00+00:00,,Shadow Department,Live - Primary,2025-05-01 00:00:00+00:00,,Joint Committee on Foreign Affairs and Trade,Live,2025-05-07 00:00:00+00:00,,Sessional,,,,,,,,,,,,,,,,,,,,,,,,,,,,2025-01-29,,Social Democrats,Social_Democrats,Labour-Panel,Labour Panel,2025-01-29,,Patricia Stephenson,Patricia-Stephenson.S.2025-01-29,Stephenson,,,,,,,,,,,,,,,,,,,,,,,,,,,,,,,,,,,,,,,,,,,,,,,,,,,,,false,2025
Pauline,house,27,27th Seanad,seanad,2025-05-13 00:00:00+00:00,,Shadow Department,Live - Primary,2025-05-01 00:00:00+00:00,,Joint Committee on Education and Youth,Live,2025-05-13 00:00:00+00:00,,Sessional,2025-05-13 00:00:00+00:00,,Shadow Department,Live - Primary,2025-05-01 00:00:00+00:00,,"Joint Committee on Further and Higher Education, Research, Innovation and Science",Live,2025-05-13 00:00:00+00:00,,Sessional,,,,,,,,,,,,,,,,,,,,,,,,,,,,,,,,,,,,,,,,,,,,,,,,,,2025-01-29,,Sinn Féin,Sinn_Féin,Cultural-and-Educational-Panel,Cultural and Educational Panel,2025-01-29,,Pauline Tully,Pauline-Tully.D.2020-02-08,Tully,,,,,,,,,,,,,,,,,,,,,,,,,,,,,,,,,,,,,,,,,,,,,,,,,,,,,false,2020
Diarmuid,house,27,27th Seanad,seanad,2025-05-13 00:00:00+00:00,,Shadow Department,Live - Primary,2025-05-01 00:00:00+00:00,,Joint Committee on Defence and National Security,Live,2025-05-13 00:00:00+00:00,,Sessional,2025-05-13 00:00:00+00:00,,Shadow Department,Live - Primary,2025-05-01 00:00:00+00:00,,Joint Committee on Fisheries and Maritime Affairs,Live,2025-05-07 00:00:00+00:00,,Sessional,,,,,,,,,,,,,,,,,,,,,,,,,,,,,,,,,,,,,,,,,,,,,,,,,,2025-01-29,,Fianna Fáil,Fianna_Fáil,Administrative-Panel,Administrative Panel,2025-01-29,,Diarmuid Wilson,Diarmuid-Wilson.S.2002-09-12,Wilson,,,,,Leas-Chathaoirleach,2025-05-22 00:00:00+00:00,,,,,,,,,,,,,,,,,,,,,,,,,,,,,,,,,,,,,,,,,,,,,,,false,2002
