Monaghan County Council,monaghan_county_council,,,,90.0,,"National Route: 90m (setback from the near edge of the surfaced carriageway, rural area, §15.27)",30.0,,"Regional Route: 30m (setback from the near edge of the surfaced carriageway, rural area, §15.27)",18.0,,"County Road: 18m (setback from the near edge of the surfaced carriageway, rural area, §15.27)",,,,3.0,Y,3.0 m (national/regional upgraded); 2.4 m (regional not upgraded/local),,,All residential developments with proposed communal parking and all non-residential proposed development shall normally provide EV car parking spaces at a rate of one space in five. (15.24),20.0,,Under the provisions of Part V of the Act 20% of all private residential developments on land zoned for residential or mixed uses (where residential development is included) shall be provided for soci,,,"Public open space shall be provided in accordance with the standards set out in the Sustainable Residential Development and Compact Settlements, Guidelines for Planning Authorities (2024), specificall",,,,,,Per Sustainable Residential Development and Compact Settlements Guidelines 2024 (no fixed table); max 15 units/ha on 'Proposed Residential B' lands,70.0,,Independent living accommodation for a family member: The accommodation shall not exceed a gross floor area of 70sqm and shall be subordinate in size and scale to that of the main dwelling. It shall b,,,"The Sustainable Rural Housing Guidelines define ribbon development as five or more houses on any one side of a given 250 metres of road frontage. The ribbon may not have a uniform building line, and b"
Offaly County Council,offaly_county_council,2000,Y,0.2 hectares (0.5 acres) (DMS-45); 0.202 hectares (0.5 acres) rural infill (DMS-54),,,,,,,,,,22.0,Y,22 m between directly opposing rear first floor windows (DMS-13); 2.5 m single storey / 3 m two-storey between side walls (DMS-14),2.4,,2.4 m from road edge (DMS-97),10.0,,"A minimum of 10% of the proposed car parking spaces required for the category of development listed in car parking standards contained in DMO-102 shall be provided with electrical connection points, t",,,Details to be submitted with planning applications shall include; How the applicant intends to discharge their Part V obligation as regards a selection of a preferred option from the options available,15.0,Y,"In greenfield sites, the minimum area of public open space that shall be provided is 15% of the total site area; In brownfield sites or large infill sites, the minimum area of public open space that s",,,,,,Determined with reference to Sustainable Residential Development Guidelines 2009 and prevailing scale/pattern (no fixed uph table),,,Planning applications for the provision of accommodation for a dependant family member or relative comply with the following criteria; Granny flat/unit shall be attached to the existing dwelling. The ,,,Limited infill development shall be permitted in the open countryside where the proposed site shall coalesce the existing linear pattern of development and shall not be located at the end of a line of
Roscommon County Council,roscommon_county_council,,,,,,,,,,,,,,,,3.0,Y,3 m (national/regional); 2.4 m (local),20.0,,All developments should provide facilities for the charging of battery operated cars at a rate of at least 20% of the total car parking spaces. The remainder of the parking spaces should be constructe,,,,15.0,Y,Communal (public or shared) open space should be appropriately integrated into the overall residential layout and should comprise of 15% of gross site area for green field sites and 10% for brown fiel,75.0,Y,Should not exceed 75% for industrial or retail; 80% may be permissible in town centre locations,,,Determined with reference to Sustainable Residential Development in Urban Areas Guidelines; authority discretion in varying maximum density standards (no fixed uph table),,,A Granny Flat refers to ancillary accommodation for family members (granny flats). Proposals for Granny Flats may be facilitated in either in the form of an extension to a dwelling house or in a detac,,,"The Plan supports the use of rural clusters, or groups of buildings, in appropriate locations, as an alternative to ribbon development in the rural landscape. The grouping of new housing in rural clus"
Sligo County Council,sligo_county_council,,,,,,,,,,,,,16.0,Y,16 m between opposing habitable-room windows above ground floor; 2.3 m between side walls,,,,,,"Table 33.11 EV charging point standards: Residential multi-unit developments (new buildings and major renovations with private car spaces, including visitor spaces) — A minimum of one EV charge point ",,,,10.0,Y,"A minimum of 10% and a maximum of 15% of the net site area shall be reserved for the provision of communal open space, landscaped to a high standard. The minimum requirement should be justified taking",,,,,,,70.0,,The Planning Authority will consider the provision of an independent living unit for a family member subject to the following requirements: there is a demonstrated need to provide an independent unit ,,,Ribbon development means frontage development along a road where there is no other development in the backlands. It is defined as five or more houses located within a 250m stretch of road (one side or
South Dublin County Council,south_dublin_county_council,,,,,,,,,,,,,22.0,,circa 22 m between opposing windows (incl. apartments up to three storeys),,,,20.0,,"EV charging shall be provided in all residential, mixed use and commercial development and shall comprise a minimum of 20% of the total parking spaces provided, with higher provision within this range",,,,15.0,Y,"Table 12.22 Minimum Public Open Space Standards: Overall Standard 2.4 Ha per 1,000 Population; New Residential Development on Lands Zone RES-N Minimum 15% of site area; New Residential Development on ",,,,,,No numerical density limit; contextual/performance framework (Appendix 10),,,A family flat is to provide semi-independent accommodation for an immediate family member (dependent of the main occupants of an existing dwelling). A family flat is not considered to represent an ind,,,A minimum road frontage of 60 metres should be provided for all new dwelling sites in rural areas and a proliferation of housing along stretches of road in a manner that creates ribbon development sho
Tipperary County Council,tipperary_county_council,,,,,,,,,,,,,22.0,,22 m between directly opposing windows at first floor level,2.4,Y,"2.4 m (national, stop control); 3.0 m (regional/local stop); 4.5 m (yield); 2.0 m (lightly trafficked single residence)",,,Provisions for electric vehicle charging points shall be made in housing developments in excess of 10 units; and all commercial and industrial development that facilitate car parking (3.9). S.I. No. 3,,,Has the proposal identified how the requirement of Part V (if applicable) is addressed in a manner that best suits social and community needs and how the demand for affordable housing in the area will,15.0,,At least 15% of total site area shall be allocated for public open space. Public amenity areas shall be capable of passive supervision and shall provide a safe area for play. Pedestrian and cycle link,,,,,,Refer to relevant settlement plan (Volume 2); no fixed table in DM Standards volume,50.0,,Consideration can be given to building ancillary accommodation as an extension to an existing house where it can be shown that such is required for a family member. Proposals for such development will,,,
Waterford City & County Council,waterford_city_and_county_council,,,,,,It is a policy of the Council to avoid the creation of any additional access point from new development or the generation of increased traffic from existing accesses to national roads to which speed l,25.0,Y,Preferably not less than 25 m from public-road boundary (specified protected routes); in any event not less than 18 m,18.0,,General set-back 18 m from road fence on all County roads,22.0,,22 m between directly opposing above-ground-floor windows (reciprocal overlooking),4.5,Y,4.5 m (housing estates/commercial/industrial) or 2.4 m (single dwellings),10.0,,Residential multi-unit developments (new buildings and major renovations): A minimum of 1 EV charge point space per five car parking spaces (ducting for every parking space shall also be provided). No,10.0,Y,A recent significant change to Part V arrangements under the Affordable Housing Act 2021 is to increase the Part V contribution for new housing developments from up to 10% for social housing to a mand,15.0,Y,"Public open space should be provided at a minimum rate of 15% of total site area, save in developments where increased building heights and densities are considered appropriate such as those specified",75.0,,Shall not normally exceed 75%,,,"Criteria-based, location-dependent (Section 3.2); fixed dwellings/ha figures carried in Volume 1 Core Strategy / Table 3.2",,,"The creation of an ancillary, subsidiary, dwelling unit ('granny flat') to be occupied for habitable purposes, is generally acceptable, provided such proposals can demonstrate that: It is not a separa",,,Dwellings which give rise to or exacerbate an existing pattern of ribbon development shall generally not be permitted. Ribbon development is defined as where 5 or more houses exist on any one side of 
Westmeath County Council,westmeath_county_council,,,,,,,,,,,,,22.0,Y,22 m separation between opposing rear first-floor windows; ground-floor window not less than 1 m from boundary (CPO 16.14),,,"Safe unobstructed sight distances should be provided and maintained thereafter from vehicular entrances onto the road network as follows: Local Roads: 90 metres, (subject to the discretion of the Plan",10.0,,All developments should provide facilities for the charging of battery-operated cars at a rate of up to 10% of the total car parking spaces. The remainder of the parking spaces should be constructed s,,,,15.0,,"In general, 15% of gross site area should be provided for multifunctional open spaces at suitable locations within new residential schemes. These open spaces should be easily accessible to all residen",,,,,,Site-by-site; higher densities encouraged at accessible locations; no fixed countywide uph table,,,Dependent Relative Accommodation/Granny Flats: Proposals for this type of accommodation should demonstrate: A bona-fide need for such a unit; A physical connection to the main house with direct access,,,
Wexford County Council,wexford_county_council,2000,Y,0.2 ha (<100 m² & 100-200 m²); 0.4 ha (>200-300 m²); 1.0 ha (>300 m²) per Table 3-3,,,,,,,,,,22.0,,Minimum 22 m between opposing first-floor windows at rear; 22 m between dwellings and schools/childcare,3.0,Y,measured 3 m back from edge of public road (2 m for a single dwelling access) [Section 6],20.0,,"Developments with Private Car Spaces (residential, incl. visitor): (a) All residential off street parking space should be equipped with one fully functional EV charging point. (b) All on street parkin",,,,10.0,,New developments on greenfield sites will be required to provide a minimum of 10% open space [enterprise/employment developments]. Developments on brownfield/infill sites should make provision for ext,,,,50,,typically 30-50 units per hectare,,,The provision of a self-contained residential unit for a family member will be considered subject to compliance with the following standards: ... The unit must be attached to the main dwelling house a,,,The development should not result in ribbon development as defined in Volume 1 Chapter 4 Sustainable Housing. (3.1.2)
Wicklow County Council,wicklow_county_council,,,,100.0,Y,100 m (all development); 20 m (employment development) — Motorway & National Road [Table 2.5],40.0,Y,40 m (all development); 20 m (employment development) — Rural Regional [Table 2.5],20.0,Y,20 m (Rural Local Roads); 10 m (Arterial Road); 6 m (Link Road); Urban Local = min for footpaths/buffer [Table 2.5],22.0,Y,22 m above ground level between directly opposing windows; 0.9 m minimum in defined circumstances,,,,,,Table 2.2 - Car Charging Point Provision: New non-residential buildings and buildings undergoing major renovation with more than 10 parking spaces within property boundary — Installation of at least 1,,,,15.0,Y,Public open space will normally be required at a rate of 15% of the site area — areas within the site that are not suitable for development or for recreational use must be excluded before the calculat,,,,50,Y,Min 50 uph within 500 m of larger town centres; 35-50 dph medium towns; 40+ uph higher-order; <30 dph smaller/rural,45.0,,"A 'granny flat' or 'independent living unit' ... The unit is modest in size and in particular, it shall not exceed 45sqm and shall not have more than 1 bedroom; The unit shall not be sold or let as an",,,
